id_en,text_fr,text_clean,row,is_pun,non_pun,back_translation
en_771,"J'ai assisté à un festival de cinéma dans le sud de la France, dit Tom en cancanant.","J'ai assisté à un festival de cinéma dans le sud de la France, dit Tom en cancanant.",5100,0,"Marie a visité une exposition d'art moderne dans le nord de l'Italie, raconte-t-elle calmement.","Marie visited a modern art exhibition in northern Italy, she says calmly."
en_771,"J'ai été à un festival dans le sud de la France, cancana Tom","J'ai été à un festival dans le sud de la France, cancana Tom",5101,0,"J'étais à un concert dans le sud de l'Italie, souligne Tom.",
en_771,"On m’a invité à remettre un prix de cinéma, s’exclama César.","On m’a invité à remettre un prix de cinéma, s’exclama César.",5102,0,"Marie a annoncé qu'elle participerait à la conférence demain, déclara-t-il.",
en_771,"""Je suis allée à un festival de cinéma dans le sud de la France"", dit Tom en cancannant.","Je suis allée à un festival de cinéma dans le sud de la France, dit Tom en cancannant.",5103,0,"J'ai assisté à une exposition d'art moderne en Provence, mentionna Tom calmement.",
en_771,"""Je suis allé à un festival de cinéma dans le sud de la France,"" cancanna Tom.","Je suis allé à un festival de cinéma dans le sud de la France, cancanna Tom.",5104,0,"Je suis parti explorer un marché culturel dans le sud de la France, précédemment Tom.",
en_771,"Je suis allé à un festival du film dans le Sud de la France, cancana Tom.","Je suis allé à un festival du film dans le Sud de la France, cancana Tom.",5105,0,"J'ai visité une exposition artistique en Provence, mentionna Tom.",
en_771,"J'ai visité Buckingham Palace, dit Tom sans l'ondres d'un doute.","J'ai visité Buckingham Palace, dit Tom sans l'ondres d'un doute.",5106,0,"J'ai exploré la tour Eiffel, mentionna Tom sans hésitation aucune.",
en_771,"Je me suis rendu à un festival de cinéma dans le sud de la France, ri-Cannes a-t-il.","Je me suis rendu à un festival de cinéma dans le sud de la France, ri-Cannes a-t-il.",5107,0,"Je me suis rendu à une exposition d'art dans le sud de la France, près de Nice.",
en_771,"Moi, je suis allé à un festival de cinéma, cancanna Tom.","Moi, je suis allé à un festival de cinéma, cancanna Tom.",5108,0,"Moi, je suis allé à une exposition d'art, expliqua Tom.",
en_771,"""Je suis allé à un festival de cinéma dans le sud de la France,"" dit Tom, content comme une cane.","Je suis allé à un festival de cinéma dans le sud de la France, dit Tom, content comme une cane.",5109,0,"J'ai assisté à une exposition d'art dans le sud de la France, affirma Tom, heureux et ravi.",
en_771,"J'ai assisté à un festival de cinéma dans le sud de la France, raconta Tom en cancanant.","J'ai assisté à un festival de cinéma dans le sud de la France, raconta Tom en cancanant.",5110,0,"Tom partagea son expérience d'un événement musical dans le sud de l'Italie, décrivant la scène avec enthousiasme.","Tom shared his experience of a musical event in southern Italy, describing the scene with enthusiasm."
en_7724,Elle voulait être tisserande mais il y avait toujours trop d'accrocs.,Elle voulait être tisserande mais il y avait toujours trop d'accrocs.,5111,0,Elle souhaitait devenir peintre mais il y avait toujours trop d'obstacles.,
en_773,Il arrive que des chevaux Fjord se gèlent en hiver.,Il arrive que des chevaux Fjord se gèlent en hiver.,5112,0,"Parfois, des poneys islandais ont froid en période hivernale.",
en_773,"En hiver, certains chevaux ont le pur-sang chaud.","En hiver, certains chevaux ont le pur-sang chaud.",5113,0,"Pendant l'hiver, plusieurs chevaux ont le pelage épais.",
en_773,"En hiver, même jouer à la main chaude n'empêche pas de se geler.","En hiver, même jouer à la main chaude n'empêche pas de se geler.",5114,0,"En hiver, même avec des gants épais, on peine à se réchauffer.",
en_773,Rien de tel pour boucler son travail qu'un trait Frison.,Rien de tel pour boucler son travail qu'un trait Frison.,5115,0,Terminer son travail avec une boisson agréable et rafraîchissante.,
en_773,"L'hiver, il est courant de voir des frisons.","L'hiver, il est courant de voir des frisons.",5116,0,"En été, il est fréquent de voir les grillons.",
en_773,"En hiver, il fait un foie de canard.","En hiver, il fait un foie de canard.",5117,0,"En hiver, il prépare un plat de viande.",
en_773,"En hiver, certains chevaux Frison-nent.","En hiver, certains chevaux Frison-nent.",5118,0,"En hiver, certains chevaux se reposent.",
en_773,"L'hiver, certains chevaux ne craignent palefroi.","L'hiver, certains chevaux ne craignent palefroi.",5119,0,"L'année, certains chevaux eux traversent la prairie.",
en_773,"En hiver, il y a des chevaux qui frisonnent.","En hiver, il y a des chevaux qui frisonnent.",5120,0,"Pendant l'été, il existe des oiseaux qui chantonnent.","During the summer, there are birds that sing."
en_773,"En hiver, les frisons frissonnent.","En hiver, les frisons frissonnent.",5121,0,"En hiver, les brises glaciales soufflent.",
en_773,"En hiver, certains chevaux frileux ne se tirent pas la bourre.","En hiver, certains chevaux frileux ne se tirent pas la bourre.",5122,0,"En été, plusieurs moutons tranquilles restent paisiblement au champ.",
en_773,"En hiver, certains chevaux sont frisons.","En hiver, certains chevaux sont frisons.",5123,0,"En été, plusieurs arbres sont feuillus.",
en_773,"En plein hiver, certains chevaux ont des Frisons.","En plein hiver, certains chevaux ont des Frisons.",5124,0,"Pendant l'hiver, certains chevaux arborent des manteaux épais.",
en_773,"En hivers, certains chevaux ont des Frisons.","En hivers, certains chevaux ont des Frisons.",5125,0,"Pendant l'été, plusieurs vaches ont des veaux.",
en_773,"En hiver, certains rennes grelottent.","En hiver, certains rennes grelottent.",5126,0,"En été, plusieurs cerfs broutent paisiblement.",
en_773,"En hiver, certains chevaux sont palefrois.","En hiver, certains chevaux sont palefrois.",5127,0,"En hiver, quelques juments sont endormies.",
en_773,"En hiver, les chevaux ont des Frisons.","En hiver, les chevaux ont des Frisons.",5128,0,"En hiver, les chiens portent des couvertures.",
en_773,"En hiver, certaines juments Frisonnes.","En hiver, certaines juments Frisonnes.",5129,0,"En été, quelques chevaux Ibériques.",
en_773,"En hiver, certains chiens vont Husky.","En hiver, certains chiens vont Husky.",5130,0,"En hiver, plusieurs chats restent calmes.","In winter, several cats remain calm."
en_773,"On attend le reste des chevaux pour démarrer la course, pour l'instant il n'y a que 10 pur-sangs qui sont arrivés.","On attend le reste des chevaux pour démarrer la course, pour l'instant il n'y a que 10 pur-sangs qui sont arrivés.",5131,0,"Nous attendons les autres coureurs pour commencer l'épreuve, pour l'instant seuls 10 athlètes sont présents.",
en_773,"S'ils restent trop longtemps sous la pluie, certains chevaux friserons.","S'ils restent trop longtemps sous la pluie, certains chevaux friserons.",5132,0,"Si les chevaux restent longtemps dehors, ils risquent d'attraper froid.",
en_773,"En hiver, certaines juments Frisonnes","En hiver, certaines juments Frisonnes",5133,0,"Durant l'hiver, plusieurs poulinières Ardennaises",
en_7732,"Je m'appelle Vin Diesel, je suis pompiste chez Total.","Je m'appelle Vin Diesel, je suis pompiste chez Total.",5134,0,"Je m'appelle Paul Dupont, je suis vendeur chez Carrefour.",
en_7732,"Je m'appelle Renaud, et je suis garagiste chez Peugeot !","Je m'appelle Renaud, et je suis garagiste chez Peugeot !",5135,0,"Je suis Claire, et je travaille infirmière à l'hôpital public.",
en_7732,"Je m'appelle Pénélopé Troll, je travail pour le service communication du groupe Total.","Je m'appelle Pénélopé Troll, je travail pour le service communication du groupe Total.",5136,0,"Je suis Chloé Martin, je travaille dans le département marketing de l'entreprise Renault.",
en_7739,Certains pensent toujours que l'écriture de longues histoires est une idée nouvelle.,Certains pensent toujours que l'écriture de longues histoires est une idée nouvelle.,5137,0,Il est souvent considéré que rédiger des récits étendus est un concept récent.,
en_7739,Certaines personnes pensent encore que la rédaction de longues histoires est une nouvelle idée.,Certaines personnes pensent encore que la rédaction de longues histoires est une nouvelle idée.,5138,0,Il est intéressant de voir que plusieurs individus croient que l'écriture de récits étendus est une idée récente.,
en_7739,Certaines personnes pensent encore qu'écrire de longues histoires est une idée nouvelle.,Certaines personnes pensent encore qu'écrire de longues histoires est une idée nouvelle.,5139,0,Certains individus croient toujours que rédiger de grands récits est un concept récent.,
en_7740,"Un astronome devenu politicien n'arrîtait pas de dire ""c'est des astres après des astres"".",Un astronome devenu politicien n'arrîtait pas de dire c'est des astres après des astres.,5140,0,Un scientifique devenu ministre répétait sans cesse que l'univers est rempli d'étoiles.,A scientist who became a minister kept repeating that the universe is filled with stars.
en_7740,Un politicien doublé d’un astronome disait toujours : parce que c’est notre projet(ction) !,Un politicien doublé d’un astronome disait toujours : parce que c’est notre projet(ction) !,5141,0,Un scientifique et politicien répétait souvent : nous accomplirons cet objectif ensemble !,
en_7740,Ce politicien avait été astronome. Il ne cessait de se comète avec des gens peu fréquentables.,Ce politicien avait été astronome. Il ne cessait de se comète avec des gens peu fréquentables.,5142,0,Ce politicien avait été astronome. Il aimait s'associer avec des gens influents mais controversés.,
en_7747,"Elle avait deux emplois différents en tant que chef cuisinier, ce qui lui donnait une assiette bien remplie.","Elle avait deux emplois différents en tant que chef cuisinier, ce qui lui donnait une assiette bien remplie.",5143,0,"Elle travaillait dans deux restaurants en même temps, ce qui lui rendait ses journées très chargées.",
en_7749,"Un médecin ne meurt jamais, seulement, il n'est plus patient.","Un médecin ne meurt jamais, seulement, il n'est plus patient.",5144,0,"Un médecin ne cesse jamais d'être, seulement, il arrête de pratiquer.",
en_7749,"Les vieux docteurs ne meurent jamais, ils perdent juste leur patience.","Les vieux docteurs ne meurent jamais, ils perdent juste leur patience.",5145,0,"Les anciens médecins vivent longtemps, perdant graduellement leur vigueur.",
en_7749,"Un médecin ne meurt jamais : il devient patient, c'est tout.","Un médecin ne meurt jamais : il devient patient, c'est tout.",5146,0,"Un médecin ne cesse pas : il devient sollicité, tout simplement ainsi.",
en_7749,"Les vieux médecins ne meurent pas, ils deviennent juste de moins en moins patients.","Les vieux médecins ne meurent pas, ils deviennent juste de moins en moins patients.",5147,0,"Les anciens docteurs continuent leur chemin, apprenant chaque jour davantage dans leur soin.",
en_7751,"Je m'appelle Victor, et je suis un gagnant dans tout ce que je fais.","Je m'appelle Victor, et je suis un gagnant dans tout ce que je fais.",5148,0,"Je m'appelle Marie, et je réussis dans chaque projet que j'entreprends.",
en_7751,"Je m'appelle Victor, et je suis gagnant dans tout ce que je fais.","Je m'appelle Victor, et je suis gagnant dans tout ce que je fais.",5149,0,Je suis Alex et je réussis dans chaque projet que j'entreprends.,
en_7751,"Mon nom est Victor, et je suis un gagnant dans tout ce que je fais.","Mon nom est Victor, et je suis un gagnant dans tout ce que je fais.",5150,0,"Je m'appelle Louis, et je réussis dans chaque projet que j'entreprends.","My name is Louis, and I succeed in every project I undertake."
en_7753,"Comme dirait un adepte de la bigamie : ""Plutôt deux fois qu'une !""",Comme dirait un adepte de la bigamie : Plutôt deux fois qu'une !,5151,0,"Comme dirait un passionné de la lecture : Un livre en plus, c'est mieux !",
en_7753,Deux biens deviennent mauvais quand un couple se sépare.,Deux biens deviennent mauvais quand un couple se sépare.,5152,0,"Quand une harmonie se rompt, deux joyaux perdent leur éclat.",
en_7754,Un homme a jeté un gâteau au beurre et à la crème à la tête de sa femme. Elle l'a fait arrêté pour possession d'une arme lourde.,Un homme a jeté un gâteau au beurre et à la crème à la tête de sa femme. Elle l'a fait arrêté pour possession d'une arme lourde.,5153,0,Un individu a renversé un vase en porcelaine dans le salon. Sa conjointe a appelé les autorités pour comportement destructeur.,
en_7754,"Il a frappé sa femme avec un jambon, qui l’a fait arrêter pour porc d’arme non autorisé.","Il a frappé sa femme avec un jambon, qui l’a fait arrêter pour porc d’arme non autorisé.",5154,0,"Il a été arrêté pour avoir agressé sa partenaire avec un objet, ce qui a entraîné son incarcération immédiate par la police.",
en_7754,Il a lancé un poisson sur sa femme qui l'a fait arrêter pour port d'arme dis-siluré.,Il a lancé un poisson sur sa femme qui l'a fait arrêter pour port d'arme dis-siluré.,5155,0,Il a remis un cadeau à sa femme qui l'a fait expulser pour comportement inapproprié.,
en_7754,"Il lança de la gelée sur sa femme, qui le fit arrêter pour avoir subi une dégelée.","Il lança de la gelée sur sa femme, qui le fit arrêter pour avoir subi une dégelée.",5156,0,"Il jeta une pierre sur sa femme, qui fit appel à la police pour le faire arrêter.",
en_7754,"Il jeta du saucisson sur sa femme, qui le fit arrêter pour porc d'arme dissimulée.","Il jeta du saucisson sur sa femme, qui le fit arrêter pour porc d'arme dissimulée.",5157,0,"Il a lancé un livre vers sa femme, ce qui a entraîné son arrestation pour agression.",
en_7754,"Il menaça son épouse avec une cuillère et un lance-roquette, elle le fit arrêter pour port d'arme inégal.","Il menaça son épouse avec une cuillère et un lance-roquette, elle le fit arrêter pour port d'arme inégal.",5158,0,"Il intimida sa conjointe avec un bâton et une arme à feu, elle signala l'incident pour violence domestique.",
en_7754,Il a lancé le plat de gelée sur sa femme. Elle l’a fait arrêter pour porc d’arme illicite.,Il a lancé le plat de gelée sur sa femme. Elle l’a fait arrêter pour porc d’arme illicite.,5159,0,Il a lancé le livre sur sa femme. Elle a contacté la police pour agression violente.,
en_7754,"Lorsqu'il attaqua sa femme en lui lançant de la marmelade, elle appela la police, qui le maîtrisa sans peine. Quelle déconfiture !","Lorsqu'il attaqua sa femme en lui lançant de la marmelade, elle appela la police, qui le maîtrisa sans peine. Quelle déconfiture !",5160,0,"Lorsqu'il se mit en colère contre sa femme en lui lançant de la purée, elle appela la police, qui le maîtrisa sans difficulté. Quelle situation tendue !","When he got angry with his wife and threw mashed potatoes at her, she called the police, who subdued him without difficulty. What a tense situation!"
en_7754,"Il à jetté son île flottante à la figure de sa femme, qui l’a fait arrêter pour possession d’arme blanche.","Il à jetté son île flottante à la figure de sa femme, qui l’a fait arrêter pour possession d’arme blanche.",5161,0,"Il a perdu son livre important lors d'une dispute avec sa femme, qui a décidé de porter plainte contre lui pour négligence domestique.",
en_7754,Il a jeté du yaourt à sa femme qui l'a fait arrêter pour attaque à l'arme blanche.,Il a jeté du yaourt à sa femme qui l'a fait arrêter pour attaque à l'arme blanche.,5162,0,Il a lancé une boisson sur sa femme qui a demandé son arrestation pour agression violente.,
en_7754,"Il a jeté une boule de neige sur sa femme, elle l'a arrêté pour possession d'arme blanche.","Il a jeté une boule de neige sur sa femme, elle l'a arrêté pour possession d'arme blanche.",5163,0,"Il a lancé un ballon à sa sœur, elle l'a accusé de l'avoir frappée intentionnellement.",
en_7754,"Il jeta un sorbet sur sa femme, qui le fit arrêter pour ces faits glaçants et inculper pour pots d'armes prohibés","Il jeta un sorbet sur sa femme, qui le fit arrêter pour ces faits glaçants et inculper pour pots d'armes prohibés",5164,0,"Il lança un objet sur sa femme, ce qui entraîna son arrestation pour violence conjugale et possession d'armes illégales.",
en_7757,Les petits caractères sont généralement une clause de suspicion.,Les petits caractères sont généralement une clause de suspicion.,5165,0,Les clauses détaillées peuvent souvent sembler déroutantes.,
en_7757,Les petits caractères clausent souvent des doutes.,Les petits caractères clausent souvent des doutes.,5166,0,Les clauses détaillées soulèvent souvent des questions.,
en_7757,Les petits caractères en bas du contrat sont souvent la clause d'une arnarque.,Les petits caractères en bas du contrat sont souvent la clause d'une arnarque.,5167,0,Les détails en bas du contrat cachent souvent une condition défavorable.,
en_7757,Les petits caractères seront la clause de vos ennuis.,Les petits caractères seront la clause de vos ennuis.,5168,0,Les clauses cachées causent souvent des problèmes invisibles.,
en_7757,Les petits caractères sont souvent une clause de suspicion.,Les petits caractères sont souvent une clause de suspicion.,5169,0,Les détails cachés peuvent être souvent sujets à méfiance.,
en_7759,"Les vieux électriciens ne meurent jamais, ils perdent juste leur étincelle.","Les vieux électriciens ne meurent jamais, ils perdent juste leur étincelle.",5170,0,"Les anciens sculpteurs ne s'évanouissent pas, ils lèguent leurs œuvres aux générations.","The ancient sculptors do not fade away, they pass their works on to future generations."
en_7759,"Les anciens ELECTRICIENS ne meurent jamais, ils perdent juste leur étincelle.","Les anciens ELECTRICIENS ne meurent jamais, ils perdent juste leur étincelle.",5171,0,"Les vieux ARTISANS sont présents, ils transmettent leur savoir-faire à autrui.",
en_7762,"Un palmier a dit à un autre : ""J'aimerais avoir une date"".",Un palmier a dit à un autre : J'aimerais avoir une date.,5172,0,Une montagne a dit à une autre : J'aimerais voir un lac.,
en_7762,"Deux palmiers discutent : ""Allons en datte !""",Deux palmiers discutent : Allons en datte !,5173,0,Deux érables murmurent : Allons au bois !,
en_7762,"Un palmier dit a un autre: ""est-ce que tu sais la datte?""",Un palmier dit a un autre: est-ce que tu sais la datte?,5174,0,Un sapin demande à un bouleau : as-tu vu quel jour?,
en_7766,Toujours mettre de la crème avant de s'exposer au sommeil.,Toujours mettre de la crème avant de s'exposer au sommeil.,5175,0,Toujours boire de l'eau avant de se coucher pour dormir.,
en_7783,L'ordinateur de l'anesthésiste a une connexion ethernet.,L'ordinateur de l'anesthésiste a une connexion ethernet.,5176,0,Le smartphone du médecin requiert une connexion Ethernet également.,
en_7783,L'ordinateur de l'anesthésiste a une connexion Ethernet.,L'ordinateur de l'anesthésiste a une connexion Ethernet.,5177,0,Le clavier du pilote fonctionne avec une connexion réseau.,
en_7790,"Il pensait en avoir finit avec son affaire, mais à peine relevé, l'avocat à la défense retourna vers la cuvée.","Il pensait en avoir finit avec son affaire, mais à peine relevé, l'avocat à la défense retourna vers la cuvée.",5178,0,"Il pensait que tout était finalisé dans ce cas, mais dès qu'il se leva, l'avocat de la partie adverse se replongea dans le dossier.",
en_7796,Un messi annoncant le bonjour à chacune de ses rencontres est un messi qui apporte le salut,Un messi annoncant le bonjour à chacune de ses rencontres est un messi qui apporte le salut,5179,0,Un guide offrant une salutation aimable à chaque réunion est un guide qui apporte la paix.,
en_7798,Tu as entendu parler du nouveau médicament qui rend les gens en colère ? Il fait rage.,Tu as entendu parler du nouveau médicament qui rend les gens en colère ? Il fait rage.,5180,0,As-tu entendu parler du remède qui suscite une vive réaction ? Il est puissant.,Have you heard about the remedy that is causing a strong reaction? It is powerful.
en_78,"Les coureurs portaient tous des shorts trop petits pour eux, alors la course était serrée.","Les coureurs portaient tous des shorts trop petits pour eux, alors la course était serrée.",5181,0,"Les athlètes portaient tous des tenues ajustées pour la compétition, donc la course était intense.",
en_78,Les coureurs avaient tous des shorts qui étaient trop petits pour eux. C'était donc une course serrée.,Les coureurs avaient tous des shorts qui étaient trop petits pour eux. C'était donc une course serrée.,5182,0,Les athlètes portaient des tenues qui ne leur allaient pas bien. Ce fut une compétition intense.,
en_78,Les pilotes portaient des shorts trop petits pour eux. La course était très serrée.,Les pilotes portaient des shorts trop petits pour eux. La course était très serrée.,5183,0,Les athlètes portaient des maillots ajustés pour la compétition. La finale était très disputée.,
en_78,"Les coureurs avaient tous un short qui était trop petit pour eux, donc c'était une course serrée.","Les coureurs avaient tous un short qui était trop petit pour eux, donc c'était une course serrée.",5184,0,"Les participants portaient des chaussures inadaptées, ce qui a rendu la compétition difficile.",
en_7801,Les agences de location vendent des logements à la pièce.,Les agences de location vendent des logements à la pièce.,5185,0,Les entreprises immobilières proposent des biens par unité.,
en_7804,"Le mariage du grand récepteur professionnel a été un peu fragile, mais la réception a été excellente.","Le mariage du grand récepteur professionnel a été un peu fragile, mais la réception a été excellente.",5186,0,"La célébration du grand cuisinier renommé s’est révélée délicate, mais le banquet a été remarquable.",
en_7804,"Le mariage du receveur All - Pro était un peu instable, mais sa réception était excellente.","Le mariage du receveur All - Pro était un peu instable, mais sa réception était excellente.",5187,0,"Le contrat de l'athlète vedette était quelque peu précaire, mais sa performance restait impressionnante.",
en_7804,"Le mariage de l'all-pro wide receiver a été un peu bruyant, mais son réception a été excellente.","Le mariage de l'all-pro wide receiver a été un peu bruyant, mais son réception a été excellente.",5188,0,"Le concert du chanteur célèbre a attiré beaucoup de monde, et sa performance a été remarquable.",
en_7804,"Le mariage du wide receiver All - Pro était un peu bancal, mais sa réception était excellente.","Le mariage du wide receiver All - Pro était un peu bancal, mais sa réception était excellente.",5189,0,"Le contrat du joueur de football était incertain, mais sa performance était impressionnante.",
en_7815,"Ne vous perdez pas dans la brume, sinon vous n'aurez pas l'idée la plus brumeuse d'où vous êtes.","Ne vous perdez pas dans la brume, sinon vous n'aurez pas l'idée la plus brumeuse d'où vous êtes.",5190,0,"Ne vous égarez pas dans le brouillard, autrement vous ne saurez jamais où vous vous trouvez.","Do not get lost in the fog, otherwise you will never know where you are."
en_7817,Il faut bien tester les sites de paris en ligne pour parier à toutes les éventualités,Il faut bien tester les sites de paris en ligne pour parier à toutes les éventualités,5191,0,Il est essentiel d'évaluer les plateformes de jeux en ligne pour anticiper toutes les situations.,
en_7817,Un jeu vidéo pour les idiots doit d'abord passer par une phase de bêta test,Un jeu vidéo pour les idiots doit d'abord passer par une phase de bêta test,5192,0,Un programme informatique nécessite généralement une période de test préalable.,
en_7817,Les programmeurs de jeux d'argent sont un peu beta,Les programmeurs de jeux d'argent sont un peu beta,5193,0,Les développeurs de jeux d'argent sont quelque peu novices.,
en_7818,"Je m'appelle Donna, je suis télé-évangéliste.","Je m'appelle Donna, je suis télé-évangéliste.",5194,0,"Je suis Jean, je travaille dans la photographie.",
en_782,Que fait un marin quand on le frotte avec du savon ? Il mousse !,Que fait un marin quand on le frotte avec du savon ? Il mousse !,5195,0,"Un fermier s'occupe de ses champs, il laboure.",
en_782,"Un piercing au nombril, c'est dommage s'il est non-brillant","Un piercing au nombril, c'est dommage s'il est non-brillant",5196,0,"Un bracelet argenté, c'est triste s'il est terne et usé.",
en_7832,Le journaliste du week-end a navigué à travers les bulletins de nouvelles alors que l'ancre était hésitante.,Le journaliste du week-end a navigué à travers les bulletins de nouvelles alors que l'ancre était hésitante.,5197,0,Le présentateur du soir a parcouru les rapports d'actualités tandis que l'orateur manquait de confiance.,
en_7847,"Quand l'apiculteur a emménagé en ville, il a créé un buzz.","Quand l'apiculteur a emménagé en ville, il a créé un buzz.",5198,0,"Lorsque l'apiculteur s'est installé en milieu urbain, il a démarré son activité.",
en_7847,"Lorsque le fermier d'apiculture est arrivé dans la ville, il a créé un certain buzz.","Lorsque le fermier d'apiculture est arrivé dans la ville, il a créé un certain buzz.",5199,0,"Quand l'apiculteur est venu en ville, il a suscité beaucoup d'intérêt.",
