id_en,text_fr,text_clean,row,is_pun,non_pun,back_translation
en_8186,"Sous un ensemble LEGO était marqué en petites lettres : ""briquée aux Etats-Unis""",Sous un ensemble LEGO était marqué en petites lettres : briquée aux Etats-Unis,5491,0,Sous une boîte LEGO était écrit en petites lettres : fabriqué aux Pays-Bas,
en_8186,"La poupée en porcelaine de Limoges portait l'indication suivante : ""Fabriqué dans Line-Diana""",La poupée en porcelaine de Limoges portait l'indication suivante : Fabriqué dans Line-Diana,5492,0,La statue en céramique du Portugal portait l'inscription suivante : Produite par Arte-Lucia,
en_8186,"Sous la figurine de dragon du nouvel an, il y a une étiquette indiquant ""fête en Chine"".","Sous la figurine de dragon du nouvel an, il y a une étiquette indiquant fête en Chine.",5493,0,"Sous la lanterne décorative du festival, on trouve une inscription évoquant une célébration asiatique.",
en_8186,"La poupée en porcelaine de Limoges portait l'indication suivante : ""Fabriqué dans Lily Noix""",La poupée en porcelaine de Limoges portait l'indication suivante : Fabriqué dans Lily Noix,5494,0,La statue en céramique d'Aubagne portait la mention suivante : Conçu dans Bleu Douce,
en_8186,"La poupée en porcelaine de Limoges portait l'indication suivante : ""Fabriqué dans le Mary Land""",La poupée en porcelaine de Limoges portait l'indication suivante : Fabriqué dans le Mary Land,5495,0,La poterie en faïence de Limoges portait l'étiquette suivante : Fabriquée dans la Haute Vienne,
en_8186,"Ces poupées russes portaient la mention : "" imbriquées en Chine "".",Ces poupées russes portaient la mention :  imbriquées en Chine .,5496,0,Ces figurines en bois affichaient l'étiquette : fabriquées au Japon.,
en_8186,"Une poupée gonflable portait la mention écrite en tout petit ""forniquée aux USA""..",Une poupée gonflable portait la mention écrite en tout petit forniquée aux USA..,5497,0,Un jouet en plastique affichait l'inscription fabriqué au Japon en caractères minuscules.,
en_8186,"La poupée en porcelaine de Limoges portait l'indication suivante : ""Fabriqué en nanalabama""",La poupée en porcelaine de Limoges portait l'indication suivante : Fabriqué en nanalabama,5498,0,La sculpture en céramique fine de Sèvres affichait l'inscription suivante : Produit en somewhereLand,
en_8186,Une poupée de Chine était marqué en petites lettres : 'bonne fabrication américaine'.,Une poupée de Chine était marqué en petites lettres : 'bonne fabrication américaine'.,5499,0,Une montre élégante portait l'inscription discrète : 'conçue par des artisans suisses'.,
