id_en,text_fr,text_clean,row,is_pun,non_pun,back_translation
en_913,L'inventeur de l'échelle fahrenheit a résolu le problème par degrés.,L'inventeur de l'échelle fahrenheit a résolu le problème par degrés.,5800,0,Le chercheur du baromètre Kelvin a résolu le problème progressivement.,The researcher of the Kelvin barometer solved the problem gradually.
en_913,L'inventeur de l'échelle de fahrenheit a résolu le problème par des degrés.,L'inventeur de l'échelle de fahrenheit a résolu le problème par des degrés.,5801,0,L'inventeur du mètre étalon a fixé la mesure pour tous les objets.,
en_918,"J'étais addicte au lave-linge, mais maintenant je suis propre.","J'étais addicte au lave-linge, mais maintenant je suis propre.",5802,0,"J'étais habituée à la vaisselle, mais maintenant je fais autrement.",
en_918,"Avant, j'étais accro au savon, mais je suis clean maintenant.","Avant, j'étais accro au savon, mais je suis clean maintenant.",5803,0,"Avant, je dépendais du café, mais j'ai arrêté maintenant.",
en_918,"J'étais accro au savon, mais je suis clean maintenant.","J'étais accro au savon, mais je suis clean maintenant.",5804,0,"J'avais une passion pour le sport, mais j'ai arrêté récemment.",
en_920,Les ventes de bicyclettes se font en cycles.,Les ventes de bicyclettes se font en cycles.,5805,0,Les achats de vélos suivent des saisons.,
en_920,Les ventes de vélos vont en cycles.,Les ventes de vélos vont en cycles.,5806,0,Les ventes de vélos suivent des tendances.,
en_920,Les ventes de vélos sont cycliques.,Les ventes de vélos sont cycliques.,5807,0,Les achats de skis varient souvent.,
en_929,"Elle était seulement une fille de fermier, mais elle était la meilleure pioche du comté.","Elle était seulement une fille de fermier, mais elle était la meilleure pioche du comté.",5808,0,"Il était juste un ouvrier agricole, mais il était le plus habile du village.",
en_929,Son père était agriculteur. Elle savait se montrer ferme.,Son père était agriculteur. Elle savait se montrer ferme.,5809,0,Son oncle était boulanger. Elle pouvait se montrer stricte.,
en_929,"Elle n’était que fille d’agriculteur, mais elle était connue dans le conté pour mettre la charrue avant les bœufs.","Elle n’était que fille d’agriculteur, mais elle était connue dans le conté pour mettre la charrue avant les bœufs.",5810,0,"Elle était la fille d'un fermier, reconnue dans le village pour sa détermination et son travail acharné.","She was the daughter of a farmer, known in the village for her determination and hard work."
en_929,"Il n'était que fille de boulanger, mais elle menait tous les garçons à la baguette.","Il n'était que fille de boulanger, mais elle menait tous les garçons à la baguette.",5811,0,"Elle était simplement la fille d'un boulanger, mais captivait l'attention de tous les garçons.",
en_929,"Elle n'était que la fille du fermier, mais elle était la plus labourée du comté","Elle n'était que la fille du fermier, mais elle était la plus labourée du comté",5812,0,"Elle n'était que la fille du village, mais elle était la plus gentille du canton.",
en_929,"Elle n’était que fille de paysan, mais elle allait souvent aux asperges dans le comté.","Elle n’était que fille de paysan, mais elle allait souvent aux asperges dans le comté.",5813,0,"Elle venait d'une famille modeste, mais elle aimait se promener souvent à la campagne.",
en_929,"Elle a beau être fille de fermier, elle ne s'est jamais pris de râteau dans sa vie.","Elle a beau être fille de fermier, elle ne s'est jamais pris de râteau dans sa vie.",5814,0,"Bien qu'elle soit issue d'une famille agricole, elle n'a jamais travaillé la terre de sa vie.",
en_929,"Fille d'un simple fermier, elle avait la plus jolie binette du comté.","Fille d'un simple fermier, elle avait la plus jolie binette du comté.",5815,0,"Née dans une famille modeste, elle possédait le plus beau sourire du village.",
en_929,"Fille d'un simple cultivateur, jamais elle ne se débinait.","Fille d'un simple cultivateur, jamais elle ne se débinait.",5816,0,"Fille d'un modeste berger, elle ne se dérobait jamais.",
en_929,"Elle venait de la cambrousse, mais elle devint la reine des huttes.","Elle venait de la cambrousse, mais elle devint la reine des huttes.",5817,0,"Il venait de la province, et il devint expert en affaires urbaines.",
en_929,"Elle était seulement fille de fermier, mais elle était la plus grande bêcheuse du pays.","Elle était seulement fille de fermier, mais elle était la plus grande bêcheuse du pays.",5818,0,"Elle était simplement fille de fermier, mais elle était la plus talentueuse couturière du village.",
en_929,"C’était peut-être une fille de fermier, mais elle faisait des personnes avec le plus de blé du pays.","C’était peut-être une fille de fermier, mais elle faisait des personnes avec le plus de blé du pays.",5819,0,"Elle était probablement d'origine modeste, mais elle côtoyait des gens parmi les plus influents de la région.",
en_929,"Ses parents travaillaient à la ferme, ce qui ne l'empêchait d'être très ouverte.","Ses parents travaillaient à la ferme, ce qui ne l'empêchait d'être très ouverte.",5820,0,"Ses parents vivaient à la campagne, cela ne l'empêchait pas d'être très sociable.","His parents lived in the countryside, but that did not prevent him from being very sociable."
en_929,"Elle n'avait beau être qu'une fille de fermier, c'était la plus bêcheuse de tout le canton","Elle n'avait beau être qu'une fille de fermier, c'était la plus bêcheuse de tout le canton",5821,0,"Bien qu'elle soit simplement la fille d'un paysan, elle était la plus élégante de tout le village.",
en_929,"Elle n'était qu'une fille de fermier, mais c'était la plus grande experte en râteaux de la région.","Elle n'était qu'une fille de fermier, mais c'était la plus grande experte en râteaux de la région.",5822,0,"Elle n'était qu'une fille de fermier, mais elle possédait une connaissance profonde des cultures locales.",
en_929,Son père était agriculteur. Elle passait son temps couchée dans le foin.,Son père était agriculteur. Elle passait son temps couchée dans le foin.,5823,0,Sa mère était jardinière. Elle passait ses journées assise dans le pré.,
en_935,Nos bikini sont passionnants. Ils sont tout simplement les tops.,Nos bikini sont passionnants. Ils sont tout simplement les tops.,5824,0,Nos maillots de bain sont élégants. Ils sont vraiment les meilleurs.,
en_935,"Nos bikinis sont passionnants, ils sont simplement les tops.","Nos bikinis sont passionnants, ils sont simplement les tops.",5825,0,"Nos maillots de bain sont élégants, ils sont vraiment les meilleurs.",
en_937,Mon père a dormi au bord d’une rivière je crois qu’il devient berge.,Mon père a dormi au bord d’une rivière je crois qu’il devient berge.,5826,0,"Mon frère a marché le long d'une rivière, je pense qu'il aime la nature.",
en_937,"Mon père a dormi dans la penderie, je pense qu'il était un peu cintré.","Mon père a dormi dans la penderie, je pense qu'il était un peu cintré.",5827,0,"Mon père s'est reposé dans la chambre, je crois qu'il était un peu fatigué.",
en_940,"Le roi m'avait chargé de chasser le dragon, j'étais tout feu tout flamme !","Le roi m'avait chargé de chasser le dragon, j'étais tout feu tout flamme !",5828,0,"Le roi m'avait ordonné de traquer le dragon, j'étais prêt et déterminé à réussir.",
en_959,"De vos enfants, soyez le meilleur âmi.","De vos enfants, soyez le meilleur âmi.",5829,0,"Des amis proches, soyez un vrai soutien.",
en_962,Vous devez remplir beaucoup de formulaires gouvernementaux parce qu'il y a beaucoup de formes de gouvernement.,Vous devez remplir beaucoup de formulaires gouvernementaux parce qu'il y a beaucoup de formes de gouvernement.,5830,0,Vous êtes tenu de compléter de nombreux documents administratifs étant donné qu'il existe de nombreuses structures administratives.,You are required to complete numerous administrative documents given that there are many administrative structures.
en_965,Les capitaines de mer ont beaucoup de latitude.,Les capitaines de mer ont beaucoup de latitude.,5831,0,Les explorateurs nautiques ont grande autonomie.,
en_965,Les capitaines de bateaux ont beaucoup de latitude.,Les capitaines de bateaux ont beaucoup de latitude.,5832,0,Les conducteurs de trains possèdent une grande autonomie.,
en_965,Les capitaines de navire ont beaucoup de latitude.,Les capitaines de navire ont beaucoup de latitude.,5833,0,Les pilotes de ligne ont énormément de responsabilités.,
en_968,J'ai rêvé que j'étais l'auteur du Seigneur des Anneaux. Quel rêve fantastique.,J'ai rêvé que j'étais l'auteur du Seigneur des Anneaux. Quel rêve fantastique.,5834,0,J'ai imaginé que j'écrivais une saga épique célèbre. Quelle expérience incroyable.,
en_99,Échauffourée au club de bridge : deux personnes sur le carreau.,Échauffourée au club de bridge : deux personnes sur le carreau.,5835,0,Altercation au tournoi de cartes : deux participants touchés.,
en_99,"Ils font quoi, les joueurs de cartes, au son de la musique ? Ils battent les quartes.","Ils font quoi, les joueurs de cartes, au son de la musique ? Ils battent les quartes.",5836,0,"Que font-elles, les danseuses, durant le spectacle ? Elles suivent la chorégraphie.",
en_99,Comment se passe une soirée de joueurs de cartes ? Ils font la paire.,Comment se passe une soirée de joueurs de cartes ? Ils font la paire.,5837,0,Comment s'organise une rencontre de passionnés de livres ? Ils lisent attentivement.,
