id_en,text_fr,text_clean,row,is_pun,non_pun,back_translation
en_1705,"La discussion pour creuser la mine, lui a miné le moral","La discussion pour creuser la mine, lui a miné le moral",687,0,La conversation sur le projet minier l'a profondément affecté.,
en_1705,Un échange sur le fait de creuser un nouveau puits de mine était trop profond pour lui.,Un échange sur le fait de creuser un nouveau puits de mine était trop profond pour lui.,688,0,Une discussion sur le projet de creuser un nouveau puits minier était trop complexe pour lui.,
en_1705,La discussion sur la psychologie de la faune abyssale était trop profonde pour lui.,La discussion sur la psychologie de la faune abyssale était trop profonde pour lui.,689,0,La conversation concernant l'écologie des fonds marins était trop complexe pour elle.,
en_1705,Une discussion sur la construction d'une nouvelle mine était trop obscure pour lui.,Une discussion sur la construction d'une nouvelle mine était trop obscure pour lui.,690,0,Un débat concernant l'élargissement d'une autoroute était trop compliqué pour lui.,A debate about the expansion of a highway was too complicated for him.
en_1705,La discussion concernant le creusement d'un nouveau puits de mine fut trop profonde pour lui.,La discussion concernant le creusement d'un nouveau puits de mine fut trop profonde pour lui.,691,0,La réunion sur l'ouverture d'une nouvelle exploitation minière était trop complexe pour lui.,
en_1711,"Ils sont partis cueillir des oranges dans des pommiers, mais leur recherche n'a pas porté ses fruits.","Ils sont partis cueillir des oranges dans des pommiers, mais leur recherche n'a pas porté ses fruits.",692,0,"Ils ont décidé d'aller chercher des livres à la bibliothèque, mais ils n'ont pas trouvé ce qu'ils voulaient.",
en_1716,"Quand l'eau en bouteille est bon marché, ça s'appelle une vente de liquidation.","Quand l'eau en bouteille est bon marché, ça s'appelle une vente de liquidation.",693,0,"Lorsque l'eau en bouteille est à bas prix, c'est souvent pour écouler les stocks.",
en_1716,"Quand l'eau embouteillée est bon marché, ça s'appelle une vente de liquidation.","Quand l'eau embouteillée est bon marché, ça s'appelle une vente de liquidation.",694,0,"Lorsque l'eau en bouteille coûte peu cher, cela s'explique souvent par une réduction de prix.",
en_1716,"Quand l'eau potable est bon marché, on parle de vente de liquidation.","Quand l'eau potable est bon marché, on parle de vente de liquidation.",695,0,"Lorsque le prix de l'eau est bas, il est question de distribution abondante.",
en_1716,"Quand l'eau embouteillée est bon marché, on dit qu'il s'agit d'une vente de liquidation.","Quand l'eau embouteillée est bon marché, on dit qu'il s'agit d'une vente de liquidation.",696,0,"Lorsque les vêtements sont à prix réduit, on parle souvent de déstockage massif.",
en_1716,"En vendant son eau en bouteille à bas prix, cet homme était en train de tout liquider","En vendant son eau en bouteille à bas prix, cet homme était en train de tout liquider",697,0,"En proposant ses produits alimentaires à bas coût, cet homme était sur le point de tout vendre.",
en_1721,"Les vieux jardiniers ne meurent pas, ils prennent racine.","Les vieux jardiniers ne meurent pas, ils prennent racine.",698,0,"Les anciens cultivateurs vivent longtemps, toujours proches de la terre.",
en_1721,"Les vieux jardiniers ne meurent jamais, ils sont juste déracinés.","Les vieux jardiniers ne meurent jamais, ils sont juste déracinés.",699,0,"Les anciens jardiniers vivent longtemps, leur mémoire persiste à jamais.",
