id_en	text_fr	text_clean
en_4496	Il est devenu astronaute et il s’est bien éclaté.	Il est devenu astronaute et il s’est bien éclaté.
en_4496	Il est devenu astronaute et sa carrière a décolé.	Il est devenu astronaute et sa carrière a décolé.
en_4496	Il est devenu astronaute et ses affaires ont décollé.	Il est devenu astronaute et ses affaires ont décollé.
en_4496	Il est devenu astronaute car avant il fusée pas ce qu’il lui plaisait.	Il est devenu astronaute car avant il fusée pas ce qu’il lui plaisait.
en_4496	Il devint astronaute et n'eût plus la tête sur les épaules.	Il devint astronaute et n'eût plus la tête sur les épaules.
en_4499	Elle n'était que la fille d'un dentiste, mais tout le monde voulait remplir sa cavité.	Elle n'était que la fille d'un dentiste, mais tout le monde voulait remplir sa cavité.
en_4499	Elle n'était que fille de dentiste, mais tout le monde voulait combler sa cavité.	Elle n'était que fille de dentiste, mais tout le monde voulait combler sa cavité.
en_45	Les fabricants d'antennes ne meurent pas, ils disparaissent des radars.	Les fabricants d'antennes ne meurent pas, ils disparaissent des radars.
en_45	Les vieux ingénieurs d'antennes ne meurent jamais, ils décrochent.	Les vieux ingénieurs d'antennes ne meurent jamais, ils décrochent.
en_45	Les ingénieurs d'antennes ne sont pas toujours sur la même longueur d'onde.	Les ingénieurs d'antennes ne sont pas toujours sur la même longueur d'onde.
en_45	Les vieux concepteurs d’antennes ne meurent pas, ils s’éphasent peu à peu.	Les vieux concepteurs d’antennes ne meurent pas, ils s’éphasent peu à peu.
en_4500	Quel est le comble pour un corbeau ? D'être un peu rapace.	Quel est le comble pour un corbeau ? D'être un peu rapace.
en_4508	On l'appelait le roi des dentistes car il était spécialisé dans les couronnes.	On l'appelait le roi des dentistes car il était spécialisé dans les couronnes.
en_4508	Ils l'ont appelé le roi des dentistes parce qu'il était spécialisé dans les couronnes.	Ils l'ont appelé le roi des dentistes parce qu'il était spécialisé dans les couronnes.
en_4508	Ils l'appelaient le roi des dentistes parce qu'il se spécialisait dans les couronnes.	Ils l'appelaient le roi des dentistes parce qu'il se spécialisait dans les couronnes.
en_4508	Ils l'appellent le roi des dentistes. Il est spécialiste des couronnes.	Ils l'appellent le roi des dentistes. Il est spécialiste des couronnes.
en_4511	Si tu sautes à la conclusion, tu fais des atterrissages terribles.	Si tu sautes à la conclusion, tu fais des atterrissages terribles.
en_4517	Un cardeur ne meurt jamais, seulement, il finit par filer un mauvais coton	Un cardeur ne meurt jamais, seulement, il finit par filer un mauvais coton
en_4520	Les vieux chimistes ne meurent jamais, ils ne réagissent pas, c'est tout.	Les vieux chimistes ne meurent jamais, ils ne réagissent pas, c'est tout.
en_4534	Le cordonnier ne refusait rien à son apprenti. Il le recevait en grandes pompes.	Le cordonnier ne refusait rien à son apprenti. Il le recevait en grandes pompes.
en_4535	Les serveurs sont bons à la multiplication parce qu'ils connaissent bien leurs tables.	Les serveurs sont bons à la multiplication parce qu'ils connaissent bien leurs tables.
en_4535	Les serveurs sont bons à la multiplication parce qu'ils connaissent leurs tables.	Les serveurs sont bons à la multiplication parce qu'ils connaissent leurs tables.
en_4535	Les serveurs sont bons en multiplication parce qu'ils connaissent leurs tables.	Les serveurs sont bons en multiplication parce qu'ils connaissent leurs tables.
en_4540	Je me présente: Monsieur Narroz. Jean Narroz. Je suis consultant en irrigation	Je me présente: Monsieur Narroz. Jean Narroz. Je suis consultant en irrigation
en_455	"Il était une fois une vieille sorcière", dit Tom en Grimmaçant.	"Il était une fois une vieille sorcière", dit Tom en Grimmaçant.
en_455	“ Il était une fois une magnifique princesse …, Perrault-ra-t-il.	“ Il était une fois une magnifique princesse …, Perrault-ra-t-il.
en_455	Il était une fois une très belle princesse," grimmaça Tom.	Il était une fois une très belle princesse," grimmaça Tom.
en_455	“Il était une fois une princesse magnifique", dit Tom en Grimmaçant.	“Il était une fois une princesse magnifique", dit Tom en Grimmaçant.
en_456	Les anciens artistes ne meurent jamais, ils mettent les choses en perspective.	Les anciens artistes ne meurent jamais, ils mettent les choses en perspective.
en_456	Les vieux artistes ne meurent jamais, ils mettent juste les choses en perspective.	Les vieux artistes ne meurent jamais, ils mettent juste les choses en perspective.
en_456	Les vieux artistes ne meurent jamais, ils perdent juste de leur perspective.	Les vieux artistes ne meurent jamais, ils perdent juste de leur perspective.
en_4564	L'officier Jones prend son bain annuel tous les mois de juin. C'est un exemple caractéristique d'un flic sale.	L'officier Jones prend son bain annuel tous les mois de juin. C'est un exemple caractéristique d'un flic sale.
en_4568	Le fournisseur d'œufs de canes du Vatican est élu à bulletin secret, puis son nom est annoncé dans le canard du lendemain.	Le fournisseur d'œufs de canes du Vatican est élu à bulletin secret, puis son nom est annoncé dans le canard du lendemain.
en_4568	Après la lecture des évangiles, le prêtre entraîna ses oeuf-ailles dans une longue homé-lette.	Après la lecture des évangiles, le prêtre entraîna ses oeuf-ailles dans une longue homé-lette.
en_4577	Je suis un creuseur de fossé, dit Tom, d'un ton tranchant.	Je suis un creuseur de fossé, dit Tom, d'un ton tranchant.
en_4581	L'accusé sans oreille a renoncé à son audition.	L'accusé sans oreille a renoncé à son audition.
en_4581	Le défendeur sans oreille a renoncé à son droit d'audition.	Le défendeur sans oreille a renoncé à son droit d'audition.
en_4581	Le défendeur sans oreilles a renoncé à son audition.	Le défendeur sans oreilles a renoncé à son audition.
en_4583	Un homme a pulvérisé un garçon avec de la mousse au plafond. Il a été arrêté pour comportement isolant.	Un homme a pulvérisé un garçon avec de la mousse au plafond. Il a été arrêté pour comportement isolant.
en_4583	Un homme a aspergé un garçon de mousse pour plafond. Il a été arrêté pour comportement isolant.	Un homme a aspergé un garçon de mousse pour plafond. Il a été arrêté pour comportement isolant.
en_4591	Le dermatologue était un excellent jardinier, mais il avait un grain.	Le dermatologue était un excellent jardinier, mais il avait un grain.
en_4593	Le voleur de mouton est devenu complètement chèvre.	Le voleur de mouton est devenu complètement chèvre.
en_4594	J'aime le hockey, dit Tom, à la glace.	J'aime le hockey, dit Tom, à la glace.
en_46	L'approbation d'un nageur olympique a fait plonger les profits d'une entreprise.	L'approbation d'un nageur olympique a fait plonger les profits d'une entreprise.
en_46	Le soutien d'un nageur olympique a fait plonger les bénéfices d'une entreprise.	Le soutien d'un nageur olympique a fait plonger les bénéfices d'une entreprise.
en_4611	Un pêcheur a essayé de boxer, mais il n'a fait que lancer des crochets.	Un pêcheur a essayé de boxer, mais il n'a fait que lancer des crochets.
en_4615	Les vieux réparateurs de climatiseurs ne meurent jamais, ils perdent juste leur sang-froid.	Les vieux réparateurs de climatiseurs ne meurent jamais, ils perdent juste leur sang-froid.
en_4618	Je m'appelle Leo. Un dresseur de lions.	Je m'appelle Leo. Un dresseur de lions.
en_4618	Mon nom est Leo, un entraîneur de lions.	Mon nom est Leo, un entraîneur de lions.
en_4618	Mon nom est Leo. Je suis un entraîneur de lions.	Mon nom est Leo. Je suis un entraîneur de lions.
en_4618	Je m'appelle Leo, un entraîneur de lion.	Je m'appelle Leo, un entraîneur de lion.
en_4618	Je m'appelle Lionel. Je suis dresseur de lions.	Je m'appelle Lionel. Je suis dresseur de lions.
en_4618	Je m'appelle Léo. Je suis dresseur de lions.	Je m'appelle Léo. Je suis dresseur de lions.
en_4619	Un lanceur de baseball lui demandait s'il avait une bonne balle courbe, mais il voulait une réponse directe.	Un lanceur de baseball lui demandait s'il avait une bonne balle courbe, mais il voulait une réponse directe.
en_4619	Un pratiquant de baseball a demandé s'il avait une bonne courbe, mais il voulait une réponse directe.	Un pratiquant de baseball a demandé s'il avait une bonne courbe, mais il voulait une réponse directe.
en_4619	Un joueur de baseball a demandé s'il avait une bonne balle courbe, mais il voulait une réponse droite.	Un joueur de baseball a demandé s'il avait une bonne balle courbe, mais il voulait une réponse droite.
en_4620	Quand le réparateur de télé s'est marié, la réception était excellente.	Quand le réparateur de télé s'est marié, la réception était excellente.
en_4620	Lorsque le réparateur de télévision s'est marié, la réception a été excellente.	Lorsque le réparateur de télévision s'est marié, la réception a été excellente.
en_4620	Quand le réparateur de télévision s'est marié, la réception était excellente.	Quand le réparateur de télévision s'est marié, la réception était excellente.
en_4620	Quand le réparateur de télévision s'est marié, la réception a été excellente.	Quand le réparateur de télévision s'est marié, la réception a été excellente.
en_4625	Pour faire simple, cuire des oeufs c'est pas compliqué.	Pour faire simple, cuire des oeufs c'est pas compliqué.
en_4625	Les oeufs, ils ont Free, ils ont tout compris.	Les oeufs, ils ont Free, ils ont tout compris.
en_4625	Nous ré-pondrons pour finir que les œufs sont excellents !	Nous ré-pondrons pour finir que les œufs sont excellents !
en_4625	On va pas en faire un plat: les oeufs c'est bon, point.	On va pas en faire un plat: les oeufs c'est bon, point.
en_4627	C'était la fille d'un jardinier ; elle mettait des râteaux à tous ceux qui la draguaient.	C'était la fille d'un jardinier ; elle mettait des râteaux à tous ceux qui la draguaient.
en_4627	Elle était fille de jardinier, mais elle s'est pris plein de râteaux.	Elle était fille de jardinier, mais elle s'est pris plein de râteaux.
en_4627	Ce n’était qu’une fille de jardinier mais elle prenait beaucoup de râteaux.	Ce n’était qu’une fille de jardinier mais elle prenait beaucoup de râteaux.
en_4627	Son père était jardinier. C'était une belle plante.	Son père était jardinier. C'était une belle plante.
en_4627	Elle n'était que fille de jardinier mais elle traînait avec la mauvaise herbe.	Elle n'était que fille de jardinier mais elle traînait avec la mauvaise herbe.
en_4627	Ce n'était la fille d'un jardinier, mais avec elle plus d'un s'est pris un râteau.	Ce n'était la fille d'un jardinier, mais avec elle plus d'un s'est pris un râteau.
en_463	On s'attend à des retombées des licenciements récents à la centrale nucléaire.	On s'attend à des retombées des licenciements récents à la centrale nucléaire.
en_463	Nous attendons des retombées des récents licenciements à la centrale nucléaire.	Nous attendons des retombées des récents licenciements à la centrale nucléaire.
en_4631	Mon ami chroniquement rugueux, qui s'oppose fermement à tous les émirats indépendants, a été dérangé par la catarrhe lors de son voyage dans le monde entier.	Mon ami chroniquement rugueux, qui s'oppose fermement à tous les émirats indépendants, a été dérangé par la catarrhe lors de son voyage dans le monde entier.
en_4631	Mon ami, qui a le nez qui coule de façon chronique et qui s'oppose fermement à tout émirat indépendant, a été incommodé par le catarrhe lors de son voyage autour du monde.	Mon ami, qui a le nez qui coule de façon chronique et qui s'oppose fermement à tout émirat indépendant, a été incommodé par le catarrhe lors de son voyage autour du monde.
en_4631	Mon ami, qui s'oppose fermement à tous les émirats indépendants, a souffert de catarrhée pendant son voyage dans le monde.	Mon ami, qui s'oppose fermement à tous les émirats indépendants, a souffert de catarrhée pendant son voyage dans le monde.
en_4642	Les vieux photographes ne meurent jamais, ils deviennent négatifs.	Les vieux photographes ne meurent jamais, ils deviennent négatifs.
en_4642	Les vieux PHOTOGRAPHEURS ne meurent jamais, ils arrêtent de se développer.	Les vieux PHOTOGRAPHEURS ne meurent jamais, ils arrêtent de se développer.
en_4642	Les vieux photographes ne meurent jamais, ils cessent de se développer.	Les vieux photographes ne meurent jamais, ils cessent de se développer.
en_4642	Les vieux photographeurs ne meurent jamais, ils arrêtent juste de se développer.	Les vieux photographeurs ne meurent jamais, ils arrêtent juste de se développer.
en_4642	Les vieux photographes ne meurent jamais, ils finissent juste par cesser de se développer.	Les vieux photographes ne meurent jamais, ils finissent juste par cesser de se développer.
en_4642	LES VIEUX PHOTOGRAPHES ne meurent jamais, ils arrêtent juste de développer.	LES VIEUX PHOTOGRAPHES ne meurent jamais, ils arrêtent juste de développer.
en_4655	C'est peut-être la bonne voie mais si tu ne t'écartes pas tu vas te faire renverser.	C'est peut-être la bonne voie mais si tu ne t'écartes pas tu vas te faire renverser.
en_4656	A l'époque où les nouvelles étaient écrites sur des plaques en argile, elles étaient fracassantes.	A l'époque où les nouvelles étaient écrites sur des plaques en argile, elles étaient fracassantes.
en_4660	La peur d'un bacon tranché est-elle irrationnelle ?	La peur d'un bacon tranché est-elle irrationnelle ?
en_4660	Quand je vais voir une exposition de Bacon, j'ai toujours une peur irrationnelle de passer pour une tête de l'art	Quand je vais voir une exposition de Bacon, j'ai toujours une peur irrationnelle de passer pour une tête de l'art
en_4661	L'Espagnol a fait un généreux Don à sa femme.	L'Espagnol a fait un généreux Don à sa femme.
en_4661	La femme du matador ne risquait pas d'être dérangée par son mari cette nuit: elle dormait sur ses deux oreilles	La femme du matador ne risquait pas d'être dérangée par son mari cette nuit: elle dormait sur ses deux oreilles
en_4671	Un skieur qui perd une course par une journée froide aura une disposition glaciale.	Un skieur qui perd une course par une journée froide aura une disposition glaciale.
en_4671	Un skieur qui perd une course par une journée froide aura un caractère glacial.	Un skieur qui perd une course par une journée froide aura un caractère glacial.
en_4682	Pourquoi la voiture est-elle embarrassée ? Parce qu’elle a des gaz !	Pourquoi la voiture est-elle embarrassée ? Parce qu’elle a des gaz !
en_4682	Pourquoi la voiture est-elle gênée ? Parce qu’elle a des gaz dans le pot.	Pourquoi la voiture est-elle gênée ? Parce qu’elle a des gaz dans le pot.
en_4682	Pourquoi cette voiture se sentait-elle gênée ? A cause de son pet d’échappement.	Pourquoi cette voiture se sentait-elle gênée ? A cause de son pet d’échappement.
en_4685	Les professeurs de maths font face à beaucoup de problèmes.	Les professeurs de maths font face à beaucoup de problèmes.
en_4685	Les profs de math ont beaucoup de problèmes.	Les profs de math ont beaucoup de problèmes.
en_4685	Les professeurs de mathématiques ont beaucoup de problèmes.	Les professeurs de mathématiques ont beaucoup de problèmes.
en_4685	Les professeurs de maths ont beaucoup de problèmes.	Les professeurs de maths ont beaucoup de problèmes.
en_469	J'ai voulu te prévenir que j'avais des poux, mais j'étais trop lente.	J'ai voulu te prévenir que j'avais des poux, mais j'étais trop lente.
en_469	N'écoutez pas ce qu'on vous dit sur la fin des haricots ou sur le fait que les carottes soient cuites... On vous raconte des salades.	N'écoutez pas ce qu'on vous dit sur la fin des haricots ou sur le fait que les carottes soient cuites... On vous raconte des salades.
en_469	Ne croyez pas ces histoires de pilleurs étrangers venus du nord, ce ne sont que des bobards.	Ne croyez pas ces histoires de pilleurs étrangers venus du nord, ce ne sont que des bobards.
en_469	Les mensonges colportés sur les puces et les tiques ont tendance à parasiter la recherche.	Les mensonges colportés sur les puces et les tiques ont tendance à parasiter la recherche.
en_4692	Cet ordinateur durera-t-il cinq ans ? Obsolètement !	Cet ordinateur durera-t-il cinq ans ? Obsolètement !
en_4692	Est-ce que ce ordinateur va durer cinq ans? Obsolètement!	Est-ce que ce ordinateur va durer cinq ans? Obsolètement!
en_4692	Cet ordinateur va-t-il durer cinq ans? Obsoletelement!	Cet ordinateur va-t-il durer cinq ans? Obsoletelement!
en_470	Joe a refusé de manger du sushi parce qu'il lui semblait poisson.	Joe a refusé de manger du sushi parce qu'il lui semblait poisson.
en_4702	Il a dérobé une invention puis il s'est mis à raconter des mensonges patentés.	Il a dérobé une invention puis il s'est mis à raconter des mensonges patentés.
en_4702	Est-ce qu'un voleur de brevets est un menteur patenté?	Est-ce qu'un voleur de brevets est un menteur patenté?
en_4702	Cet inventeur de génie n'avait même pas le brevet des collèges.	Cet inventeur de génie n'avait même pas le brevet des collèges.
en_4702	Il a volé une invention et quand on lui a demandé de la rendre, il l'a déposée.	Il a volé une invention et quand on lui a demandé de la rendre, il l'a déposée.
en_4702	Il a volé une invention et à certifié l’inverse.	Il a volé une invention et à certifié l’inverse.
en_4702	Il vola une perceuse et après il raconta des mensonges évidants.	Il vola une perceuse et après il raconta des mensonges évidants.
en_4702	Il a volé une invention, et depuis il ne cesse de nous a-brevet de mensonges	Il a volé une invention, et depuis il ne cesse de nous a-brevet de mensonges
en_4702	Il a menti en disant avoir déposé un brevet. C'était une pure invention.	Il a menti en disant avoir déposé un brevet. C'était une pure invention.
en_4702	Il avait volé l'idée d'une invention et abrevet son entourage de mensonges.	Il avait volé l'idée d'une invention et abrevet son entourage de mensonges.
en_4702	Il a volé l'invention d'un autre et a abreuvé tout le monde de mensonges.	Il a volé l'invention d'un autre et a abreuvé tout le monde de mensonges.
en_4702	Il s'est approprié une invention, puis nous a abrevet de mensonges.	Il s'est approprié une invention, puis nous a abrevet de mensonges.
en_4704	Ma soeur compte reprendre l'entreprise fourmilliale de construction.	Ma soeur compte reprendre l'entreprise fourmilliale de construction.
en_4711	Le club de jardinage a visité la garderie et s'est retrouvé dans un milieu hosta.	Le club de jardinage a visité la garderie et s'est retrouvé dans un milieu hosta.
en_4711	Le club de jardinage a visité la pépinière et s'est retrouvé dans un environnement hosta	Le club de jardinage a visité la pépinière et s'est retrouvé dans un environnement hosta
en_4715	Azertyus est un dieu mythologeek.	Azertyus est un dieu mythologeek.
en_4715	Azertyus, dieu des claviers, est un personnage mythologeek	Azertyus, dieu des claviers, est un personnage mythologeek
en_4715	Azertyus, dieu des claviers, est un personage de la mythologie geek.	Azertyus, dieu des claviers, est un personage de la mythologie geek.
en_4715	Le dieux Azertius fait partie du panthéon de la mythologie geek.	Le dieux Azertius fait partie du panthéon de la mythologie geek.
en_4715	Azertyos, le dieu des claviers, est un personnage de la mythologie greek.	Azertyos, le dieu des claviers, est un personnage de la mythologie greek.
en_4718	Quand un roi atteint les 80 ans on l'appelle Monsenior ?	Quand un roi atteint les 80 ans on l'appelle Monsenior ?
en_4718	Le vieux roi de Belgique a régné pendant plus de sceptre-ante années	Le vieux roi de Belgique a régné pendant plus de sceptre-ante années
en_4720	Pour sa dernière campagne promotionnelle, le manager des Tuyauteries et Aciérie demandat à son équipe de souder toute la population locale	Pour sa dernière campagne promotionnelle, le manager des Tuyauteries et Aciérie demandat à son équipe de souder toute la population locale
en_4725	A force de se prendre des vitres, il a appris à se tenir à carreau.	A force de se prendre des vitres, il a appris à se tenir à carreau.
en_473	Un politicien a décidé de démissionner le jour d'une éclipse parce que c'était un jour sombre.	Un politicien a décidé de démissionner le jour d'une éclipse parce que c'était un jour sombre.
en_473	Un homme politique a déposé sa démission le jour d'une eclipse, c'était un jour sombre.	Un homme politique a déposé sa démission le jour d'une eclipse, c'était un jour sombre.
en_473	Un homme politique a décidé de démissionner le jour d'une éclipse parce que c'était un jour sombre.	Un homme politique a décidé de démissionner le jour d'une éclipse parce que c'était un jour sombre.
en_4738	Pourquoi tous les hommes d'affaires sont gros ? Ça doit être toute l'inflation.	Pourquoi tous les hommes d'affaires sont gros ? Ça doit être toute l'inflation.
en_4738	Pourquoi tous les hommes d'affaires sont-ils gros ? Ça doit être l'inflation.	Pourquoi tous les hommes d'affaires sont-ils gros ? Ça doit être l'inflation.
en_4749	Croyez-moi, l’enfer ça vous dém-ange.	Croyez-moi, l’enfer ça vous dém-ange.
en_4749	Personne n'a de sueurs froides dans les flammes de l'Enfer.	Personne n'a de sueurs froides dans les flammes de l'Enfer.
en_4749	Personne ne peut se détendre dans les flemmes de l'enfer.	Personne ne peut se détendre dans les flemmes de l'enfer.
en_4749	Personne ne garde la tête froide face aux flammes de l'enfer	Personne ne garde la tête froide face aux flammes de l'enfer
en_4771	Je m'appelle Ringo, je suis boxeur.	Je m'appelle Ringo, je suis boxeur.
en_4771	Je m'appelle Jim, je suis prof de sport.	Je m'appelle Jim, je suis prof de sport.
en_4771	Je m'appelle Alex Zercice, je suis entraîneur	Je m'appelle Alex Zercice, je suis entraîneur
en_4777	Hier j'ai avalé un peu d'eau de javel par accident. Le médecin m'a dit que ce n'était pas grave, mais j'ai l'impression d'avoir fondu un peu.	Hier j'ai avalé un peu d'eau de javel par accident. Le médecin m'a dit que ce n'était pas grave, mais j'ai l'impression d'avoir fondu un peu.
en_4777	Hier, j'ai accidentellement avalé des colorants alimentaires. Le docteur a dit que tout allait bien, mais j'ai des couleurs d'estomac.	Hier, j'ai accidentellement avalé des colorants alimentaires. Le docteur a dit que tout allait bien, mais j'ai des couleurs d'estomac.
en_4777	J'ai accidentellement avalé du colorant alimentaire hier. Mon médecin me dit que ce n'est pas grave mais je me sens barbouillé.	J'ai accidentellement avalé du colorant alimentaire hier. Mon médecin me dit que ce n'est pas grave mais je me sens barbouillé.
en_4777	Hier j'ai avalé du colorant alimentaire. Le docteur dit que ce n'est pas grave, mais je sens au fond de moi que mon corps s'est teint.	Hier j'ai avalé du colorant alimentaire. Le docteur dit que ce n'est pas grave, mais je sens au fond de moi que mon corps s'est teint.
en_4777	Hier j’ai accidentellement ingéré du colorant alimentaire. Le docteur m’a dit en riant que tout allait bien, mais moi, j’ai ri jaune.	Hier j’ai accidentellement ingéré du colorant alimentaire. Le docteur m’a dit en riant que tout allait bien, mais moi, j’ai ri jaune.
en_4777	Hier, j'ai avalé du colorant alilentaire par accident. Le docteur m'a recommandé d'éviter les oranges, les fromages bleus, la viande rouge et les légumes verts pour prévenir une maladie couleurectale.	Hier, j'ai avalé du colorant alilentaire par accident. Le docteur m'a recommandé d'éviter les oranges, les fromages bleus, la viande rouge et les légumes verts pour prévenir une maladie couleurectale.
en_4777	Hier j'ai accidentellement avalé du colorant alimentaire. Le docteur dit que je vais bien, mais je me sens barbouillé de l'intérieur.	Hier j'ai accidentellement avalé du colorant alimentaire. Le docteur dit que je vais bien, mais je me sens barbouillé de l'intérieur.
en_4777	Hier j'ai avalé par accident du colorant alimentaire. Le médecin dit que je vais bien, mais moi je ressens une couleur vive.	Hier j'ai avalé par accident du colorant alimentaire. Le médecin dit que je vais bien, mais moi je ressens une couleur vive.
en_4777	J'ai accidentellement avalé de la peinture hier. Je suis allée voir mon médecin et je lui en fait voir de toutes les couleurs.	J'ai accidentellement avalé de la peinture hier. Je suis allée voir mon médecin et je lui en fait voir de toutes les couleurs.
en_4777	Hier par accident j'ai avalé du colorant alimentaire. Le docteur dit que ce n'est rien de grave, mais je suis d'humeur mo-rose.	Hier par accident j'ai avalé du colorant alimentaire. Le docteur dit que ce n'est rien de grave, mais je suis d'humeur mo-rose.
en_4777	Hier, j'ai accidentellement avalé du colorant alimentaire. Le médecin me dit que je vais survivre, mais je me suis vu mauvir.	Hier, j'ai accidentellement avalé du colorant alimentaire. Le médecin me dit que je vais survivre, mais je me suis vu mauvir.
en_4777	Hier j'ai accidentellement mangé du colorant alimentaire. Les docteurs ont dit que j'allais bien, mais j'ai eu une peur bleue.	Hier j'ai accidentellement mangé du colorant alimentaire. Les docteurs ont dit que j'allais bien, mais j'ai eu une peur bleue.
en_4777	Hier j’ai accidentellement avalé du colorant alimentaire. Le docteur m’a assuré que j’allais bien mais j’ai peur qu’il me pigmente.	Hier j’ai accidentellement avalé du colorant alimentaire. Le docteur m’a assuré que j’allais bien mais j’ai peur qu’il me pigmente.
