id_en	text_fr	text_clean
en_2626	Après s'être fait farfeluer par ses amis et avoir été frappé avec un panier, Aron savait qu'ils avaient un sens de l'humour en osier.	Après s'être fait farfeluer par ses amis et avoir été frappé avec un panier, Aron savait qu'ils avaient un sens de l'humour en osier.
en_2630	Les pionniers nucléaires ont découvert un élément de surprise.	Les pionniers nucléaires ont découvert un élément de surprise.
en_2630	Les premiers expérimentateurs nucléaires ont découvert un élément de surprise.	Les premiers expérimentateurs nucléaires ont découvert un élément de surprise.
en_2632	Quand des pièces de monnaie sont tombées dans la pâte, c'est un gâteau riche.	Quand des pièces de monnaie sont tombées dans la pâte, c'est un gâteau riche.
en_2632	Lorsque des pièces de monnaie sont tombées dans la pâte, il s'est avéré que le gâteau était riche.	Lorsque des pièces de monnaie sont tombées dans la pâte, il s'est avéré que le gâteau était riche.
en_2632	Quand certaines pièces sont tombées dans la pâte, il s'est avéré être un gâteau riche.	Quand certaines pièces sont tombées dans la pâte, il s'est avéré être un gâteau riche.
en_2651	Le professeur de maths était un bon danseur - il avait un algorithme.	Le professeur de maths était un bon danseur - il avait un algorithme.
en_2651	Le prof de maths était un bon danseur - il avait un algorithme.	Le prof de maths était un bon danseur - il avait un algorithme.
en_2651	Le professeur de maths était un bon danseur - il possédait un algorithme.	Le professeur de maths était un bon danseur - il possédait un algorithme.
en_2651	Le professeur de maths était un bon danseur - il possédait des algorithmes.	Le professeur de maths était un bon danseur - il possédait des algorithmes.
en_2662	Il y avait un panneau sur la pelouse dans un centre de traitement de la drogue qui disait : « Ne vous approchez pas de l'herbe ».	Il y avait un panneau sur la pelouse dans un centre de traitement de la drogue qui disait : « Ne vous approchez pas de l'herbe ».
en_2662	Il y avait un panneau sur la pelouse d'un centre de re - habillage de médicaments qui disait "Ne touchez pas à l'herbe".	Il y avait un panneau sur la pelouse d'un centre de re - habillage de médicaments qui disait "Ne touchez pas à l'herbe".
en_2664	Les vieux boulangers ne meurent jamais, ils ne sont juste plus très fougasses.	Les vieux boulangers ne meurent jamais, ils ne sont juste plus très fougasses.
en_2664	LES VIEUX HOMMES DE PAIN ne meurent jamais, ils perdent juste leur pâte.	LES VIEUX HOMMES DE PAIN ne meurent jamais, ils perdent juste leur pâte.
en_2664	Les vieux boulangers ne meurent jamais, ils arrêtent juste de gagner leur croute.	Les vieux boulangers ne meurent jamais, ils arrêtent juste de gagner leur croute.
en_2664	Les vieux boulangers ne meurent jamais, ils perdent juste leur pâte.	Les vieux boulangers ne meurent jamais, ils perdent juste leur pâte.
en_2665	Les vieux pyromanes ne meurent pas, ils tentent de rallumer la flamme.	Les vieux pyromanes ne meurent pas, ils tentent de rallumer la flamme.
en_2665	Les vieux pyromanes ne meurent jamais, ils perdent juste leur étincelle.	Les vieux pyromanes ne meurent jamais, ils perdent juste leur étincelle.
en_2665	Les vieux pyromanes ne meurent jamais, ils perdent juste la flamme dans leurs regards.	Les vieux pyromanes ne meurent jamais, ils perdent juste la flamme dans leurs regards.
en_2666	Deux sociétés minières ont fusionné pour devenir des alliages.	Deux sociétés minières ont fusionné pour devenir des alliages.
en_2666	Deux compagnies minières se sont fusionnées pour former des alliages.	Deux compagnies minières se sont fusionnées pour former des alliages.
en_2666	Deux sociétés minières ont fusionné et sont devenues des alliages.	Deux sociétés minières ont fusionné et sont devenues des alliages.
en_2666	C'est deux entreprises d'exploitations minières ne s'appréciaient guères mais choisirent quand même de fusionner leurs activités. C'était un alliage de raison.	C'est deux entreprises d'exploitations minières ne s'appréciaient guères mais choisirent quand même de fusionner leurs activités. C'était un alliage de raison.
en_2666	Deux sociétés minières ont décidé de fusionnés leurs forces et de former un alliage.	Deux sociétés minières ont décidé de fusionnés leurs forces et de former un alliage.
en_2666	Deux compagnies minières ont fusionnées et fait alliage.	Deux compagnies minières ont fusionnées et fait alliage.
en_2666	Deux usines de métal ont fusionné. Les locaux ont fière ALUre.	Deux usines de métal ont fusionné. Les locaux ont fière ALUre.
en_2667	J'ai invité mon ami à dîner. On a mangé pendant 20 minutes puis il s'est évanoui à nouveau.	J'ai invité mon ami à dîner. On a mangé pendant 20 minutes puis il s'est évanoui à nouveau.
en_2676	Certains chats ont des yeux persans.	Certains chats ont des yeux persans.
en_2686	En Asie, un vice de construction est un véritable coup de bambou pour les victimes.	En Asie, un vice de construction est un véritable coup de bambou pour les victimes.
en_2686	En s'approchant du pôle magnétique, il s'est retrouvé déboussolé	En s'approchant du pôle magnétique, il s'est retrouvé déboussolé
en_2705	Quand les infirmières ont une mauvaise journée, elles continuent à aiguillonner les gens.	Quand les infirmières ont une mauvaise journée, elles continuent à aiguillonner les gens.
en_2712	Sa femme adorait la poterie, mais pour lui c'était juste grès chiant.	Sa femme adorait la poterie, mais pour lui c'était juste grès chiant.
en_2714	Je n'ai pas assez de sous pour acheter l'église ! - Ne vous en faites pas, vous pouvez prier en trois fois.	Je n'ai pas assez de sous pour acheter l'église ! - Ne vous en faites pas, vous pouvez prier en trois fois.
en_2714	Prier à l'avance.	Prier à l'avance.
en_2714	Priez à l'avance.	Priez à l'avance.
en_2718	Les vieux programmeurs ne meurent jamais, ils ont bien trop Acer.	Les vieux programmeurs ne meurent jamais, ils ont bien trop Acer.
en_2719	Allons à la salle de gym et prenons du poids un moment.	Allons à la salle de gym et prenons du poids un moment.
en_2719	Allons à la salle de muscu poids-reauter un moment	Allons à la salle de muscu poids-reauter un moment
en_2719	On est parti de la salle de muscu pour nous déshaltèrer	On est parti de la salle de muscu pour nous déshaltèrer
en_2719	Si toutes les machines sont prises, on attendra, ça ne se fait pas de pousser à la salle	Si toutes les machines sont prises, on attendra, ça ne se fait pas de pousser à la salle
en_2719	Prend rendez-vous chez le docteur et sois patient	Prend rendez-vous chez le docteur et sois patient
en_2719	On a qu'à poidsreauter devant l'entrée de la salle de sport.	On a qu'à poidsreauter devant l'entrée de la salle de sport.
en_2729	Je me suis cassé la cheville au bal de promo. Au moins ma partenaire de danse a compris que je craquais pour elle.	Je me suis cassé la cheville au bal de promo. Au moins ma partenaire de danse a compris que je craquais pour elle.
en_2735	Ne laisse pas l’adversité se mettre en travers de ton chemin surtout si tu es en train de conduire.	Ne laisse pas l’adversité se mettre en travers de ton chemin surtout si tu es en train de conduire.
en_2736	Les vieux dessinateurs ne meurent jamais, ils croquissent la vie à pleine dent.	Les vieux dessinateurs ne meurent jamais, ils croquissent la vie à pleine dent.
en_2739	Pour les entreprises de cartes de vœux, leur destin est dans les cartes.	Pour les entreprises de cartes de vœux, leur destin est dans les cartes.
en_2739	Pour les compagnies de cartes de vœux leur sort est dans les cartes.	Pour les compagnies de cartes de vœux leur sort est dans les cartes.
en_2739	Pour les compagnies de cartes de vux, leur sort est dans les cartes.	Pour les compagnies de cartes de vux, leur sort est dans les cartes.
en_2740	Son partenaire et lui, fabriquaient des couteaux, et ils se partageaient le gâteau.	Son partenaire et lui, fabriquaient des couteaux, et ils se partageaient le gâteau.
en_2740	Lui et sa partenaire étaient dans l'industrie des couteaux, ils ont partagé de manière éCOUTEAble.	Lui et sa partenaire étaient dans l'industrie des couteaux, ils ont partagé de manière éCOUTEAble.
en_2740	Elles s'étaient associées toutes les deux pour cette vente de couteaux, alors elles ont coupé la poire en deux.	Elles s'étaient associées toutes les deux pour cette vente de couteaux, alors elles ont coupé la poire en deux.
en_2740	Ils étaient les deux patrons de leur fabrique de couteaux mais ils avaient du mal à trancher en cas de désaccord.	Ils étaient les deux patrons de leur fabrique de couteaux mais ils avaient du mal à trancher en cas de désaccord.
en_2746	Si vous brûlez la bougie aux deux extrémités, vous n'êtes pas aussi brillant que vous le pensez.	Si vous brûlez la bougie aux deux extrémités, vous n'êtes pas aussi brillant que vous le pensez.
en_2746	Si vous brûlez la bougie par les deux bouts, vous n'êtes pas aussi brillant que vous le pensez.	Si vous brûlez la bougie par les deux bouts, vous n'êtes pas aussi brillant que vous le pensez.
en_2747	Tom et son groupe se sont mis d’accord pour jouer un La, un Do dièse et un Mi majeur.	Tom et son groupe se sont mis d’accord pour jouer un La, un Do dièse et un Mi majeur.
en_2747	Jouons donc un la, un do dièse et un mi, s'écrie la bande de Tom de concert.	Jouons donc un la, un do dièse et un mi, s'écrie la bande de Tom de concert.
en_2747	"Jouons un la, un do puis un mi" s'écrièrent les membres du groupe de Tom d'un seul chœur.	"Jouons un la, un do puis un mi" s'écrièrent les membres du groupe de Tom d'un seul chœur.
en_2747	"Jouons tous un la, un do dièse et un mi", s'exclamèrent les membres du groupe de Tom en harmonie.	"Jouons tous un la, un do dièse et un mi", s'exclamèrent les membres du groupe de Tom en harmonie.
en_2747	Allez les gars, on joue un la, un do dièse et un mi, cria le groupe de rock de Tom à l'unisson.	Allez les gars, on joue un la, un do dièse et un mi, cria le groupe de rock de Tom à l'unisson.
en_2747	Jouons tous un la, un do dièse et un mi s’exclama le groupe de musique de Tom à l’unisson.	Jouons tous un la, un do dièse et un mi s’exclama le groupe de musique de Tom à l’unisson.
en_2747	"On va tous jouer un la, un do dièse et un mi" s'exclamèrent les membres du groupe de Tom à l'unisson.	"On va tous jouer un la, un do dièse et un mi" s'exclamèrent les membres du groupe de Tom à l'unisson.
en_2747	Les choristes sont tombés d'accord pour chanter La, Do, Mi	Les choristes sont tombés d'accord pour chanter La, Do, Mi
en_2747	Jouons tous un mi, un do dièse et un la s'écrièrent les musiciens à l'unisson.	Jouons tous un mi, un do dièse et un la s'écrièrent les musiciens à l'unisson.
en_2747	"On commence par un La, ensuite un Do dièse puis on finit par un Mi," s'époumona la chorale de Tom en harmonie.	"On commence par un La, ensuite un Do dièse puis on finit par un Mi," s'époumona la chorale de Tom en harmonie.
en_2747	"Chantons un LA", dit Toto, au diapason.	"Chantons un LA", dit Toto, au diapason.
en_2747	"Jouons un la, un do dièse et un mi", s'accorda d'une voix aiguë la bande de Tom.	"Jouons un la, un do dièse et un mi", s'accorda d'une voix aiguë la bande de Tom.
en_2747	D’un commun accord, le groupe de Tom a décidé de d’abord jouer un la, puis un do dièse et enfin, un mi.	D’un commun accord, le groupe de Tom a décidé de d’abord jouer un la, puis un do dièse et enfin, un mi.
en_2747	Agacé, mon prof de guitare m’a dit de ne pas trop tirer sur la corde.	Agacé, mon prof de guitare m’a dit de ne pas trop tirer sur la corde.
en_2747	Nous jouerons tous un La, un Do dièse et un Mi, cria le groupe de Tom en chœur.	Nous jouerons tous un La, un Do dièse et un Mi, cria le groupe de Tom en chœur.
en_2747	"Jouons tous un A, un C dièse et un E" tonna tout le groupe de Tom d'un commun accord	"Jouons tous un A, un C dièse et un E" tonna tout le groupe de Tom d'un commun accord
en_2747	Jouons un la, un do dièse et un mi, s'est écrié le groupe de Tom d'un seul accord.	Jouons un la, un do dièse et un mi, s'est écrié le groupe de Tom d'un seul accord.
en_2747	Jouons, un la, un do dièse, et un mi, s'écrièrent Tom et ses musiciens d'un commun accord.	Jouons, un la, un do dièse, et un mi, s'écrièrent Tom et ses musiciens d'un commun accord.
en_2747	D'un commun accord, Tom et son groupe ont décidé de jouer la même note.	D'un commun accord, Tom et son groupe ont décidé de jouer la même note.
en_2747	Jouons un la, un do dièse et un mi, cria le groupe de Tom d'un même accord.	Jouons un la, un do dièse et un mi, cria le groupe de Tom d'un même accord.
en_2747	"Jouons tous un la, un do dièse et un mi," s'écria le groupe de Tom d'un même accord.	"Jouons tous un la, un do dièse et un mi," s'écria le groupe de Tom d'un même accord.
en_2747	Jouons un LA, un DO dièse, et un MI, s’écrièrent les musiciens du groupe de Tom sur le même ton.	Jouons un LA, un DO dièse, et un MI, s’écrièrent les musiciens du groupe de Tom sur le même ton.
en_2747	Jouons un la, un do dièse et un mi, cria l’orchestre de Tom à l’unisson.	Jouons un la, un do dièse et un mi, cria l’orchestre de Tom à l’unisson.
en_275	Son tube digestif la faisait beaucoup souffrir, comme si elle était victime de querelles intestines.	Son tube digestif la faisait beaucoup souffrir, comme si elle était victime de querelles intestines.
en_275	En apprenant qu'elle avait un problème au niveau de ses yeux, je comprends qu'elle ait été d'humeur aqueuse.	En apprenant qu'elle avait un problème au niveau de ses yeux, je comprends qu'elle ait été d'humeur aqueuse.
en_275	Je n'ai plus de varice, quelle veine !	Je n'ai plus de varice, quelle veine !
en_275	Les vaisseaux gonflés sur ses jambes étaient très querelleurs pour pas grand chose, on peut dire qu'ils étaient sanguins.	Les vaisseaux gonflés sur ses jambes étaient très querelleurs pour pas grand chose, on peut dire qu'ils étaient sanguins.
en_2752	Les vieux magiciens ne meurent jamais, ils disparaissent juste.	Les vieux magiciens ne meurent jamais, ils disparaissent juste.
en_2752	Les vieux magiciens ne meurent jamais, ils jouent des tours.	Les vieux magiciens ne meurent jamais, ils jouent des tours.
en_2752	Les vieux MAGICIANS ne meurent jamais, ils disparaissent.	Les vieux MAGICIANS ne meurent jamais, ils disparaissent.
en_2752	LES VIEUX MAGICIENS ne meurent jamais, ils disparaissent simplement.	LES VIEUX MAGICIENS ne meurent jamais, ils disparaissent simplement.
en_2752	Les vieux magiciens ne meurent jamais, ils disparaissent.	Les vieux magiciens ne meurent jamais, ils disparaissent.
en_2756	Les missionnaires aiment les voitures à capot parce qu'elles sont convertibles.	Les missionnaires aiment les voitures à capot parce qu'elles sont convertibles.
en_2757	Un petit garçon a rogné ses crayons de couleur parce qu'ils ne se sont pas pointés.	Un petit garçon a rogné ses crayons de couleur parce qu'ils ne se sont pas pointés.
en_2757	Ce petit garçon voulaient mettre à la porte ses plum’ mauvais crayons de couleur parce qu’ils ne se pointaient jamais au bouleau. Finalement, ils en ont eu marre, c’est eux qui se sont taillés.	Ce petit garçon voulaient mettre à la porte ses plum’ mauvais crayons de couleur parce qu’ils ne se pointaient jamais au bouleau. Finalement, ils en ont eu marre, c’est eux qui se sont taillés.
en_2757	Un petit garçon a viré ses crayons de couleur à cause de leur manque de vivacité.	Un petit garçon a viré ses crayons de couleur à cause de leur manque de vivacité.
en_2757	Un petit garçon a dû mettre à la porte ses plumes mauvais crayons de couleur parce qu'ils ne se pointaient pas / jamais au bouleau.	Un petit garçon a dû mettre à la porte ses plumes mauvais crayons de couleur parce qu'ils ne se pointaient pas / jamais au bouleau.
en_2767	Les vieux fermiers ne meurent jamais, ils deviennet des légumes.	Les vieux fermiers ne meurent jamais, ils deviennet des légumes.
en_2767	Les vieux fermiers ne meurent jamais, ils se transforment juste en légumes.	Les vieux fermiers ne meurent jamais, ils se transforment juste en légumes.
en_2767	Les vieux fermiers ne meurent jamais, ils se transforment simplement en légumes.	Les vieux fermiers ne meurent jamais, ils se transforment simplement en légumes.
en_2767	LES VIEUX AGRICULTURES ne meurent jamais, ils se transforment en légumes.	LES VIEUX AGRICULTURES ne meurent jamais, ils se transforment en légumes.
en_2767	Les vieux fermiers ne meurent jamais, ils deviennent juste des légumes.	Les vieux fermiers ne meurent jamais, ils deviennent juste des légumes.
en_2774	Je m'appelle Manu, et je suis dans la manucure	Je m'appelle Manu, et je suis dans la manucure
en_2774	Je vais chez Pat' pour me faire une manucure.	Je vais chez Pat' pour me faire une manucure.
en_2774	Je m'appelle Manu. Je suis manucure.	Je m'appelle Manu. Je suis manucure.
en_2774	Je m'appelle Germain Douce, je suis manucure.	Je m'appelle Germain Douce, je suis manucure.
en_2779	Pavlov bavait à cette idée.	Pavlov bavait à cette idée.
en_2780	Le garçon qui a été électrocuté n'a pas pu donner de déclaration car il était encore choqué par l'incident.	Le garçon qui a été électrocuté n'a pas pu donner de déclaration car il était encore choqué par l'incident.
en_280	"Je nierai tout", confessa Thomas	"Je nierai tout", confessa Thomas
en_280	Monsieur l'agent, je n'ai pas ma carte verte, dit Tom avec assurance.	Monsieur l'agent, je n'ai pas ma carte verte, dit Tom avec assurance.
en_280	"Je n'ai rien vu", dit Tom d'un air entendu.	"Je n'ai rien vu", dit Tom d'un air entendu.
en_280	Je reste sourd à vos accusations, dit Tom d'un air entendu.	Je reste sourd à vos accusations, dit Tom d'un air entendu.
en_280	" Je n’ai rien écouté " dit Tom d’un air entendu.	" Je n’ai rien écouté " dit Tom d’un air entendu.
en_280	Je ne vois pas du tout de quoi vous voulez parler, dit Tom, ça doit être un malentendu.	Je ne vois pas du tout de quoi vous voulez parler, dit Tom, ça doit être un malentendu.
en_280	Je démens tout" dit Tom avec un regard fou.	Je démens tout" dit Tom avec un regard fou.
en_280	Je ne vois pas du tout de quoi vous voulez parler, dit Tom d'un air entendu.	Je ne vois pas du tout de quoi vous voulez parler, dit Tom d'un air entendu.
en_280	" Pas la peine de crier, je suis sourd ", répliqua Tom d’un air entendu.	" Pas la peine de crier, je suis sourd ", répliqua Tom d’un air entendu.
en_280	"Je n'ai pas coupé ce bois", déclara sciemment Tom.	"Je n'ai pas coupé ce bois", déclara sciemment Tom.
en_2805	Le chat a pris des cours d'informatique dans l'espoir de maîtriser sa prise sur une souris.	Le chat a pris des cours d'informatique dans l'espoir de maîtriser sa prise sur une souris.
en_2805	Le chat a pris des cours d'informatique dans le but de se familiariser avec la souris.	Le chat a pris des cours d'informatique dans le but de se familiariser avec la souris.
en_2805	Le chat a pris des leçons d'ordinateur dans l'espoir de maîtriser son emprise sur une souris.	Le chat a pris des leçons d'ordinateur dans l'espoir de maîtriser son emprise sur une souris.
en_2814	La symbologie te menera à ta rune.	La symbologie te menera à ta rune.
en_2814	Étudier les anciens alphabets c'est comme courir à sa rune.	Étudier les anciens alphabets c'est comme courir à sa rune.
en_2814	L'étudiant en symboles ancien court à sa rune	L'étudiant en symboles ancien court à sa rune
en_2814	L'étude des symboles anciens vous mènera à la rune.	L'étude des symboles anciens vous mènera à la rune.
en_2814	En investissant dans la recherche d'alphabets anciens vous allez vers la rune.	En investissant dans la recherche d'alphabets anciens vous allez vers la rune.
en_2814	L'étude des symboles anciens vous conduira à rune.	L'étude des symboles anciens vous conduira à rune.
en_2820	“Si je lâche le plafond, tout va s’effondrer", maintient Tom.	“Si je lâche le plafond, tout va s’effondrer", maintient Tom.
en_2820	"Si je lâche le plafond, il va s'effondrer," soutint Tom.	"Si je lâche le plafond, il va s'effondrer," soutint Tom.
en_2820	"Si je lâche le toit il va s'effondrer", soutint Tom.	"Si je lâche le toit il va s'effondrer", soutint Tom.
en_2820	" Si je lâche le plafond, il va s'écrouler ", soutient Tom.	" Si je lâche le plafond, il va s'écrouler ", soutient Tom.
en_2820	"Si je lâche le plafond, il va s'écrouler" soutenait Tom.	"Si je lâche le plafond, il va s'écrouler" soutenait Tom.
en_2820	"Si je n'étais pas là, le monde s'écroulerait", soutenait Toto.	"Si je n'étais pas là, le monde s'écroulerait", soutenait Toto.
en_2820	"Si je lâche le plafond il va s'effondrer", maintient Tom.	"Si je lâche le plafond il va s'effondrer", maintient Tom.
en_2820	"Si j'arrête de tenir le plafond, il va s'effondrer", a soutenu Tom.	"Si j'arrête de tenir le plafond, il va s'effondrer", a soutenu Tom.
en_2820	"Si je lâche le plafond, il s'effondrera" maintint Tom	"Si je lâche le plafond, il s'effondrera" maintint Tom
en_2820	" Si je lâche le plafond, il va s'écrouler ", maintint Tom.	" Si je lâche le plafond, il va s'écrouler ", maintint Tom.
en_2820	"Si je lâche le plafond, il va s'effondrer", maintint Tom.	"Si je lâche le plafond, il va s'effondrer", maintint Tom.
en_2820	Si je lâche le plafond, il va s'effondrer, a soutenu Tom.	Si je lâche le plafond, il va s'effondrer, a soutenu Tom.
en_2823	Quand j’ai entendu les antilopes arriver, je me suis mis à gnoux.	Quand j’ai entendu les antilopes arriver, je me suis mis à gnoux.
en_2823	J’ai appris que les fourmis allaient nous envahir en regardant une émission à l’antenne.	J’ai appris que les fourmis allaient nous envahir en regardant une émission à l’antenne.
en_2823	J'ai appris l'arrivée des oies sauvages en lisant le canard.	J'ai appris l'arrivée des oies sauvages en lisant le canard.
en_2823	Si les antilopes décidaient de prendre le pouvoir, elles mettraient l'humanité à gnous.	Si les antilopes décidaient de prendre le pouvoir, elles mettraient l'humanité à gnous.
en_2828	"Je brûle des substances aromatiques," dit Tom, encensé.	"Je brûle des substances aromatiques," dit Tom, encensé.
en_2829	La compagnie de bois d'uvre a réduit ses effectifs. Elle s'est débarrassée du bois mort.	La compagnie de bois d'uvre a réduit ses effectifs. Elle s'est débarrassée du bois mort.
en_2829	La compagnie de bois d'uvre s'est réduite. Elle a éliminé le bois mort.	La compagnie de bois d'uvre s'est réduite. Elle a éliminé le bois mort.
en_2829	L'entreprise de bois a réduit ses effectifs. Ils se sont débarrassés du bois mort.	L'entreprise de bois a réduit ses effectifs. Ils se sont débarrassés du bois mort.
en_2829	La société du bois a été déclassée, elle s'est débarrassée du bois mort.	La société du bois a été déclassée, elle s'est débarrassée du bois mort.
en_2832	Vous avez demandé à apprendre le français rapidement, alors, je vais faire court: on les appelle des leçons parce qu'elles le sont	Vous avez demandé à apprendre le français rapidement, alors, je vais faire court: on les appelle des leçons parce qu'elles le sont
en_284	Les vieux cordonniers ne meurent jamais, ils ont juste besoin de pompes funèbres	Les vieux cordonniers ne meurent jamais, ils ont juste besoin de pompes funèbres
en_284	Les vieux cordonniers ne meurent pas, ils perdent les piedales.	Les vieux cordonniers ne meurent pas, ils perdent les piedales.
en_284	Les vieux cordonniers ne meurent jamais, ils sont juste à côté de leurs pompes	Les vieux cordonniers ne meurent jamais, ils sont juste à côté de leurs pompes
en_2840	La poudrière a été inventée dans un flash.	La poudrière a été inventée dans un flash.
en_2840	La poudre à canon fût inventée en un éclair.	La poudre à canon fût inventée en un éclair.
en_2842	Il se muove, dit Galileo, en mouvement.	Il se muove, dit Galileo, en mouvement.
en_2843	Quand j'ai demandé à l'homme comment il était devenu un éboueur de fossé, il a dit qu'il venait de tomber dedans.	Quand j'ai demandé à l'homme comment il était devenu un éboueur de fossé, il a dit qu'il venait de tomber dedans.
en_2843	Lorsque j'ai demandé à l'homme comment il était devenu un creuseur de fossés, il a répondu qu'il était simplement tombé dedans.	Lorsque j'ai demandé à l'homme comment il était devenu un creuseur de fossés, il a répondu qu'il était simplement tombé dedans.
en_2846	Je vends tout ça avant que je ne le brise, dit Toto en soufflant	Je vends tout ça avant que je ne le brise, dit Toto en soufflant
en_2846	"Tiens, il y a du vent, il y a des feuilles qui volent, il y a des nuages…", souffa Toto en brassant de l'air	"Tiens, il y a du vent, il y a des feuilles qui volent, il y a des nuages…", souffa Toto en brassant de l'air
en_2846	Ce n'est pas la bonne direction, dit Toto en faisant la pirouette	Ce n'est pas la bonne direction, dit Toto en faisant la pirouette
en_2851	Son idée d'entreprise de fabrication de marteaux ne valait pas un clou.	Son idée d'entreprise de fabrication de marteaux ne valait pas un clou.
en_2851	La gestion de son entreprise de ciseaux à nécessité des coupes budgétaires.	La gestion de son entreprise de ciseaux à nécessité des coupes budgétaires.
en_2851	Il avait un projet de fabrication de ciseaux à bout piquant, mais finalement ça n'a pas ponctionné.	Il avait un projet de fabrication de ciseaux à bout piquant, mais finalement ça n'a pas ponctionné.
