id_en	text_fr	text_clean
en_1007	"Il faut sauver les baleines", jeta Tom avant de se tasser.	"Il faut sauver les baleines", jeta Tom avant de se tasser.
en_1007	"Il faut sauver les baleines", interjeta Tom.	"Il faut sauver les baleines", interjeta Tom.
en_1007	Moi je sauve les baleines, Tom s’en venta.	Moi je sauve les baleines, Tom s’en venta.
en_1007	Louis évent-a le projet de sauvetage des baleines.	Louis évent-a le projet de sauvetage des baleines.
en_1007	"Sauvez les baleines", proclama Tom à tout évent.	"Sauvez les baleines", proclama Tom à tout évent.
en_1007	"Sauvez les baleines, cracha Toto, Cétacé!"	"Sauvez les baleines, cracha Toto, Cétacé!"
en_1015	Si un citadin a un faible QI, est-ce pour autant que la population niais pas pour quelque chose ?	Si un citadin a un faible QI, est-ce pour autant que la population niais pas pour quelque chose ?
en_1015	Les habitants de Douai ont-ils un QI élevé ?	Les habitants de Douai ont-ils un QI élevé ?
en_1015	Si on fait la somme des QI d'une population, est-ce que leur intelligence devient moyenne?	Si on fait la somme des QI d'une population, est-ce que leur intelligence devient moyenne?
en_1015	Si tous les habitants d’une ville sont bouchés, est-ce que ça fait plus de bouchons ?	Si tous les habitants d’une ville sont bouchés, est-ce que ça fait plus de bouchons ?
en_102	Le skieur est parti à la retraite. Il n'arrivait pas à remonter la pente.	Le skieur est parti à la retraite. Il n'arrivait pas à remonter la pente.
en_103	Ma femme écoute du hip hop quand elle cuisine des carottes ou du gruyère. Je n'aime pas ça mais elle me dit que ça l'aide à râper.	Ma femme écoute du hip hop quand elle cuisine des carottes ou du gruyère. Je n'aime pas ça mais elle me dit que ça l'aide à râper.
en_1031	Je rêvais de dormir dans cet hôtel.	Je rêvais de dormir dans cet hôtel.
en_1033	En cuisinant, j'ai fait tomber un bâton de margarine sur le carrelage en bois, et quand ma voisine a glissé et est tombée, j'ai dit : "Ça doit être le parkay".	En cuisinant, j'ai fait tomber un bâton de margarine sur le carrelage en bois, et quand ma voisine a glissé et est tombée, j'ai dit : "Ça doit être le parkay".
en_1033	Quand j'ai fait du pain, j'ai mis un morceau de margarine sur le plancher. Quand mon voisin est tombé, j'ai dit: "Il y a eu une parkay".	Quand j'ai fait du pain, j'ai mis un morceau de margarine sur le plancher. Quand mon voisin est tombé, j'ai dit: "Il y a eu une parkay".
en_1047	La belle attendait ses amants dans le clocher de l'église, mais le temps passait et aucun ne venait. Elle se disait qu'elle aurait dû savoir si quelque chose clochait.	La belle attendait ses amants dans le clocher de l'église, mais le temps passait et aucun ne venait. Elle se disait qu'elle aurait dû savoir si quelque chose clochait.
en_1047	Pablo et José attendaient que Pilar allume le grand Feu avant de la rejoindre à l'église, mais d'aucun ne réagit à la chaleur ne sachant à qui était destiné la femme	Pablo et José attendaient que Pilar allume le grand Feu avant de la rejoindre à l'église, mais d'aucun ne réagit à la chaleur ne sachant à qui était destiné la femme
en_1047	Firmin et Henri attendaient tous les deux que Gladys arrive dans leur collocation. Elle appuie sur la sonnette mais personne ne lui ouvre, car aucun des deux ne sait pour qui sonne Gladys.	Firmin et Henri attendaient tous les deux que Gladys arrive dans leur collocation. Elle appuie sur la sonnette mais personne ne lui ouvre, car aucun des deux ne sait pour qui sonne Gladys.
en_1047	Plabo et José ont attendu un signal de la part de Pilar pour la rejoindre dans la tour de l'église, mais aucun des deux n'a répondu au carillon, car ils ne savaient pas lequel des deux cette cloche sonnait.	Plabo et José ont attendu un signal de la part de Pilar pour la rejoindre dans la tour de l'église, mais aucun des deux n'a répondu au carillon, car ils ne savaient pas lequel des deux cette cloche sonnait.
en_1047	Pablo et José ont attendu que Pilar leur dise de la rejoindre à dans le clochet de l'église. Ils ont cherché le clochet mais ne l'ont jamais trouvé. Pilar ne dit que des sonnettes.	Pablo et José ont attendu que Pilar leur dise de la rejoindre à dans le clochet de l'église. Ils ont cherché le clochet mais ne l'ont jamais trouvé. Pilar ne dit que des sonnettes.
en_1047	Pablo et Jose attendirent un signal de Pilar pour la rejoindre dans la tour de l'Église, mais ils ne répondirent pas au chant parce qu'ils ne savaient pas pour qui la belle se balançait.	Pablo et Jose attendirent un signal de Pilar pour la rejoindre dans la tour de l'Église, mais ils ne répondirent pas au chant parce qu'ils ne savaient pas pour qui la belle se balançait.
en_1051	Un jour, quelqu'un m'a accusé d'avoir volé un timbre de valeur, rare et ancien. Je lui ai dit que, pour porter de telles accusations, il devait être complètement timbré.	Un jour, quelqu'un m'a accusé d'avoir volé un timbre de valeur, rare et ancien. Je lui ai dit que, pour porter de telles accusations, il devait être complètement timbré.
en_1051	Quelqu'un m'a accusé d'avoir contrefait les pièces de collections vendues au club de philatélistes. J'ai nié en ajoutant qu'il était timbré.	Quelqu'un m'a accusé d'avoir contrefait les pièces de collections vendues au club de philatélistes. J'ai nié en ajoutant qu'il était timbré.
en_1051	On m'a accusé de voler un vieux timbre de grande valeur, mais je me suis affranchi de ce soupçon.	On m'a accusé de voler un vieux timbre de grande valeur, mais je me suis affranchi de ce soupçon.
en_1051	Une fois j’ai été accusé d’avoir volé un vieux timbre rare et précieux, j’ai évidemment nié comme un timbré.	Une fois j’ai été accusé d’avoir volé un vieux timbre rare et précieux, j’ai évidemment nié comme un timbré.
en_1051	Un jour quelqu’un m’a accusée d’avoir volé un œuf de Fabergé très rare, et je n’ai pas pu rester pondéré.	Un jour quelqu’un m’a accusée d’avoir volé un œuf de Fabergé très rare, et je n’ai pas pu rester pondéré.
en_1051	Un philatéliste m'a accusé d'avoir volé toute sa collection... Quel timbré, celui-là !	Un philatéliste m'a accusé d'avoir volé toute sa collection... Quel timbré, celui-là !
en_1051	On m'a un jour accusé d'avoir volé des vieux timbres rares qui valaient très cher, ce que j'ai nié en bloc.	On m'a un jour accusé d'avoir volé des vieux timbres rares qui valaient très cher, ce que j'ai nié en bloc.
en_1059	Le pêcheur sifflant était toujours hors de thon.	Le pêcheur sifflant était toujours hors de thon.
en_1072	Si vous portez un bandeau aux yeux, vous ne saurez pas ce que vous manquez.	Si vous portez un bandeau aux yeux, vous ne saurez pas ce que vous manquez.
en_1072	Si vous portez un bandeau sur les yeux au stand de tir, vous ne saurez pas ce que vous manquez.	Si vous portez un bandeau sur les yeux au stand de tir, vous ne saurez pas ce que vous manquez.
en_1072	Si tu portes un bandeau sur tes yeux au stand de tir, tu ne sauras pas ce que tu rates.	Si tu portes un bandeau sur tes yeux au stand de tir, tu ne sauras pas ce que tu rates.
en_1072	Si tu portes des yeux au champ de tir, tu ne sais pas ce que tu manques.	Si tu portes des yeux au champ de tir, tu ne sais pas ce que tu manques.
en_108	Les vieux boulangers ne meurent jamais, ils ne gagnent juste plus aussi bien leur pain.	Les vieux boulangers ne meurent jamais, ils ne gagnent juste plus aussi bien leur pain.
en_108	Les anciens boulangers ne meurent jamais, ils arrêtent juste de se faire du blé.	Les anciens boulangers ne meurent jamais, ils arrêtent juste de se faire du blé.
en_108	Les vieux boulangers ne meurent jamais, ils arrêtent juste de gagner leur croûte.	Les vieux boulangers ne meurent jamais, ils arrêtent juste de gagner leur croûte.
en_108	Un boulanger qui a fait faillite n'a plus de blé.	Un boulanger qui a fait faillite n'a plus de blé.
en_108	Les vieux boulangers ne meurent pas, ils ont juste de moins en moins de blé.	Les vieux boulangers ne meurent pas, ils ont juste de moins en moins de blé.
en_108	Les vieux boulangers ne meurent pas, ils arrêtent seulement de gagner leur croûte.	Les vieux boulangers ne meurent pas, ils arrêtent seulement de gagner leur croûte.
en_108	Les vieux boulangers ne meurent pas, ils arrêtent juste de se faire du blé	Les vieux boulangers ne meurent pas, ils arrêtent juste de se faire du blé
en_108	Les vieux meuniers ne meurent jamais, ils arrêtent juste de se faire du blé.	Les vieux meuniers ne meurent jamais, ils arrêtent juste de se faire du blé.
en_108	Les vieux pâtissier ne meurent pas, ils arrêtent de mettre la main à la pâte.	Les vieux pâtissier ne meurent pas, ils arrêtent de mettre la main à la pâte.
en_108	Une boulangère ne meurt jamais, seulement, ses problèmes vont croissant.	Une boulangère ne meurt jamais, seulement, ses problèmes vont croissant.
en_108	Les vieux boulangers ne meurent jamais, ils cessent seulement de mettre la main à la pâte.	Les vieux boulangers ne meurent jamais, ils cessent seulement de mettre la main à la pâte.
en_108	Un boulanger ne meurt pas, il est dans le pétrin.	Un boulanger ne meurt pas, il est dans le pétrin.
en_108	À force de se faire mener à la baguette, le boulanger s’est retrouvé dans le pétrin.	À force de se faire mener à la baguette, le boulanger s’est retrouvé dans le pétrin.
en_108	Les vieux boulangers ne meurent pas, ils ne mettent juste plus la main à la pâte.	Les vieux boulangers ne meurent pas, ils ne mettent juste plus la main à la pâte.
en_1084	Je trouve que dans un intérieur rustique, un poêle à bois, ça a vraiment du chien	Je trouve que dans un intérieur rustique, un poêle à bois, ça a vraiment du chien
en_1085	Il réfléchit mieux maintenant qu'il a un miroir.	Il réfléchit mieux maintenant qu'il a un miroir.
en_1085	Après avoir acheté un miroir, il est devenu très réfléchi.	Après avoir acheté un miroir, il est devenu très réfléchi.
en_110	"La nourriture a goût de plutonium", dit Tom, rayonnant.	"La nourriture a goût de plutonium", dit Tom, rayonnant.
en_110	"Ce plat a un goût de plutonium", dit Tom rayonnant.	"Ce plat a un goût de plutonium", dit Tom rayonnant.
en_110	"Ah, ce plat a un goût de plutonium!", fit Tom, rayonnant.	"Ah, ce plat a un goût de plutonium!", fit Tom, rayonnant.
en_110	Ce plat à un goût de plutonium, dit Tom brillamment.	Ce plat à un goût de plutonium, dit Tom brillamment.
en_110	"Ça a un goût de plutonium", conclut Toto, brillament	"Ça a un goût de plutonium", conclut Toto, brillament
en_110	" Ça a un peu le goût d'uranium non ? ", demanda Tom, rayonnant.	" Ça a un peu le goût d'uranium non ? ", demanda Tom, rayonnant.
en_110	"Ça a le goût du plutonium", dit Tom radieux.	"Ça a le goût du plutonium", dit Tom radieux.
en_110	Ce plat a goût de plutonium", dit Tom, radieux	Ce plat a goût de plutonium", dit Tom, radieux
en_110	Cette nourriture a le goût de plutonium, à dit Tom brillamment.	Cette nourriture a le goût de plutonium, à dit Tom brillamment.
en_110	" Ce plat a goût de plutonium " dit Tom d'un air radieux.	" Ce plat a goût de plutonium " dit Tom d'un air radieux.
en_110	Cette nourriture à un goût de plutonium, dit Tom si brillamment.	Cette nourriture à un goût de plutonium, dit Tom si brillamment.
en_110	Ce plat a un goût de plutonium, dit Tom, irradiant la joie.	Ce plat a un goût de plutonium, dit Tom, irradiant la joie.
en_110	"Ce plat a le goût de plutonium", dit Tom, les yeux brillants et la mine radieuse.	"Ce plat a le goût de plutonium", dit Tom, les yeux brillants et la mine radieuse.
en_110	"Cette nourriture a un goût de plutonium", dit Tom, les yeux brillants.	"Cette nourriture a un goût de plutonium", dit Tom, les yeux brillants.
en_110	"Ce repas a le goût de plutonium", dit Tom avec un sourire irradieux.	"Ce repas a le goût de plutonium", dit Tom avec un sourire irradieux.
en_1106	Les vieux dactylographes ne meurent jamais, ils perdent juste leur touche spéciale.	Les vieux dactylographes ne meurent jamais, ils perdent juste leur touche spéciale.
en_1107	Cette sauce salade contient trop de vinaigre, dit Tom d'un ton acide.	Cette sauce salade contient trop de vinaigre, dit Tom d'un ton acide.
en_1107	"Ce dressing de salade a trop de vinaigre", dit Tom acidement.	"Ce dressing de salade a trop de vinaigre", dit Tom acidement.
en_1107	« Cette vinaigrette à salade contient trop de vinaigre, a dit Tom acidulément.	« Cette vinaigrette à salade contient trop de vinaigre, a dit Tom acidulément.
en_1107	Quel est le comble pour un étudiant en cuisine qui n'arrive pas à faire de sauce salade au vinaigre ? D'être assidu	Quel est le comble pour un étudiant en cuisine qui n'arrive pas à faire de sauce salade au vinaigre ? D'être assidu
en_111	Tu sais que le boulanger du coin paye ses employés au blé noir ?	Tu sais que le boulanger du coin paye ses employés au blé noir ?
en_111	On ne peut pas dire que le boulanger du coin paie bien ses employés, il les roule dans la farine.	On ne peut pas dire que le boulanger du coin paie bien ses employés, il les roule dans la farine.
en_111	Le boulanger du quartier payait à peine ses employés alors qu'il est plein de blé.	Le boulanger du quartier payait à peine ses employés alors qu'il est plein de blé.
en_111	Le boulanger local payait son personnel sur la base d'un taux faramineux.	Le boulanger local payait son personnel sur la base d'un taux faramineux.
en_111	Le primeur du quartier paye ses employés selon le salade horaire moyen.	Le primeur du quartier paye ses employés selon le salade horaire moyen.
en_1120	Les vieux politiciens ne meurent jamais, ils ne sont juste plus trop dans leur état normal.	Les vieux politiciens ne meurent jamais, ils ne sont juste plus trop dans leur état normal.
en_1121	Certaines personnes pensent que les exercices d’incendie peuvent amener les gens à se blesser dans le feu de l’action.	Certaines personnes pensent que les exercices d’incendie peuvent amener les gens à se blesser dans le feu de l’action.
en_1121	Certaines personnes trouvent les exercices incendie très alarmant	Certaines personnes trouvent les exercices incendie très alarmant
en_1121	Pour certains, les exercices d'incendie sont alarmants.	Pour certains, les exercices d'incendie sont alarmants.
en_1121	Certaines personnes trouvent les exercices d’incendie plutôt alarmant.	Certaines personnes trouvent les exercices d’incendie plutôt alarmant.
en_1121	Certains trouvent que les sirènes incendies ont un effet alarmant.	Certains trouvent que les sirènes incendies ont un effet alarmant.
en_1121	Certains trouvent les exercices incendie très alarmants.	Certains trouvent les exercices incendie très alarmants.
en_1121	Certaines personnes trouvent les exercices d'incendie alarmants.	Certaines personnes trouvent les exercices d'incendie alarmants.
en_1121	Certains trouvent les exercices d'évacuation incendie assez alarmants.	Certains trouvent les exercices d'évacuation incendie assez alarmants.
en_1121	Certaines personnes trouvent que les exercices d'évacuation incendie très alarmants.	Certaines personnes trouvent que les exercices d'évacuation incendie très alarmants.
en_1121	Les simulations d'incendie, certains trouvent ça alarmant.	Les simulations d'incendie, certains trouvent ça alarmant.
en_114	Un fleuriste ne meurt jamais, seulement, il perd de sa fraîcheur.	Un fleuriste ne meurt jamais, seulement, il perd de sa fraîcheur.
en_114	Un fleuriste ne meurt jamais : il est juste surbooké.	Un fleuriste ne meurt jamais : il est juste surbooké.
en_114	Les vieux fleuristes ne meurent jamais parce qu’ils sont de bonne composition.	Les vieux fleuristes ne meurent jamais parce qu’ils sont de bonne composition.
en_114	Les vieux fleuristes ne meurent jamais, car ils continuent à voir la vie en rose.	Les vieux fleuristes ne meurent jamais, car ils continuent à voir la vie en rose.
en_114	Les vieux fleuristes ne meurent jamais, il se composent juste différemment.	Les vieux fleuristes ne meurent jamais, il se composent juste différemment.
en_1144	Va chercher Guevara ! cria Toto en havanant	Va chercher Guevara ! cria Toto en havanant
en_1144	"Allez! Va chercher mon chien!", lança Toto.	"Allez! Va chercher mon chien!", lança Toto.
en_1146	Le responsable anti-incendie était toujours mis sur le gril.	Le responsable anti-incendie était toujours mis sur le gril.
en_1146	Le directeur de cabinet posait toujours des questions pressantes.	Le directeur de cabinet posait toujours des questions pressantes.
en_1146	Le chef des pompiers brûlait toujours d'envie de poser des questions importantes	Le chef des pompiers brûlait toujours d'envie de poser des questions importantes
en_1146	Le capitaine des pompiers se charge toujours des question les plus brûlantes.	Le capitaine des pompiers se charge toujours des question les plus brûlantes.
en_1146	On laissait toujours le capitaine des pompiers s'occuper des sujets brûlants.	On laissait toujours le capitaine des pompiers s'occuper des sujets brûlants.
en_1146	On demandait toujours au chef des pompiers des questions brûlantes	On demandait toujours au chef des pompiers des questions brûlantes
en_1146	C’est toujours au chef des pompiers qu’étaient posées les questions brûlantes.	C’est toujours au chef des pompiers qu’étaient posées les questions brûlantes.
en_1146	Une question brûlait les lèvres du chef des pompiers.	Une question brûlait les lèvres du chef des pompiers.
en_1146	On interrogeait souvent le chef des pompiers sur l'actualité brûlante.	On interrogeait souvent le chef des pompiers sur l'actualité brûlante.
en_1146	Le chef des pompiers avait l'habitude de poser des questions brûlantes.	Le chef des pompiers avait l'habitude de poser des questions brûlantes.
en_1146	Le chef des pompiers se voyait toujours poser les questions les plus brûlantes.	Le chef des pompiers se voyait toujours poser les questions les plus brûlantes.
en_1146	Ça nous brûle les lèvres de poser ces questions au chef des pompiers.	Ça nous brûle les lèvres de poser ces questions au chef des pompiers.
en_1146	Le chef des pompiers traitait toujours de sujets brûlants.	Le chef des pompiers traitait toujours de sujets brûlants.
en_1146	Le capitaine des sapeur-pompiers posait toujours des questions à chaud.	Le capitaine des sapeur-pompiers posait toujours des questions à chaud.
en_1146	Le capitaine des pompiers devait toujours répondre à des questions brûlantes.	Le capitaine des pompiers devait toujours répondre à des questions brûlantes.
en_1146	Le capitaine des pompiers devait sans cesse répondre à des questions, il était sur des charbons ardents.	Le capitaine des pompiers devait sans cesse répondre à des questions, il était sur des charbons ardents.
en_1146	On posait toujours toujours d’ardentes questions au chef des pompiers.	On posait toujours toujours d’ardentes questions au chef des pompiers.
en_1146	Le pompier devait toujours répondre à des questions brûlantes.	Le pompier devait toujours répondre à des questions brûlantes.
en_1146	Le chef de la caserne était assailli de journalistes enflammés.	Le chef de la caserne était assailli de journalistes enflammés.
en_1146	Le pompier en chef était constamment arrosé de questions brûlantes	Le pompier en chef était constamment arrosé de questions brûlantes
en_1146	Le chef des pompiers était souvent pris entre deux feux par les questions explosives.	Le chef des pompiers était souvent pris entre deux feux par les questions explosives.
en_1146	On posait toujours des questions brûlantes au chef des pompiers.	On posait toujours des questions brûlantes au chef des pompiers.
en_1146	Les questions les plus brûlantes étaient toujours réservées au chef des pompiers.	Les questions les plus brûlantes étaient toujours réservées au chef des pompiers.
en_1146	Le chef des pompiers avait toujours droit aux questions brûlantes.	Le chef des pompiers avait toujours droit aux questions brûlantes.
en_1146	Le chef des pompiers se voyait toujours poser des questions brûlantes.	Le chef des pompiers se voyait toujours poser des questions brûlantes.
en_1157	Ils ont sué sang et eau avant d’atteindre le sauna et échapper au tueur.	Ils ont sué sang et eau avant d’atteindre le sauna et échapper au tueur.
en_1157	Pour échapper au bandit armé, ils se sont cachés dans un sauna, même si ça les faisait suer (d’attendre là).	Pour échapper au bandit armé, ils se sont cachés dans un sauna, même si ça les faisait suer (d’attendre là).
en_1157	Ils ont échappé au tireur et se sont cachés dans un sauna où ils ont pu s’armer de patience en suant.	Ils ont échappé au tireur et se sont cachés dans un sauna où ils ont pu s’armer de patience en suant.
en_1157	Leur poursuite jusque dans un sauna par un tueur à gages leur donna des sueurs froides.	Leur poursuite jusque dans un sauna par un tueur à gages leur donna des sueurs froides.
en_1157	Ils se sont réfugiés dans le sauna pour échapper au tireur, qui leur a donné des sueurs froides.	Ils se sont réfugiés dans le sauna pour échapper au tireur, qui leur a donné des sueurs froides.
en_1157	Ils se cachèrent du tireur dans un sauna où ils pouvaient laisser couler.	Ils se cachèrent du tireur dans un sauna où ils pouvaient laisser couler.
en_1157	Ils n'avaient pas froid aux yeux, mais la vue du tireur isolé leur glaça le sang ; blessés, ils suèrent sang et eau pour aller se réfugier dans le sauna, seul abri à proximité.	Ils n'avaient pas froid aux yeux, mais la vue du tireur isolé leur glaça le sang ; blessés, ils suèrent sang et eau pour aller se réfugier dans le sauna, seul abri à proximité.
en_1157	Les passants ont trouvé refuge dans un sauna lors d'une fusillade. On peut dire qu'ils ont eu chaud.	Les passants ont trouvé refuge dans un sauna lors d'une fusillade. On peut dire qu'ils ont eu chaud.
en_1157	Ils se sont cacher du tireur dans un sauna où ils pouvaient évacuer	Ils se sont cacher du tireur dans un sauna où ils pouvaient évacuer
en_1157	Ils se sont cachés du tireur dans une chambre frigorifique, où ils ont pu garder leur sang froid.	Ils se sont cachés du tireur dans une chambre frigorifique, où ils ont pu garder leur sang froid.
en_1157	Ils s'étaient cachés dans un sauna pour faire croire à leur poursuivant qu'ils s'étaient évaporés	Ils s'étaient cachés dans un sauna pour faire croire à leur poursuivant qu'ils s'étaient évaporés
en_1157	Ils échappèrent au tireur en se cachant dans un sauna, où ils attendirent la fin de l'échauffourée	Ils échappèrent au tireur en se cachant dans un sauna, où ils attendirent la fin de l'échauffourée
en_1157	Ils se sont cachés dans le sauna en attendant que le tireur s’évapore.	Ils se sont cachés dans le sauna en attendant que le tireur s’évapore.
en_1157	Ils se sont cachés du tireur dans un champ pour le semer.	Ils se sont cachés du tireur dans un champ pour le semer.
en_1157	Pour échapper au tireur, ils se cachèrent dans le sauna. Ils ont eu chaud.	Pour échapper au tireur, ils se cachèrent dans le sauna. Ils ont eu chaud.
en_1157	Ils se cachèrent du bandit armé, se faufilant dans le sauna si discrètement que rien ne le laissait transpirer.	Ils se cachèrent du bandit armé, se faufilant dans le sauna si discrètement que rien ne le laissait transpirer.
en_1157	Ils se cachèrent du tireur en se réfugiant dans un sauna, où ils purent transpirer un coup.	Ils se cachèrent du tireur en se réfugiant dans un sauna, où ils purent transpirer un coup.
en_1157	Poursuivis par un tueur, ils se cachèrent dans un sauna en attendant de trouver un moyen de renverser la vapeur.	Poursuivis par un tueur, ils se cachèrent dans un sauna en attendant de trouver un moyen de renverser la vapeur.
en_1157	Cachés dans le sauna pour échapper au tireur, ils ont eu leurs vapeurs.	Cachés dans le sauna pour échapper au tireur, ils ont eu leurs vapeurs.
en_1157	Ils se sont cachés du tireur dans un sauna; ça commençait à devenir chaud !	Ils se sont cachés du tireur dans un sauna; ça commençait à devenir chaud !
en_1157	Ils se sont mis à l'abri du tireur dans un sauna afin de prendre la température de la situation.	Ils se sont mis à l'abri du tireur dans un sauna afin de prendre la température de la situation.
en_116	L'astronaute a affirmé avoir découvert une nouvelle étoile, mais personne ne l'a pris au Sirius.	L'astronaute a affirmé avoir découvert une nouvelle étoile, mais personne ne l'a pris au Sirius.
en_116	Quelle est la boisson énergisante préférée des extraterrestres ? Alpha Centaurine	Quelle est la boisson énergisante préférée des extraterrestres ? Alpha Centaurine
en_116	L'astronaute a fait une déclaration sur une étoile bien connue, et ce n'était pas un mentar.	L'astronaute a fait une déclaration sur une étoile bien connue, et ce n'était pas un mentar.
en_116	En découvrant cette nouvelle étoile, la Russie fit Dombay la chemise.	En découvrant cette nouvelle étoile, la Russie fit Dombay la chemise.
en_116	L'astronaute a fait une déclaration sur une étoile bien connue, mais ça n'a pas perse.	L'astronaute a fait une déclaration sur une étoile bien connue, mais ça n'a pas perse.
en_1160	La robe en satin était parfaite. Les deux nœud-nœuds de chaque côté de la mariée n'ont fait que l'embellir.	La robe en satin était parfaite. Les deux nœud-nœuds de chaque côté de la mariée n'ont fait que l'embellir.
en_1169	Les vieux PROFESSEURS ne meurent jamais, ils perdent juste leur classe.	Les vieux PROFESSEURS ne meurent jamais, ils perdent juste leur classe.
