id_en	text_fr	text_clean
en_6631	Quelle belle paire de lunettes ! Tom fit la réflexion.	Quelle belle paire de lunettes ! Tom fit la réflexion.
en_6631	C'est un beau miroir, fit Tom, plongé dans ses réflexions.	C'est un beau miroir, fit Tom, plongé dans ses réflexions.
en_6631	" Quel beau miroir ! " s'exclama Tom après réflexion.	" Quel beau miroir ! " s'exclama Tom après réflexion.
en_6631	Quel superbe miroir ! dit Tom en réfléchissant.	Quel superbe miroir ! dit Tom en réfléchissant.
en_6631	" Quel beau miroir ", réfléchit Tom à voix haute.	" Quel beau miroir ", réfléchit Tom à voix haute.
en_6631	En y réfléchissant bien, c'est un beau miroir, dit Tom	En y réfléchissant bien, c'est un beau miroir, dit Tom
en_6631	"Joli miroir !" dit Tom en réfléchissant.	"Joli miroir !" dit Tom en réfléchissant.
en_6631	Joli miroir, dit Tom réfléchissant à voix haute	Joli miroir, dit Tom réfléchissant à voix haute
en_6631	C'est un bien joli miroir, dis Tom en réfléchissant.	C'est un bien joli miroir, dis Tom en réfléchissant.
en_6631	Joli miroir ! dit Tom en réfléchissant.	Joli miroir ! dit Tom en réfléchissant.
en_6631	"Quel étrange miroir !", dit Toto en réfléchissant	"Quel étrange miroir !", dit Toto en réfléchissant
en_6631	"Joli miroir" dit Tom d'un ton réfléchi.	"Joli miroir" dit Tom d'un ton réfléchi.
en_6631	"Pourquoi est-ce que je ne me vois pas dans ce miroir ?" fit Tom sans réfléchir.	"Pourquoi est-ce que je ne me vois pas dans ce miroir ?" fit Tom sans réfléchir.
en_6631	"Je veux le même miroir!" réfléchit Tom	"Je veux le même miroir!" réfléchit Tom
en_6632	Les pendus gardent toujours leurs clients dans la boucle.	Les pendus gardent toujours leurs clients dans la boucle.
en_6639	Le diététicien est un adversaire de taille.	Le diététicien est un adversaire de taille.
en_6644	Je n'ai jamais tué de cerf, mais je tenterai le coup.	Je n'ai jamais tué de cerf, mais je tenterai le coup.
en_6666	Les copeaux retrouvés près du corps suggéraient de rechercher du côté d’un tueur en scierie.	Les copeaux retrouvés près du corps suggéraient de rechercher du côté d’un tueur en scierie.
en_6666	Les Frosties près du corps indiquent que la police cherche un céréales killer.	Les Frosties près du corps indiquent que la police cherche un céréales killer.
en_6666	Des cornflakes retrouvés près du cadavre ont conduit la police à évoquer un céréales killer.	Des cornflakes retrouvés près du cadavre ont conduit la police à évoquer un céréales killer.
en_6666	Il y avait des ampoules électriques/DVD de Game of Thrones tout autour du cadavre : la police orientait ses recherches vers un tueur en série.	Il y avait des ampoules électriques/DVD de Game of Thrones tout autour du cadavre : la police orientait ses recherches vers un tueur en série.
en_6666	Il y avait des Corn Flakes tout autour du cadavre : la police pense que c’est l’œuvre du célèbre tueur en série, Al.	Il y avait des Corn Flakes tout autour du cadavre : la police pense que c’est l’œuvre du célèbre tueur en série, Al.
en_6666	Il y avait des gouttes d’eau tout autour du cadavre : ça ne pouvait qu’être l’œuvre d’un tueur en ciré.	Il y avait des gouttes d’eau tout autour du cadavre : ça ne pouvait qu’être l’œuvre d’un tueur en ciré.
en_6666	Des Frosties ont été retrouvés près du cadavre... L'œuvre d'un céréale killer.	Des Frosties ont été retrouvés près du cadavre... L'œuvre d'un céréale killer.
en_6672	Les chiens de police sont souvent au sentre des arrestations pour drogue.	Les chiens de police sont souvent au sentre des arrestations pour drogue.
en_6672	C'est souvent le chien renifleur qui est au sentre des opérations anti-drogues	C'est souvent le chien renifleur qui est au sentre des opérations anti-drogues
en_6672	Les chiens de la police sentent quand quelqu'un ment ou non.	Les chiens de la police sentent quand quelqu'un ment ou non.
en_6673	Ma femme, qui est professeure d'algèbre, est une excellente cuisinère. Elle est connue pour sa fameuse pi-zza.	Ma femme, qui est professeure d'algèbre, est une excellente cuisinère. Elle est connue pour sa fameuse pi-zza.
en_6679	Le poisson découvrit qu'on lui avait volé ses pneus : "Oh non, mérou !"	Le poisson découvrit qu'on lui avait volé ses pneus : "Oh non, mérou !"
en_6682	Je me présente: Léo Djavel. Je m'occupe de la propreté de la piscine.	Je me présente: Léo Djavel. Je m'occupe de la propreté de la piscine.
en_6682	Je m’appelle Jacques Ouzy, je m’occupe de l’entretien des piscines.	Je m’appelle Jacques Ouzy, je m’occupe de l’entretien des piscines.
en_6689	Le chef est un bleu, l'ancien est parti en retraite.	Le chef est un bleu, l'ancien est parti en retraite.
en_6691	Ceux qui fabriquent des aimants peuvent être très attrayants.	Ceux qui fabriquent des aimants peuvent être très attrayants.
en_6693	Ce n'était pas la pomme poussant sur l'arbre de la connaissance le problème, c'était les deux poires en dessous.	Ce n'était pas la pomme poussant sur l'arbre de la connaissance le problème, c'était les deux poires en dessous.
en_6693	Ah les jumeaux... Tel paire tels fils.	Ah les jumeaux... Tel paire tels fils.
en_6693	Notre paire qui est au pieu	Notre paire qui est au pieu
en_6699	Si tu voyages en bus, tu devras juste payer un prix éticketable.	Si tu voyages en bus, tu devras juste payer un prix éticketable.
en_6699	Quand même, quand tu vois le prix du bus aujourd’hui, ça fait tiquer !	Quand même, quand tu vois le prix du bus aujourd’hui, ça fait tiquer !
en_6701	"Cosigner ici", lise la première instruction sur l'examen de placement trigonométrique.	"Cosigner ici", lise la première instruction sur l'examen de placement trigonométrique.
en_6705	À chaque fois qu'elle devait bosser à la boulangerie, elle tirait la tranche.	À chaque fois qu'elle devait bosser à la boulangerie, elle tirait la tranche.
en_6705	C'était la plus honnête boulangère mais ils la laissèrent partir avec une franche de pain	C'était la plus honnête boulangère mais ils la laissèrent partir avec une franche de pain
en_6705	Elle a quitté son emploi de boulangère. Ça lui a fait beaucoup de PAINe.	Elle a quitté son emploi de boulangère. Ça lui a fait beaucoup de PAINe.
en_6705	A force de manger des chouquettes il a fini par prendre de la brioche.	A force de manger des chouquettes il a fini par prendre de la brioche.
en_6705	Travailler dans une boulangerie ne l'intéressait pas mais elle était dans le pétrin.	Travailler dans une boulangerie ne l'intéressait pas mais elle était dans le pétrin.
en_6722	Le communisme est un concept compliqué. Il ne suffie pas de lire dans les grandes Lénine.	Le communisme est un concept compliqué. Il ne suffie pas de lire dans les grandes Lénine.
en_6734	Une dispute a explosé dans la poudrerie.	Une dispute a explosé dans la poudrerie.
en_6739	Se débarrasser d'un bateau pour un autre peut vous submerger de problème	Se débarrasser d'un bateau pour un autre peut vous submerger de problème
en_6739	Vous débarrasser de votre bateau pourrait vous causer une nouvelle vague de problèmes.	Vous débarrasser de votre bateau pourrait vous causer une nouvelle vague de problèmes.
en_6739	Vendre un bateau pour en racheter un autre ne fera pas changer votre situation d'un yacht-a.	Vendre un bateau pour en racheter un autre ne fera pas changer votre situation d'un yacht-a.
en_6739	Ce n'est pas en vendant un bateau pour en acheter un autre que tu maintiendras tes finances à flot.	Ce n'est pas en vendant un bateau pour en acheter un autre que tu maintiendras tes finances à flot.
en_6739	Te débarrasser de ton bateau pour en avoir un autre engendrerait une vague de problèmes.	Te débarrasser de ton bateau pour en avoir un autre engendrerait une vague de problèmes.
en_6739	Jouer avec une perceuse dans une barque pourrait engendrer un problème de fond.	Jouer avec une perceuse dans une barque pourrait engendrer un problème de fond.
en_6739	Te débarrasser de ton bateau pour en acheter un autre pourrait te mener au naufrage.	Te débarrasser de ton bateau pour en acheter un autre pourrait te mener au naufrage.
en_6739	En changeant votre vieux bateau pour un neuf, vous risquez d'avoir du mal à vous maintenir à flot	En changeant votre vieux bateau pour un neuf, vous risquez d'avoir du mal à vous maintenir à flot
en_6739	Changer ton rafiot pour un autre, ferait un sacré raffût.	Changer ton rafiot pour un autre, ferait un sacré raffût.
en_6739	Te débarrasser de ton bateau pour en prendre en autre, c'est t'embarquer pour autant de problèmes.	Te débarrasser de ton bateau pour en prendre en autre, c'est t'embarquer pour autant de problèmes.
en_6739	Si vous changez de bateau, vous risquez de vous retrouver dans une galère.	Si vous changez de bateau, vous risquez de vous retrouver dans une galère.
en_6739	Échanger son bateau contre un autre pourrait causer une armada de problèmes.	Échanger son bateau contre un autre pourrait causer une armada de problèmes.
en_6739	Te débarrasser de ton bateau pour un autre pourrait causer un océan de problèmes.	Te débarrasser de ton bateau pour un autre pourrait causer un océan de problèmes.
en_6739	Si tu te débarrasses de ton bateau pour en prendre un autre, tu risques de te retrouver en rade.	Si tu te débarrasses de ton bateau pour en prendre un autre, tu risques de te retrouver en rade.
en_6739	Tes projets pourraient tomber à l’eau si tu te procurais un nouveau bateau.	Tes projets pourraient tomber à l’eau si tu te procurais un nouveau bateau.
en_6739	Si tu te débarrasses de ton bateau pour en acheter un autre, tu risques de couler à pic.	Si tu te débarrasses de ton bateau pour en acheter un autre, tu risques de couler à pic.
en_6739	Se débarrasser de son bateau est une grande décision, mais il faut se jeter à l'eau.	Se débarrasser de son bateau est une grande décision, mais il faut se jeter à l'eau.
en_6739	Tu veux te débarrasser de ton bateau pour en acheter un nouveau ?! Ça risque d'être une sacré galère !	Tu veux te débarrasser de ton bateau pour en acheter un nouveau ?! Ça risque d'être une sacré galère !
en_6745	Les vieilles voyantes ne meurent jamais, elles perdent juste la boule.	Les vieilles voyantes ne meurent jamais, elles perdent juste la boule.
en_6745	Les vieux voyants ne meurent jamais, ils perdent juste leur vision.	Les vieux voyants ne meurent jamais, ils perdent juste leur vision.
en_6746	Elle avait un partenaire avec une jambe de bois, mais elle l'a rompue.	Elle avait un partenaire avec une jambe de bois, mais elle l'a rompue.
en_6748	Elle a lancé une nouvelle entreprise de messagerie à des fins expresses.	Elle a lancé une nouvelle entreprise de messagerie à des fins expresses.
en_6759	Son histoire de bassin, là, c’était d’un superficiel ! Franchement, on touche le fond !	Son histoire de bassin, là, c’était d’un superficiel ! Franchement, on touche le fond !
en_6759	Son intrique qui se déroule près d’un lac était vraiment sans profondeur.	Son intrique qui se déroule près d’un lac était vraiment sans profondeur.
en_6759	L'intrigue de son anecdote de l'étang manquait de profondeur.	L'intrigue de son anecdote de l'étang manquait de profondeur.
en_6759	La trame de cette histoire de mare manquait un peu de profondeur	La trame de cette histoire de mare manquait un peu de profondeur
en_6759	La trame de son histoire sur la mare manquait de profondeur	La trame de son histoire sur la mare manquait de profondeur
en_6759	Il a raconté une vague histoire de bassin, mais il est resté en surface.	Il a raconté une vague histoire de bassin, mais il est resté en surface.
en_6762	Lorsque la coiffeuse a gagné une coupe, ça a surpris tout le monde.	Lorsque la coiffeuse a gagné une coupe, ça a surpris tout le monde.
en_6762	Tout le monde fut sous le choc quand le coiffeur s’est é-teint.	Tout le monde fut sous le choc quand le coiffeur s’est é-teint.
en_6762	"Le coiffeur s'est éteint". Le nouvelle avait pris tout le monde de court.	"Le coiffeur s'est éteint". Le nouvelle avait pris tout le monde de court.
en_6762	Tout le monde est sous le choc : le coiffeur s’était teint subitement hier soir.	Tout le monde est sous le choc : le coiffeur s’était teint subitement hier soir.
en_6762	Tout le monde était triste quand le coiffeur s'est é-teint.	Tout le monde était triste quand le coiffeur s'est é-teint.
en_6762	Le teinturier était parti en vacances au soleil pour prendre des couleurs.	Le teinturier était parti en vacances au soleil pour prendre des couleurs.
en_6762	Tout le monde été sous le choc lorsque nous avons appris que le coiffeur s'est éteint.	Tout le monde été sous le choc lorsque nous avons appris que le coiffeur s'est éteint.
en_6762	Il paraît que la coiffeuse a été impliquée dans une bagarre, c’est vraiment tiré par les cheveux cette histoire !	Il paraît que la coiffeuse a été impliquée dans une bagarre, c’est vraiment tiré par les cheveux cette histoire !
en_6762	Le coiffeur te déteint dessus.	Le coiffeur te déteint dessus.
en_6762	Tout le monde fut choqué d'apprendre que le coiffeur s'éteint	Tout le monde fut choqué d'apprendre que le coiffeur s'éteint
en_6762	Tout le monde a été ébahi d'apprendre que la coiffeuse n'avait pas son bac.	Tout le monde a été ébahi d'apprendre que la coiffeuse n'avait pas son bac.
en_6785	"J'ai rejoint la marine", dit Tom d'un air vague.	"J'ai rejoint la marine", dit Tom d'un air vague.
en_6789	Il y avait une vente au marché aux poissons aujourd'hui. J'y suis allé pour voir ce qu'il y avait à pêcher.	Il y avait une vente au marché aux poissons aujourd'hui. J'y suis allé pour voir ce qu'il y avait à pêcher.
en_6795	Une femme dit à son mari: tu as pété si fort qu'on l'a mesuré à 8.0 sur l'échelle de sphincter	Une femme dit à son mari: tu as pété si fort qu'on l'a mesuré à 8.0 sur l'échelle de sphincter
en_6795	Une femme dit à son mari, "c'était un passage de gaz explosif, je dirais d'environ 8.0 sur l'échelle du sphincter."	Une femme dit à son mari, "c'était un passage de gaz explosif, je dirais d'environ 8.0 sur l'échelle du sphincter."
en_6795	"C'était un passage au gaz explosif, dit la femme à son mari, au moins 8 sur l'échelle de Sphincter."	"C'était un passage au gaz explosif, dit la femme à son mari, au moins 8 sur l'échelle de Sphincter."
en_6795	La femme à son mari : "Ça, c'était explosif, comme fuite de gaz, je dirais un vent de force 8 environ."	La femme à son mari : "Ça, c'était explosif, comme fuite de gaz, je dirais un vent de force 8 environ."
en_6804	Les vieux cuisiniers chinois ne meurent jamais, ils nems pas l’idée de mourizr.	Les vieux cuisiniers chinois ne meurent jamais, ils nems pas l’idée de mourizr.
en_6804	Un cuisinier vitenamien ne meurt jamais, seulement, ses rouleaux ne sont plus du dernier printemps.	Un cuisinier vitenamien ne meurt jamais, seulement, ses rouleaux ne sont plus du dernier printemps.
en_6804	Les vieux cuisiniers chinois ne meurent jamais, ils se font saké.	Les vieux cuisiniers chinois ne meurent jamais, ils se font saké.
en_6804	Les vieux cuisiniers chinois ne meurent pas, ils arrêtent juste de la RAMENer.	Les vieux cuisiniers chinois ne meurent pas, ils arrêtent juste de la RAMENer.
en_6804	Les vieux cuisiniers chinois meurent souvent, ils ont un taux fou de mortalité.	Les vieux cuisiniers chinois meurent souvent, ils ont un taux fou de mortalité.
en_6804	Un cuisinier chinois ne meurt jamais : il inwok son droit de retrait, c'est tout.	Un cuisinier chinois ne meurt jamais : il inwok son droit de retrait, c'est tout.
en_6804	Un cuisinier chinois ne meurt pas, il est au bout du rouleau de printemps.	Un cuisinier chinois ne meurt pas, il est au bout du rouleau de printemps.
en_6805	J'ai eu un café qui était seulement bon pour ses valeurs sédimentaires.	J'ai eu un café qui était seulement bon pour ses valeurs sédimentaires.
en_6805	Je ne dis rien parce qu'elle est ma mère, mais j'en ai marc de son café.	Je ne dis rien parce qu'elle est ma mère, mais j'en ai marc de son café.
en_6805	J'ai pris du café mais j'en avais un peu marc.	J'ai pris du café mais j'en avais un peu marc.
en_6805	Le dernier café que j'ai bu ne m'a pas mar(c)qué	Le dernier café que j'ai bu ne m'a pas mar(c)qué
en_6805	Je viens de boire un café qui avait une forte valeur sédimentale.	Je viens de boire un café qui avait une forte valeur sédimentale.
en_6805	Quand je réfléchis, je bois du café ; ça me donne toujours du grain à moudre.	Quand je réfléchis, je bois du café ; ça me donne toujours du grain à moudre.
en_6805	Le café que je viens de boire était trop dilué. Il y en a marc !	Le café que je viens de boire était trop dilué. Il y en a marc !
en_6805	Je viens de boire le meilleur café de ma vie, je l’aurai troquet pour rien au monde.	Je viens de boire le meilleur café de ma vie, je l’aurai troquet pour rien au monde.
en_6805	Ce café était bon pour sa valeur sédimentale.	Ce café était bon pour sa valeur sédimentale.
en_6805	Je viens de prendre un café, mais il n'a vraiment qu'une valeur sédimentale.	Je viens de prendre un café, mais il n'a vraiment qu'une valeur sédimentale.
en_6805	Je viens de prendre un café qui n'avait qu'une valeur sédimentale.	Je viens de prendre un café qui n'avait qu'une valeur sédimentale.
en_6810	Ses qualifications en tant qu'enseignant de maths ne se sont pas ajoutées.	Ses qualifications en tant qu'enseignant de maths ne se sont pas ajoutées.
en_6813	Deux amis ont pris des cordes à l'école pour pouvoir sécher les cours.	Deux amis ont pris des cordes à l'école pour pouvoir sécher les cours.
en_6824	Je m'appelle Mélodie. Je suis musicienne.	Je m'appelle Mélodie. Je suis musicienne.
en_6824	Mon nom est Melody. Je suis musicienne.	Mon nom est Melody. Je suis musicienne.
en_6824	Moi c'est Mélodie, je suis musicienne.	Moi c'est Mélodie, je suis musicienne.
en_6824	Mon nom est Mélodie. Je suis musicienne.	Mon nom est Mélodie. Je suis musicienne.
en_6824	Mon nom est Octave. Je suis musicien.	Mon nom est Octave. Je suis musicien.
en_6824	Je m’appelle Mélodie. Je suis musicienne.	Je m’appelle Mélodie. Je suis musicienne.
en_6824	Enchantée, Mélodie, musicienne.	Enchantée, Mélodie, musicienne.
en_6829	Il s'est acheté des tas de coupons de tissu avant sa première audition: il voulait s'assurer qu'il avait bien l'étoffe d'un acteur.	Il s'est acheté des tas de coupons de tissu avant sa première audition: il voulait s'assurer qu'il avait bien l'étoffe d'un acteur.
en_6829	Le cinéaste s'est arrêté à la mercerie en allant au cinéma. Il cherchait une nouvelle bobine.	Le cinéaste s'est arrêté à la mercerie en allant au cinéma. Il cherchait une nouvelle bobine.
en_6829	Le comique s'était arrêté dans un magasin de tissu pour changer la trame de son nouveau spectacle car il pensait avoir l'étoffe d'un metteur en scène.	Le comique s'était arrêté dans un magasin de tissu pour changer la trame de son nouveau spectacle car il pensait avoir l'étoffe d'un metteur en scène.
en_6829	En se rendant à la salle de spectacle, l'humoriste s'arrêta chez le marchand de tissu. Il pensait y trouver de nouvelles idées pour son texte, il cherchait, lui, mais il n'y avait que du textile cher chez lui.	En se rendant à la salle de spectacle, l'humoriste s'arrêta chez le marchand de tissu. Il pensait y trouver de nouvelles idées pour son texte, il cherchait, lui, mais il n'y avait que du textile cher chez lui.
en_6834	Un bébé éprouvette à une chambre avec vue sur mère	Un bébé éprouvette à une chambre avec vue sur mère
en_6834	Peut-on dire qu'un fœtus bénéficie d'une chambre avec vulve?	Peut-on dire qu'un fœtus bénéficie d'une chambre avec vulve?
en_6838	La fille du colonel était plutôt douée en combat au corps à corps.	La fille du colonel était plutôt douée en combat au corps à corps.
en_6838	La fille du colonel n'arrête pas d'infantiliser les fantassins	La fille du colonel n'arrête pas d'infantiliser les fantassins
en_6841	J'ai rencontré un professeur de mathématiques qui a 12 enfants - elle sait vraiment se multiplier.	J'ai rencontré un professeur de mathématiques qui a 12 enfants - elle sait vraiment se multiplier.
en_6842	C'est un fait, les plus grands dorment plus longement au lit.	C'est un fait, les plus grands dorment plus longement au lit.
en_6842	C'est un fait, les gens plus grands dorment plus longtemps au lit.	C'est un fait, les gens plus grands dorment plus longtemps au lit.
en_6842	C'est un fait, les personnes plus grandes dorment plus longtemps au lit.	C'est un fait, les personnes plus grandes dorment plus longtemps au lit.
en_6855	L'autre jour à la ferme j'ai vu un mouton manger de la menthe. Je pense qu'il voulait garder la laine fraîche.	L'autre jour à la ferme j'ai vu un mouton manger de la menthe. Je pense qu'il voulait garder la laine fraîche.
en_6855	Les moutons ont beaucoup de laine. Ils peuvent resister au froid poulaire.	Les moutons ont beaucoup de laine. Ils peuvent resister au froid poulaire.
en_6855	Je regardais un jeune couple au restaurant quand la femme se mit à se gratter agressivement. Elle était piquée.	Je regardais un jeune couple au restaurant quand la femme se mit à se gratter agressivement. Elle était piquée.
en_6855	À la mini ferme, j'ai vu une brebis qui mâchait un chewing-gum pour garder la laine fraîche.	À la mini ferme, j'ai vu une brebis qui mâchait un chewing-gum pour garder la laine fraîche.
en_6855	Je suis allée à une ferme où l'on donnait des chewing-gum aux moutons pour qu'il garde la laine fraîche.	Je suis allée à une ferme où l'on donnait des chewing-gum aux moutons pour qu'il garde la laine fraîche.
en_6858	Un type a avalé une cuillère et a trouvé qu'il ne pouvait pas remuer.	Un type a avalé une cuillère et a trouvé qu'il ne pouvait pas remuer.
en_6858	Un type a avalé une cuillère et s'est aperçu qu'il ne pouvait pas remuer.	Un type a avalé une cuillère et s'est aperçu qu'il ne pouvait pas remuer.
en_686	Ce chevalier jedi a troqué son sabre laser contre une dague laser. Il a dû passer du couteau obscur !	Ce chevalier jedi a troqué son sabre laser contre une dague laser. Il a dû passer du couteau obscur !
en_686	Un jedi a troqué ses bons mots contre des blagues ra-sith. Il est passé du côté sombre de la farce.	Un jedi a troqué ses bons mots contre des blagues ra-sith. Il est passé du côté sombre de la farce.
en_686	Le Chevalier Jedi échangea son sabre laser pour un poignard laser. Il est passé au couteau obscur de la force.	Le Chevalier Jedi échangea son sabre laser pour un poignard laser. Il est passé au couteau obscur de la force.
en_686	Le chevalier Jedi troqua son sabre-laser pour un poignard-laser. Il avait rejoint le couteau obscur de la Force	Le chevalier Jedi troqua son sabre-laser pour un poignard-laser. Il avait rejoint le couteau obscur de la Force
en_686	Le chevalier Jedi échangea son sabre laser contre une dague légère. Il est passé dans le côté sombre de la forge.	Le chevalier Jedi échangea son sabre laser contre une dague légère. Il est passé dans le côté sombre de la forge.
en_6861	Elle a dit qu'elle n'était pas enceinte mais les contractions sont plus prononcées que les mots.	Elle a dit qu'elle n'était pas enceinte mais les contractions sont plus prononcées que les mots.
en_6861	Elle dit qu'elle n'était pas enceinte, mais les contractions sont plus prononcées que les mots.	Elle dit qu'elle n'était pas enceinte, mais les contractions sont plus prononcées que les mots.
en_6865	Les spécialistes en confiture ont tendance à s'étaler sur leur sujet et écrire des tartines.	Les spécialistes en confiture ont tendance à s'étaler sur leur sujet et écrire des tartines.
en_6865	Un orateur qui parle à la lumière de la bougie peut donner des discours enflammés.	Un orateur qui parle à la lumière de la bougie peut donner des discours enflammés.
en_6876	La professeure de maths avait faim, mais il ne lui restait qu'une part de pi-zza froide.	La professeure de maths avait faim, mais il ne lui restait qu'une part de pi-zza froide.
en_6880	Il est cloué par son nouvel emploi dans une usine de soudure.	Il est cloué par son nouvel emploi dans une usine de soudure.
en_6885	Le jeune pin se fit réprimander par son père. Ça sentait le sapin pour lui.	Le jeune pin se fit réprimander par son père. Ça sentait le sapin pour lui.
en_6885	Le jeune sapin s’est fait enguirlander par son père.	Le jeune sapin s’est fait enguirlander par son père.
en_6885	Le petit sapin s'est fait gronder sèvèrement par son père.	Le petit sapin s'est fait gronder sèvèrement par son père.
en_6885	Le rejeton du pin fut admonesté par son père. Apparemment, il se faisait des noeuds.	Le rejeton du pin fut admonesté par son père. Apparemment, il se faisait des noeuds.
en_6885	Le jeune pin s'est fait disputer par son père car il était rentré avec une gueule de bois.	Le jeune pin s'est fait disputer par son père car il était rentré avec une gueule de bois.
en_6885	La taille des roses est un sujet épineux.	La taille des roses est un sujet épineux.
en_6885	Le jeune pin se fit masser par son père. Apparemment il avait quelques nœuds.	Le jeune pin se fit masser par son père. Apparemment il avait quelques nœuds.
en_6885	Le jeune sapin s'est fait enguirlander par son père.	Le jeune sapin s'est fait enguirlander par son père.
en_6885	Le petit sapin s'était fait enguirlandé par son père. Il avait les boules.	Le petit sapin s'était fait enguirlandé par son père. Il avait les boules.
