id_en,text_fr,id,location
en_1007,"['""Il faut sauver les baleines"", jeta Tom avant de se tasser.', '""Il faut sauver les baleines"", interjeta Tom.', 'Moi je sauve les baleines, Tom s’en venta.', 'Louis évent-a le projet de sauvetage des baleines.', '""Sauvez les baleines"", proclama Tom à tout évent.', '""Sauvez les baleines, cracha Toto, Cétacé!""']","['fr_1148', 'fr_6487']","['se tasser', ""cétacé | c'est assez""]"
en_1015,"['Si un citadin a un faible QI, est-ce pour autant que la population niais pas pour quelque chose ?', 'Les habitants de Douai ont-ils un QI élevé ?', ""Si on fait la somme des QI d'une population, est-ce que leur intelligence devient moyenne?"", 'Si tous les habitants d’une ville sont bouchés, est-ce que ça fait plus de bouchons ?']",[],[]
en_102,"[""Le skieur est parti à la retraite. Il n'arrivait pas à remonter la pente.""]",[],[]
en_103,"[""Ma femme écoute du hip hop quand elle cuisine des carottes ou du gruyère. Je n'aime pas ça mais elle me dit que ça l'aide à râper.""]",[],[]
en_1031,['Je rêvais de dormir dans cet hôtel.'],[],[]
en_1033,"['En cuisinant, j\'ai fait tomber un bâton de margarine sur le carrelage en bois, et quand ma voisine a glissé et est tombée, j\'ai dit : ""Ça doit être le parkay"".', 'Quand j\'ai fait du pain, j\'ai mis un morceau de margarine sur le plancher. Quand mon voisin est tombé, j\'ai dit: ""Il y a eu une parkay"".']",[],[]
en_1047,"[""La belle attendait ses amants dans le clocher de l'église, mais le temps passait et aucun ne venait. Elle se disait qu'elle aurait dû savoir si quelque chose clochait."", ""Pablo et José attendaient que Pilar allume le grand Feu avant de la rejoindre à l'église, mais d'aucun ne réagit à la chaleur ne sachant à qui était destiné la femme"", 'Firmin et Henri attendaient tous les deux que Gladys arrive dans leur collocation. Elle appuie sur la sonnette mais personne ne lui ouvre, car aucun des deux ne sait pour qui sonne Gladys.', ""Plabo et José ont attendu un signal de la part de Pilar pour la rejoindre dans la tour de l'église, mais aucun des deux n'a répondu au carillon, car ils ne savaient pas lequel des deux cette cloche sonnait."", ""Pablo et José ont attendu que Pilar leur dise de la rejoindre à dans le clochet de l'église. Ils ont cherché le clochet mais ne l'ont jamais trouvé. Pilar ne dit que des sonnettes."", ""Pablo et Jose attendirent un signal de Pilar pour la rejoindre dans la tour de l'Église, mais ils ne répondirent pas au chant parce qu'ils ne savaient pas pour qui la belle se balançait.""]","['fr_1807', 'fr_7049', 'fr_10913', 'fr_8940']","['Gladys', 'cloche', 'sonnettes', 'Guorrilla']"
en_1051,"[""Un jour, quelqu'un m'a accusé d'avoir volé un timbre de valeur, rare et ancien. Je lui ai dit que, pour porter de telles accusations, il devait être complètement timbré."", ""Quelqu'un m'a accusé d'avoir contrefait les pièces de collections vendues au club de philatélistes. J'ai nié en ajoutant qu'il était timbré."", ""On m'a accusé de voler un vieux timbre de grande valeur, mais je me suis affranchi de ce soupçon."", 'Une fois j’ai été accusé d’avoir volé un vieux timbre rare et précieux, j’ai évidemment nié comme un timbré.', 'Un jour quelqu’un m’a accusée d’avoir volé un œuf de Fabergé très rare, et je n’ai pas pu rester pondéré.', ""Un philatéliste m'a accusé d'avoir volé toute sa collection... Quel timbré, celui-là !"", ""On m'a un jour accusé d'avoir volé des vieux timbres rares qui valaient très cher, ce que j'ai nié en bloc.""]","['fr_12022', 'fr_6331', 'fr_2600']","['timbré', 'pondéré', 'legendes']"
en_1059,['Le pêcheur sifflant était toujours hors de thon.'],[],[]
en_1072,"['Si vous portez un bandeau aux yeux, vous ne saurez pas ce que vous manquez.', 'Si vous portez un bandeau sur les yeux au stand de tir, vous ne saurez pas ce que vous manquez.', 'Si tu portes un bandeau sur tes yeux au stand de tir, tu ne sauras pas ce que tu rates.', 'Si tu portes des yeux au champ de tir, tu ne sais pas ce que tu manques.']",['fr_7187'],['rates']
en_108,"['Les vieux boulangers ne meurent jamais, ils ne gagnent juste plus aussi bien leur pain.', 'Les anciens boulangers ne meurent jamais, ils arrêtent juste de se faire du blé.', 'Les vieux boulangers ne meurent jamais, ils arrêtent juste de gagner leur croûte.', ""Un boulanger qui a fait faillite n'a plus de blé."", 'Les vieux boulangers ne meurent pas, ils ont juste de moins en moins de blé.', 'Les vieux boulangers ne meurent pas, ils arrêtent seulement de gagner leur croûte.', 'Les vieux boulangers ne meurent pas, ils arrêtent juste de se faire du blé', 'Les vieux meuniers ne meurent jamais, ils arrêtent juste de se faire du blé.', 'Les vieux pâtissier ne meurent pas, ils arrêtent de mettre la main à la pâte.', 'Une boulangère ne meurt jamais, seulement, ses problèmes vont croissant.', 'Les vieux boulangers ne meurent jamais, ils cessent seulement de mettre la main à la pâte.', 'Un boulanger ne meurt pas, il est dans le pétrin.', 'À force de se faire mener à la baguette, le boulanger s’est retrouvé dans le pétrin.', 'Les vieux boulangers ne meurent pas, ils ne mettent juste plus la main à la pâte.']","['fr_1910', 'fr_9726', 'fr_14555']","['gagner leur croûte', 'blé', 'pétrin']"
en_1084,"['Je trouve que dans un intérieur rustique, un poêle à bois, ça a vraiment du chien']",[],[]
en_1085,"[""Il réfléchit mieux maintenant qu'il a un miroir."", 'Après avoir acheté un miroir, il est devenu très réfléchi.']",[],[]
en_110,"['""La nourriture a goût de plutonium"", dit Tom, rayonnant.', '""Ce plat a un goût de plutonium"", dit Tom rayonnant.', '""Ah, ce plat a un goût de plutonium!"", fit Tom, rayonnant.', 'Ce plat à un goût de plutonium, dit Tom brillamment.', '""Ça a un goût de plutonium"", conclut Toto, brillament', '"" Ça a un peu le goût d\'uranium non ?\xa0"", demanda Tom, rayonnant.', '""Ça a le goût du plutonium"", dit Tom radieux.', 'Ce plat a goût de plutonium"", dit Tom, radieux', 'Cette nourriture a le goût de plutonium, à dit Tom brillamment.', '"" Ce plat a goût de plutonium "" dit Tom d\'un air radieux.', 'Cette nourriture à un goût de plutonium, dit Tom si brillamment.', 'Ce plat a un goût de plutonium, dit Tom, irradiant la joie.', '""Ce plat a le goût de plutonium"", dit Tom, les yeux brillants et la mine radieuse.', '""Cette nourriture a un goût de plutonium"", dit Tom, les yeux brillants.', '""Ce repas a le goût de plutonium"", dit Tom avec un sourire irradieux.']","['fr_620', 'fr_15433', 'fr_13554', 'fr_9178', 'fr_16351', 'fr_9060']","['brillamment', 'rayonnat', 'Barbe à ras', 'radieux', 'radieux', 'irradiant']"
en_1106,"['Les vieux dactylographes ne meurent jamais, ils perdent juste leur touche spéciale.']",[],[]
en_1107,"[""Cette sauce salade contient trop de vinaigre, dit Tom d'un ton acide."", '""Ce dressing de salade a trop de vinaigre"", dit Tom acidement.', '« Cette vinaigrette à salade contient trop de vinaigre, a dit Tom acidulément.', ""Quel est le comble pour un étudiant en cuisine qui n'arrive pas à faire de sauce salade au vinaigre ? D'être assidu""]",['fr_16077'],['assidu']
en_111,"['Tu sais que le boulanger du coin paye ses employés au blé noir ?', 'On ne peut pas dire que le boulanger du coin paie bien ses employés, il les roule dans la farine.', ""Le boulanger du quartier payait à peine ses employés alors qu'il est plein de blé."", ""Le boulanger local payait son personnel sur la base d'un taux faramineux."", 'Le primeur du quartier paye ses employés selon le salade horaire moyen.']","['fr_13575', 'fr_15198']","['blé noir', 'roule dans la farine']"
en_1120,"['Les vieux politiciens ne meurent jamais, ils ne sont juste plus trop dans leur état normal.']",[],[]
en_1121,"['Certaines personnes pensent que les exercices d’incendie peuvent amener les gens à se blesser dans le feu de l’action.', 'Certaines personnes trouvent les exercices incendie très alarmant', ""Pour certains, les exercices d'incendie sont alarmants."", 'Certaines personnes trouvent les exercices d’incendie plutôt alarmant.', 'Certains trouvent que les sirènes incendies ont un effet alarmant.', 'Certains trouvent les exercices incendie très alarmants.', ""Certaines personnes trouvent les exercices d'incendie alarmants."", ""Certains trouvent les exercices d'évacuation incendie assez alarmants."", ""Certaines personnes trouvent que les exercices d'évacuation incendie très alarmants."", ""Les simulations d'incendie, certains trouvent ça alarmant.""]","['fr_373', 'fr_9256', 'fr_11716', 'fr_14294', 'fr_477']","['alarmant', 'alarmants', 'alarmant', 'alarmants', 'alarmants']"
en_114,"['Un fleuriste ne meurt jamais, seulement, il perd de sa fraîcheur.', 'Un fleuriste ne meurt jamais : il est juste surbooké.', 'Les vieux fleuristes ne meurent jamais parce qu’ils sont de bonne composition.', 'Les vieux fleuristes ne meurent jamais, car ils continuent à voir la vie en rose.', 'Les vieux fleuristes ne meurent jamais, il se composent juste différemment.']",[],[]
en_1144,"['Va chercher Guevara ! cria Toto en havanant', '""Allez! Va chercher mon chien!"", lança Toto.']",[],[]
en_1146,"['Le responsable anti-incendie était toujours mis sur le gril.', 'Le directeur de cabinet posait toujours des questions pressantes.', ""Le chef des pompiers brûlait toujours d'envie de poser des questions importantes"", 'Le capitaine des pompiers se charge toujours des question les plus brûlantes.', ""On laissait toujours le capitaine des pompiers s'occuper des sujets brûlants."", 'On demandait toujours au chef des pompiers des questions brûlantes', 'C’est toujours au chef des pompiers qu’étaient posées les questions brûlantes.', 'Une question brûlait les lèvres du chef des pompiers.', ""On interrogeait souvent le chef des pompiers sur l'actualité brûlante."", ""Le chef des pompiers avait l'habitude de poser des questions brûlantes."", 'Le chef des pompiers se voyait toujours poser les questions les plus brûlantes.', 'Ça nous brûle les lèvres de poser ces questions au chef des pompiers.', 'Le chef des pompiers traitait toujours de sujets brûlants.', 'Le capitaine des sapeur-pompiers posait toujours des questions à chaud.', 'Le capitaine des pompiers devait toujours répondre à des questions brûlantes.', 'Le capitaine des pompiers devait sans cesse répondre à des questions, il était sur des charbons ardents.', 'On posait toujours toujours d’ardentes questions au chef des pompiers.', 'Le pompier devait toujours répondre à des questions brûlantes.', 'Le chef de la caserne était assailli de journalistes enflammés.', 'Le pompier en chef était constamment arrosé de questions brûlantes', 'Le chef des pompiers était souvent pris entre deux feux par les questions explosives.', 'On posait toujours des questions brûlantes au chef des pompiers.', 'Les questions les plus brûlantes étaient toujours réservées au chef des pompiers.', 'Le chef des pompiers avait toujours droit aux questions brûlantes.', 'Le chef des pompiers se voyait toujours poser des questions brûlantes.']","['fr_4104', 'fr_12854', 'fr_8856', 'fr_16348']","['brûlait les lèvres', 'brûlante', 'brûlantes', 'enflammés']"
en_1157,"['Ils ont sué sang et eau avant d’atteindre le sauna et échapper au tueur.', 'Pour échapper au bandit armé, ils se sont cachés dans un sauna, même si ça les faisait suer (d’attendre là).', 'Ils ont échappé au tireur et se sont cachés dans un sauna où ils ont pu s’armer de patience en suant.', 'Leur poursuite jusque dans un sauna par un tueur à gages leur donna des sueurs froides.', 'Ils se sont réfugiés dans le sauna pour échapper au tireur, qui leur a donné des sueurs froides.', 'Ils se cachèrent du tireur dans un sauna où ils pouvaient laisser couler.', ""Ils n'avaient pas froid aux yeux, mais la vue du tireur isolé leur glaça le sang ; blessés, ils suèrent sang et eau pour aller se réfugier dans le sauna, seul abri à proximité."", ""Les passants ont trouvé refuge dans un sauna lors d'une fusillade. On peut dire qu'ils ont eu chaud."", 'Ils se sont cacher du tireur dans un sauna où ils pouvaient évacuer', 'Ils se sont cachés du tireur dans une chambre frigorifique, où ils ont pu garder leur sang froid.', ""Ils s'étaient cachés dans un sauna pour faire croire à leur poursuivant qu'ils s'étaient évaporés"", ""Ils échappèrent au tireur en se cachant dans un sauna, où ils attendirent la fin de l'échauffourée"", 'Ils se sont cachés dans le sauna en attendant que le tireur s’évapore.', 'Ils se sont cachés du tireur dans un champ pour le semer.', 'Pour échapper au tireur, ils se cachèrent dans le sauna. Ils ont eu chaud.', 'Ils se cachèrent du bandit armé, se faufilant dans le sauna si discrètement que rien ne le laissait transpirer.', 'Ils se cachèrent du tireur en se réfugiant dans un sauna, où ils purent transpirer un coup.', 'Poursuivis par un tueur, ils se cachèrent dans un sauna en attendant de trouver un moyen de renverser la vapeur.', 'Cachés dans le sauna pour échapper au tireur, ils ont eu leurs vapeurs.', 'Ils se sont cachés du tireur dans un sauna; ça commençait à devenir chaud !', ""Ils se sont mis à l'abri du tireur dans un sauna afin de prendre la température de la situation.""]","['fr_1688', 'fr_13524', 'fr_370', 'fr_222', 'fr_13884', 'fr_8917']","['sué sang et eau', 'suer', 'sueurs froides', 'sueurs froides', ""n'avaient pas froid aux yeux | glaça le sang | suèrent sang et eau"", 'évaporés']"
en_116,"[""L'astronaute a affirmé avoir découvert une nouvelle étoile, mais personne ne l'a pris au Sirius."", 'Quelle est la boisson énergisante préférée des extraterrestres ? Alpha Centaurine', ""L'astronaute a fait une déclaration sur une étoile bien connue, et ce n'était pas un mentar."", 'En découvrant cette nouvelle étoile, la Russie fit Dombay la chemise.', ""L'astronaute a fait une déclaration sur une étoile bien connue, mais ça n'a pas perse.""]","['fr_16831', 'fr_14879', 'fr_4211']","['Sirius', 'mentar', 'Dombay']"
en_1160,"[""La robe en satin était parfaite. Les deux nœud-nœuds de chaque côté de la mariée n'ont fait que l'embellir.""]",['fr_13917'],['nœud-nœuds']
en_1169,"['Les vieux PROFESSEURS ne meurent jamais, ils perdent juste leur classe.', 'Les vieux profs ne meurent jamais, ils perdent juste leur classe.', 'LES VIEUX PROFESSEURS ne meurent jamais, ils perdent juste leur classe.']",[],[]
en_1171,"['Pasteur était en train de bouillir à propos de ne pas être invité.', 'Pasteur bouillait de ne pas avoir été invité.', ""Le cur de Pasteur s'est bouilli à la suite de son refus d'être invité.""]",[],[]
en_1176,"['Parfois, un taille-crayon est nécessaire pour faire un bon point.', 'Il y a des moments où un outil de pointage est nécessaire pour faire une bonne pointe.']",['fr_12123'],['faire une bonne pointe']
en_1178,['Les cuisiniers ont beaucoup de piment dans leur vie.'],[],[]
en_1181,"[""Les vieux élagueurs ne meurent pas, ils s'enracinent."", 'Les vieux chirurgiens spécialistes des arbres ne meurent pas, mais ils perdent leurs racines.', 'Les garde forestiers ne meurent jamais, ils sont juste déracinés.', 'Un arboriculteur ne meurt pas, il est déraciné.', 'Les vieux élagueurs ne meurent jamais, ils changent de pays et sont déracinés.', 'Les médecins des arbres ne meurent jamais, ils sont juste déracinés.', 'Un élagueur ne meurt jamais, seulement, on le débranche.']","['fr_7651', 'fr_949', 'fr_15437']","['déraciné', 'déracinés', 'débranche']"
en_1184,"[""Le mannequin a avoué que son travail du jour devait sûrement être bâclé, il n'avait fait aucune pose""]",[],[]
en_1195,"[""Un plombier, ça ne meurt pas, ça évacue, c'est tout."", 'Un vieux plombier ne meurt jamais, seulement, ils devient un peu bouché.', ""Les vieux plombiers ne meurent jamais, c'est juste qu'ils ne sont plus bien tuyautés."", 'Les vieux plombiers ne meurent jamais mais ils ont souvent des ennuis de tuyauterie.', 'Les vieux plombiers ne meurent jamais, ils deviennent juste siphonnés.', 'Les plombiers ne meurent pas, seulement, ils peuvent avoir des fuites.']",['fr_14309'],['tuyauté']
en_1204,"['Les chats, en en Afrique du Sud, ont toujours trouvé un gnou pour s’asseoir.', ""En Iran, ils n'aiment pas les chiens ; là-bas, c'est le Shah qui est roi.""]",[],[]
en_1210,"[""Le gardien d'un grand cimetière était important parce qu'il avait 5000 personnes sous lui."", ""Le jardinier d'un grand cimetière était important parce qu'il comptait 5 000 personnes sous lui."", ""Le gardien de terrain d'un grand cimetière était important parce qu'il avait 5000 personnes sous lui.""]","['fr_11183', 'fr_16639']","['ne se donnait pas les moyens', 'sous']"
en_1211,"['Un petit garçon appelait son père qui faisait des ballons ""pop"".']",['fr_9670'],['pop']
en_1223,"['Castre ton chien, mieux vaut prévenir que courir après des chiots.', 'Fais châtrer ton chien, mieux vaut prévenir que maudire.', ""Stérilisez vos toutous : un chien vaut mieux que deux tu l'auras"", ""Faites stériliser votre animal : un chien vaut mieux que cinq tu n'auras."", ""Stérilisez vos animaux de compagnie: un peu de prévoyance vaut mieux qu'une portée de responsabilités."", ""J'aurais dû te prévenir plus tôt de castrer ton chien, mais mieux vaut bâtard que jamais.""]","['fr_5004', 'fr_9211']","['mieux vaut prévenir que maudire', 'bâtard']"
en_1227,"[""Il m'a recommandé le restaurant et il m'a dit qu'il n'avait pas de réservation.""]",[],[]
en_1231,"[""Le mortician tardait à dîner parce qu'il était enterré dans son travail.""]",['fr_7311'],['enterré']
en_1232,"['Les vieux recenseurs ne meurent jamais, mais ils ne ressentent plus rien.']",[],[]
en_1233,"['La classe a visité un abattoir, ils sont revenus abattus.']",['fr_13161'],['abattus']
en_1248,"[""Non le pilote n'est pas devenu fou, il traverse simplement une période de turbulences."", 'Les vieux pilotes ne meurent jamais, ils gagnent juste en turbulence', 'Un pilote ne meurt jamais, seulement, il traverse des zone trous de mémoire.', 'Un pilote ne meurt pas, il devient turbulent.', 'Un vieux pilote ne meurt pas, il devient turbulent.', 'Les vieux pilotes ne meurent jamais, ils deviennent plus turbulents.', 'Les pilotes ne meurent pas, seulement, ils deviennent turbulents.', 'Les vieux pilotes ne meurent jamais, ils ont seulement du mal à garder les pieds sur terre.', 'Les vieux pilotes ne meurent pas, ils traversent juste quelques turbulences.', 'Les vieux pilotes ne meurent jamais, ils deviennent juste plus turbulents.', ""Les pilotes vieillissant ont l'air un peu perturbés."", 'Les vieux pilotes ne meurent jamais, ils deviennent simplement plus turbulents.', 'Les vieux pilotes, au lieu de mourir, deviennent de plus en plus turbulents.', ""Les vieux pilotes ne meurent jamais, ils s'envolent juste vers de nouveaux horizons."", 'Les anciens pilotes ne meurent pas, ils deviennent plus turbulents.', 'Les vieux pilotes ne meurent pas, il perdent juste la houle.', 'Les vieux pilotes ne meurent jamais, ils finissent tous dans une boîte noire.', 'Une pilote ne meurt jamais, seulement, elle a la tête dans les nuages.', 'Les anciens pilotes ne meurent pas ils deviennent juste plus turbulents.']","['fr_2234', 'fr_15847', 'fr_13042']","['air', 'turbulents', 'turbulents']"
en_1249,"['""Ca me hérisse les poils quand tu utilises ma brosse à dent !"" s\'écria Tom.', '""Utilise ta propre brosse à dents !"", dit Tom, un poil hérissé.', '""Utilise ta propre brosse à dents"", hurla Tom les poils hérissés.', '""Utilise ta propre brosse à dent !"" se hérissa Tom.', '""Tu as intérêt à utiliser ta propre à dents !"". La menace fit dresser les poils de Toto.', '""C’est ma brosse à dent !"" Dit Tom d’un ton acariâtre.', 'Utilise ta propre brosse à dents !, dit Tom, un poil hérissé.']","['fr_5986', 'fr_14281']","['brosse à dent | hérissés', 'hérissé']"
en_1252,"[""Ma femme a envie d'exposer de la céramique raku mais elle a peur de faire un four."", ""Ma femme s'est mise à la poterie. Les chamotes sont cuites."", ""Après être tombée chez le potier, ma femme à dû rembourser les dégâts. J'imagine qu'elle ne fait que payer les pots cassés."", ""Ma femme m'a emmenée à un cours de potterie ce matin, mais j'étais vaseuse""]",['fr_13194'],['four']
en_1254,"['""Je ne vous dirai pas quoi que ce soit sur mes glandes salivaires"", dit Tom de manière secrète.', '""Je ne vous dirai rien à propos de mes glandes salivaires"", dit Toto secrètement.', '""Je ne vous dirai rien de mes glandes salivaires,"" a dit Tom secrètement.', 'Quel est le comble pour les glandes salivaires ? De ne pas savoir garder un secret.']",['fr_14769'],['secrètement']
en_1256,"[""Je pense que je vais retourner à la fac, quelqu'un m'a parlé dun cours que j'ai envie de suivre. Ce n'est pas du second degré.""]",[],[]
en_1262,"[""Les jeunes mariés adorent passer leur lune de miel en Irelande parce qu'il y a de l'amour dans l'Eire"", ""L'Irlande n'a l'Eire de rien mais il n'y a patriquement que des beaux paysages !"", ""Les vacances en Irlande c'est ce qu'il y a de mieux pour se mettre au vert.""]","['fr_14284', 'fr_10229']","[""l'amour dans l'Eire"", 'Eire | patriquement']"
en_1269,"[""Qui est votre ténor opératique préféré ?''Tom a demandé plaicidement."", ""Qui est votre ténor d'opéra préféré ?' demanda Tom placidement.""]",[],[]
en_1270,"[""Le sel a dit bonjour au poivre, c'était des salutations assaisonnées.""]",['fr_1079'],['assaisonnées']
en_1271,"['Le livre sur le Teflon ne contenait pas de personnages frictionnels.', 'Le livre sur le Téflon ne contenait aucun personnage de friction.']",[],[]
en_1273,"[""Trois doigts étaient prêts à coopérer, mais le pouce et l'index étaient opposés."", ""Trois doigts étaient d'accord de coopérer, mais le pouce et l'auriculaire s'y opposaient."", ""Trois doigts sont prêts à coopérer mais le pouce et l'index s'y opposent.""]",['fr_12862'],['opposaient']
en_1279,"['Si vous passez trop de temps dans le café, vous serez latte pour le travail.']",['fr_9054'],['latte']
en_1282,"['Dans les temps anciens, les navires de mer étaient beaucoup plus économes en carburant. Ils pouvaient parcourir des milliers de kilomètres au galion.']",[],[]
en_1283,"[""Certains ont peur des vaccins, mais je sais qu'ils sont immunoffensifs"", 'Certains se piquent de ne pas se faire vacciner', ""Certaines personnes refusent de se faire vacciner contre la grippe, c'est atypique.""]",['fr_13647'],['se piquent']
en_1294,"['""Faisons comme si on était avant qu\'il n\'existe des trains"", fit Tom avec diligence.', '""Imagine que nous sommes au temps des voitures à cheval"", dit Toto avec diligence.', '""Faisons comme si nous vivions avant l\'invention du rail"", dit Tom d\'un ton diligent.', ""Faites comme si on était avant l'invention du chemin de fer, dit Tom avec entrain."", '“Faites comme si nous étions à l\'époque précédant les chemins de fer"" railla-t-il.', '""Fait comme si nous étions à l\'époque où les trains à vapeur n\'existaient pas"", siffla Tom.', '""Fait comme si nous étions à l\'époque d\'avant le chemin de fer"", railla Tom.', '""\xa0imaginez que nous sommes à l\'époque où les chemins de fer n\'existaient pas,\xa0"" a véhiculé Tom.', '""Faites semblant que tout ça se passe avant l\'invention des chemins de fer"" diligenta Tom.', '""Fais comme si on vivait à une époque où le chemin de fer n\'existait pas encore"", charria Tom.', '""Faisons comme si nous étions au temps des Romains"", charria Tom.', '""Faisons comme si les trains n\'avaient pas encore été inventés"", dit Tom avec diligence.', 'Tom nous mit sur les rails en disant: ""Imaginez que nous sommes avant l\'époque des chemins de fer"".', '""Faisons comme avant l\'invention du train"" proposa Tom avec diligence', ""Faites comme si le chemin de fer n'existait pas encore, dit Tom avec entrain."", '"" Fais comme s’il n’y avait aucune voie ferrée\xa0"" Tom entraîne-t-il.']",['fr_8136'],['siffla']
en_1303,"['les vieux principales ne meurent jamais, ils perdent juste leurs facultés.', 'Les vieux principaux ne meurent pas, ils perdent seulement leurs facultés.', 'Les vieux proviseurs ne meurent pas mais ils perdent leurs facultés.', ""Un doyen d'université ne meurt pas, il perd ses facultés."", 'Les anciens directeurs ne meurent pas, ils perdent leurs facultés.', 'Les doyens ne meurent jamais, ils perdent juste leurs facultés.']","['fr_7687', 'fr_14503']","['facultés', 'facultés']"
en_1305,"['Les vieux cheminots ne meurent jamais, ils déraillent.', 'Les vieux RAILROADERS ne meurent jamais, ils déraillent.', 'LES VIEUX RAILROADERS ne meurent jamais, ils déraillent simplement.', 'Les vieux employés des chemins de fer ne meurent jamais, ils déraillent.']",[],[]
en_1310,"['Il a acheté un petit marteau à viande pour pouvoir casser la croûte, du poulet au sel.', ""Il avait acheté une assiette à quatre coins pour pouvoir manger entre quat'zœufs."", 'Il avait acheté une assiette à quatre coins. Maintenant, tout ce qu’il mangeait était carrément bon.']",['fr_6261'],['carrément']
en_1330,"['Maintenant qu’ils étaient en appartement, ils n’avaient plus besoin de tondre la pelouse, sup-herbe !', 'Ils ont déménagé en appartement pour ne plus avoir à tondre le gazon. Maintenant, ça gaze pour eux !']","['fr_6652', 'fr_7783']","['sup-herbe', 'ça gaze pour eux']"
en_1335,['La gravité à tendance à rabaisser les gens.'],[],[]
en_1345,"['Le scorpion dit au désert : ""À chaque fois que l\'on se parle tu me lances des piques""', 'Le scorpion dit au désert : « Tu sais, nos conversations sont toujours si sèches ».']",['fr_245'],['piques']
