id_en,text_fr,id,location
en_258,"[""Les régimes, c'est pour les gens qui en ont gros."", ""Les régimes, c'est bon pour les gens qui ont bavé des ronds de citron."", ""Les régimes sont pour ceux qui n'en pèsent plus."", 'Les régimes sont faits pour les gens forts et qui en ont marre de l’être.', 'Les régimes sont pour les gens qui en ont gros sur la patate.', ""Le régime, c'est pour les gens qui en ont gras sur le cœur."", 'Certaines diètes sont dignes de vrais régimes totalitaires.', 'Les régimes sont faits pour ceux qui en ont gros sur la patate', 'Les buffets à volonté, moi ça me gave.', 'Les régimes sont faits pour les gens qui ont en gros sur la patate.', '"" J’en ai gros sur la patate ! - Essaie ce nouveau régime. ""', ""Le régime, c'est pour les gens qui en ont ras-le-bol de tout."", 'les régimes aident ceux qui ont en gros sur le cœur.', 'Les régimes sont faits pour ceux qui ne peuvent plus supporter leur poids.', 'Les régimes sont faits pour les personnes qui en ont gros sur la patate.', 'Les régimes sont faits pour ceux qui en ont gros sur la patate.', 'Pour suivre un régime, il faut une grosse motivation et de minces excuses.', ""Les régimes sont pour les gens qui ont lard de s'en préoccuper."", 'Les régimes, c’est pour ceux qui en ont gros.', 'Les régimes sans gluten sont pour les gens allergiques obèse-personne.', ""Les régimes, c'est pour les gens qui en ont plein le bol.""]","['fr_7594', 'fr_10952', 'fr_15147', 'fr_4934', 'fr_16102', 'fr_546', 'fr_1366']","['en ont gros', ""n'en pèsent plus"", 'gros sur la patate', 'gros sur la patate', 'gros sur la patate', 'en ont gros', 'plein le bol']"
en_2585,"[""Lorsqu'on m'a demandé si j'étais bilingue ou non, j'étais sur le point de répondre que je connaissais le langage des signes, mais je me suis dit que c'était un point de détail.""]",[],[]
en_2595,"[""Je m'appelle Ovide. Je suis spécialisé dans les inventaires de liquidation."", 'Je m’appelle Madeleine et je suis spécialisée dans la vente de gâteaux au détail.', 'Je me présente: Monsieur Néanstoque, Jean Néanstoque. Je suis spécialisé dans les soldes.']",[],[]
en_2602,"[""Les bébés plus petits peuvent être livrés par des couleuvres, mais les bébés plus lourds ont besoin d'une grue."", ""Les bébés plus petits peuvent être livrés par cigogne, mais les plus lourds ont besoin d'une grue."", ""Les petits bébés peuvent être mis au monde par une cigogne, mais les plus lourds ont besoin d'une grue."", 'La cigogne livre les bébés les plus légers, et la grue livre les plus lourds.', ""Les cigognes s'occupent des bébés les plus petits et les grues des bébés les plus gros.""]",['fr_2155'],['grue']
en_2606,"[""Quand les prêtres ont fini de lire le journal, est -ce qu'ils sont supposés proclamer les bonnes nouvelles?"", 'Chaque fois que les prêtres ont une idée originale, on leur demande de l’enterrer.', 'Quand les prêtres ont une bonne idée, ma foi, il doivent la soutanir.']",['fr_8093'],['enterrer']
en_2614,"[""Les trafiquants d'alcool ne meurent pas, disent-ils."", 'Un bouilleur de cru ne meurt jamais, seulement, son raisonnement devient de plus en plus alambiqué', 'Les vieux bouilleurs de cru ne meurent jamais, ils se liquéfient simplement.']",[],[]
en_2616,"['Les accrocs au shopping ne meurent jamais, ils finissent seulement en solde.', 'Les addicts du shopping ne meurent jamais, ils souffrent de différentes ruptures.', ""Les accros du shopping ne meurent pas, ils partent à l'a-vente-ure.""]",['fr_6882'],['rupture']
en_262,"[""Tout le monde connaissait ce savant fou qui sortait en ville couvert d'un chapeau hanté."", 'Le savant fou dans son vieux château a un mystérieux secret… et il ne l’a toujours pas sorti de son château.', 'Le savant fou qui habitait le vieux chateau cachait un secret sous son chapeau: un crâne chauve-souris.']",[],[]
en_2622,"['Les vieux engins de formation ne meurent jamais, ils sont juste déraillés.', 'Les vieux ingénieurs du train ne meurent jamais, ils déraillent juste.', 'Les vieux mécaniciens de train ne meurent jamais, seulement, ils sont déraillés.', 'Les vieux concepteurs de trains ne meurent jamais, ils sont juste déraillés.']","['fr_12583', 'fr_5694']","['déraillés', 'déraillent']"
en_2626,"[""Après s'être fait farfeluer par ses amis et avoir été frappé avec un panier, Aron savait qu'ils avaient un sens de l'humour en osier.""]",[],[]
en_2630,"['Les pionniers nucléaires ont découvert un élément de surprise.', 'Les premiers expérimentateurs nucléaires ont découvert un élément de surprise.']",[],[]
en_2632,"[""Quand des pièces de monnaie sont tombées dans la pâte, c'est un gâteau riche."", ""Lorsque des pièces de monnaie sont tombées dans la pâte, il s'est avéré que le gâteau était riche."", ""Quand certaines pièces sont tombées dans la pâte, il s'est avéré être un gâteau riche.""]",[],[]
en_2651,"['Le professeur de maths était un bon danseur - il avait un algorithme.', 'Le prof de maths était un bon danseur - il avait un algorithme.', 'Le professeur de maths était un bon danseur - il possédait un algorithme.', 'Le professeur de maths était un bon danseur - il possédait des algorithmes.']",['fr_3852'],['algorithmes']
en_2662,"[""Il y avait un panneau sur la pelouse dans un centre de traitement de la drogue qui disait : « Ne vous approchez pas de l'herbe »."", 'Il y avait un panneau sur la pelouse d\'un centre de re - habillage de médicaments qui disait ""Ne touchez pas à l\'herbe"".']",[],[]
en_2664,"['Les vieux boulangers ne meurent jamais, ils ne sont juste plus très fougasses.', 'LES VIEUX HOMMES DE PAIN ne meurent jamais, ils perdent juste leur pâte.', 'Les vieux boulangers ne meurent jamais, ils arrêtent juste de gagner leur croute.', 'Les vieux boulangers ne meurent jamais, ils perdent juste leur pâte.']",[],[]
en_2665,"['Les vieux pyromanes ne meurent pas, ils tentent de rallumer la flamme.', 'Les vieux pyromanes ne meurent jamais, ils perdent juste leur étincelle.', 'Les vieux pyromanes ne meurent jamais, ils perdent juste la flamme dans leurs regards.']","['fr_14876', 'fr_591']","['étincelle', 'flamme']"
en_2666,"['Deux sociétés minières ont fusionné pour devenir des alliages.', 'Deux compagnies minières se sont fusionnées pour former des alliages.', 'Deux sociétés minières ont fusionné et sont devenues des alliages.', ""C'est deux entreprises d'exploitations minières ne s'appréciaient guères mais choisirent quand même de fusionner leurs activités. C'était un alliage de raison."", 'Deux sociétés minières ont décidé de fusionnés leurs forces et de former un alliage.', 'Deux compagnies minières ont fusionnées et fait alliage.', 'Deux usines de métal ont fusionné. Les locaux ont fière ALUre.']","['fr_2242', 'fr_12417']","['alliages', 'alliage']"
en_2667,"[""J'ai invité mon ami à dîner. On a mangé pendant 20 minutes puis il s'est évanoui à nouveau.""]",[],[]
en_2676,['Certains chats ont des yeux persans.'],[],[]
en_2686,"['En Asie, un vice de construction est un véritable coup de bambou pour les victimes.', ""En s'approchant du pôle magnétique, il s'est retrouvé déboussolé""]",[],[]
en_2705,"['Quand les infirmières ont une mauvaise journée, elles continuent à aiguillonner les gens.']",[],[]
en_2712,"[""Sa femme adorait la poterie, mais pour lui c'était juste grès chiant.""]",['fr_7887'],['grès']
en_2714,"[""Je n'ai pas assez de sous pour acheter l'église ! - Ne vous en faites pas, vous pouvez prier en trois fois."", ""Prier à l'avance."", ""Priez à l'avance.""]",['fr_5485'],['prier']
en_2718,"['Les vieux programmeurs ne meurent jamais, ils ont bien trop Acer.']",[],[]
en_2719,"['Allons à la salle de gym et prenons du poids un moment.', 'Allons à la salle de muscu poids-reauter un moment', 'On est parti de la salle de muscu pour nous déshaltèrer', 'Si toutes les machines sont prises, on attendra, ça ne se fait pas de pousser à la salle', 'Prend rendez-vous chez le docteur et sois patient', ""On a qu'à poidsreauter devant l'entrée de la salle de sport.""]",['fr_756'],['prenons du poids']
en_2729,['Je me suis cassé la cheville au bal de promo. Au moins ma partenaire de danse a compris que je craquais pour elle.'],['fr_2590'],['craquais']
en_2735,['Ne laisse pas l’adversité se mettre en travers de ton chemin surtout si tu es en train de conduire.'],[],[]
en_2736,"['Les vieux dessinateurs ne meurent jamais, ils croquissent la vie à pleine dent.']",['fr_11129'],['croquissent la vie à pleine dent']
en_2739,"['Pour les entreprises de cartes de vœux, leur destin est dans les cartes.', 'Pour les compagnies de cartes de vœux leur sort est dans les cartes.', 'Pour les compagnies de cartes de vux, leur sort est dans les cartes.']",['fr_7437'],['cartes']
en_2740,"['Son partenaire et lui, fabriquaient des couteaux, et ils se partageaient le gâteau.', ""Lui et sa partenaire étaient dans l'industrie des couteaux, ils ont partagé de manière éCOUTEAble."", ""Elles s'étaient associées toutes les deux pour cette vente de couteaux, alors elles ont coupé la poire en deux."", 'Ils étaient les deux patrons de leur fabrique de couteaux mais ils avaient du mal à trancher en cas de désaccord.']","['fr_4613', 'fr_3151']","['se partageaient le gâteau', 'précipitation']"
en_2746,"[""Si vous brûlez la bougie aux deux extrémités, vous n'êtes pas aussi brillant que vous le pensez."", ""Si vous brûlez la bougie par les deux bouts, vous n'êtes pas aussi brillant que vous le pensez.""]",[],[]
en_2747,"['Tom et son groupe se sont mis d’accord pour jouer un La, un Do dièse et un Mi majeur.', ""Jouons donc un la, un do dièse et un mi, s'écrie la bande de Tom de concert."", '""Jouons un la, un do puis un mi"" s\'écrièrent les membres du groupe de Tom d\'un seul chœur.', '""Jouons tous un la, un do dièse et un mi"", s\'exclamèrent les membres du groupe de Tom en harmonie.', ""Allez les gars, on joue un la, un do dièse et un mi, cria le groupe de rock de Tom à l'unisson."", 'Jouons tous un la, un do dièse et un mi s’exclama le groupe de musique de Tom à l’unisson.', '""On va tous jouer un la, un do dièse et un mi"" s\'exclamèrent les membres du groupe de Tom à l\'unisson.', ""Les choristes sont tombés d'accord pour chanter La, Do, Mi"", ""Jouons tous un mi, un do dièse et un la s'écrièrent les musiciens à l'unisson."", '""On commence par un La, ensuite un Do dièse puis on finit par un Mi,"" s\'époumona la chorale de Tom en harmonie.', '""Chantons un LA"", dit Toto, au diapason.', '""Jouons un la, un do dièse et un mi"", s\'accorda d\'une voix aiguë la bande de Tom.', 'D’un commun accord, le groupe de Tom a décidé de d’abord jouer un la, puis un do dièse et enfin, un mi.', 'Agacé, mon prof de guitare m’a dit de ne pas trop tirer sur la corde.', 'Nous jouerons tous un La, un Do dièse et un Mi, cria le groupe de Tom en chœur.', '""Jouons tous un A, un C dièse et un E"" tonna tout le groupe de Tom d\'un commun accord', ""Jouons un la, un do dièse et un mi, s'est écrié le groupe de Tom d'un seul accord."", ""Jouons, un la, un do dièse, et un mi, s'écrièrent Tom et ses musiciens d'un commun accord."", ""D'un commun accord, Tom et son groupe ont décidé de jouer la même note."", ""Jouons un la, un do dièse et un mi, cria le groupe de Tom d'un même accord."", '""Jouons tous un la, un do dièse et un mi,"" s\'écria le groupe de Tom d\'un même accord.', 'Jouons un LA, un DO dièse, et un MI, s’écrièrent les musiciens du groupe de Tom sur le même ton.', 'Jouons un la, un do dièse et un mi, cria l’orchestre de Tom à l’unisson.']","['fr_15235', 'fr_5832', 'fr_10109', 'fr_10379', 'fr_5705', 'fr_5797', 'fr_4625', 'fr_5294']","['harmonie', ""à l'unisson"", ""à l'unisson"", 'au diapason', ""s'accorda"", 'en chœur', 'accord', 'accord']"
en_275,"['Son tube digestif la faisait beaucoup souffrir, comme si elle était victime de querelles intestines.', ""En apprenant qu'elle avait un problème au niveau de ses yeux, je comprends qu'elle ait été d'humeur aqueuse."", ""Je n'ai plus de varice, quelle veine !"", ""Les vaisseaux gonflés sur ses jambes étaient très querelleurs pour pas grand chose, on peut dire qu'ils étaient sanguins.""]",[],[]
en_2752,"['Les vieux magiciens ne meurent jamais, ils disparaissent juste.', 'Les vieux magiciens ne meurent jamais, ils jouent des tours.', 'Les vieux MAGICIANS ne meurent jamais, ils disparaissent.', 'LES VIEUX MAGICIENS ne meurent jamais, ils disparaissent simplement.', 'Les vieux magiciens ne meurent jamais, ils disparaissent.']",[],[]
en_2756,"[""Les missionnaires aiment les voitures à capot parce qu'elles sont convertibles.""]",[],[]
en_2757,"[""Un petit garçon a rogné ses crayons de couleur parce qu'ils ne se sont pas pointés."", 'Ce petit garçon voulaient mettre à la porte ses plum’ mauvais crayons de couleur parce qu’ils ne se pointaient jamais au bouleau. Finalement, ils en ont eu marre, c’est eux qui se sont taillés.', 'Un petit garçon a viré ses crayons de couleur à cause de leur manque de vivacité.', ""Un petit garçon a dû mettre à la porte ses plumes mauvais crayons de couleur parce qu'ils ne se pointaient pas / jamais au bouleau.""]",['fr_16175'],['vivacité']
en_2767,"['Les vieux fermiers ne meurent jamais, ils deviennet des légumes.', 'Les vieux fermiers ne meurent jamais, ils se transforment juste en légumes.', 'Les vieux fermiers ne meurent jamais, ils se transforment simplement en légumes.', 'LES VIEUX AGRICULTURES ne meurent jamais, ils se transforment en légumes.', 'Les vieux fermiers ne meurent jamais, ils deviennent juste des légumes.']","['fr_10025', 'fr_13283']","['légumes', 'taillée']"
en_2774,"[""Je m'appelle Manu, et je suis dans la manucure"", ""Je vais chez Pat' pour me faire une manucure."", ""Je m'appelle Manu. Je suis manucure."", ""Je m'appelle Germain Douce, je suis manucure.""]","['fr_6726', 'fr_9724']","[""Pat'"", 'Manu']"
en_2779,['Pavlov bavait à cette idée.'],[],[]
en_2780,"[""Le garçon qui a été électrocuté n'a pas pu donner de déclaration car il était encore choqué par l'incident.""]",[],[]
en_280,"['""Je nierai tout"", confessa Thomas', ""Monsieur l'agent, je n'ai pas ma carte verte, dit Tom avec assurance."", '""Je n\'ai rien vu"", dit Tom d\'un air entendu.', ""Je reste sourd à vos accusations, dit Tom d'un air entendu."", '""\xa0Je n’ai rien écouté "" dit Tom d’un air entendu.', 'Je ne vois pas du tout de quoi vous voulez parler, dit Tom, ça doit être un malentendu.', 'Je démens tout"" dit Tom avec un regard fou.', ""Je ne vois pas du tout de quoi vous voulez parler, dit Tom d'un air entendu."", '"" Pas la peine de crier, je suis sourd "", répliqua Tom d’un air entendu.', '""Je n\'ai pas coupé ce bois"", déclara sciemment Tom.']","['fr_14691', 'fr_6832', 'fr_11325']","['air entendu', 'air entendu', 'démens']"
en_2805,"[""Le chat a pris des cours d'informatique dans l'espoir de maîtriser sa prise sur une souris."", ""Le chat a pris des cours d'informatique dans le but de se familiariser avec la souris."", ""Le chat a pris des leçons d'ordinateur dans l'espoir de maîtriser son emprise sur une souris.""]","['fr_10223', 'fr_313']","['souris', 'souris']"
en_2814,"['La symbologie te menera à ta rune.', ""Étudier les anciens alphabets c'est comme courir à sa rune."", ""L'étudiant en symboles ancien court à sa rune"", ""L'étude des symboles anciens vous mènera à la rune."", ""En investissant dans la recherche d'alphabets anciens vous allez vers la rune."", ""L'étude des symboles anciens vous conduira à rune.""]",[],[]
en_2820,"['“Si je lâche le plafond, tout va s’effondrer"", maintient Tom.', '""Si je lâche le plafond, il va s\'effondrer,"" soutint Tom.', '""Si je lâche le toit il va s\'effondrer"", soutint Tom.', '"" Si je lâche le plafond, il va s\'écrouler "", soutient Tom.', '""Si je lâche le plafond, il va s\'écrouler"" soutenait Tom.', '""Si je n\'étais pas là, le monde s\'écroulerait"", soutenait Toto.', '""Si je lâche le plafond il va s\'effondrer"", maintient Tom.', '""Si j\'arrête de tenir le plafond, il va s\'effondrer"", a soutenu Tom.', '""Si je lâche le plafond, il s\'effondrera"" maintint Tom', '"" Si je lâche le plafond, il va s\'écrouler\xa0"", maintint Tom.', '""Si je lâche le plafond, il va s\'effondrer"", maintint Tom.', ""Si je lâche le plafond, il va s'effondrer, a soutenu Tom.""]","['fr_8726', 'fr_10000', 'fr_8916', 'fr_9877']","['maintient', 'soutient', 'soutenait', 'a soutenu']"
en_2823,"['Quand j’ai entendu les antilopes arriver, je me suis mis à gnoux.', 'J’ai appris que les fourmis allaient nous envahir en regardant une émission à l’antenne.', ""J'ai appris l'arrivée des oies sauvages en lisant le canard."", ""Si les antilopes décidaient de prendre le pouvoir, elles mettraient l'humanité à gnous.""]",['fr_971'],['canard']
en_2828,"['""Je brûle des substances aromatiques,"" dit Tom, encensé.']",[],[]
en_2829,"[""La compagnie de bois d'uvre a réduit ses effectifs. Elle s'est débarrassée du bois mort."", ""La compagnie de bois d'uvre s'est réduite. Elle a éliminé le bois mort."", ""L'entreprise de bois a réduit ses effectifs. Ils se sont débarrassés du bois mort."", ""La société du bois a été déclassée, elle s'est débarrassée du bois mort.""]","['fr_12739', 'fr_16001']","['bois mort', 'bois mort']"
en_2832,"[""Vous avez demandé à apprendre le français rapidement, alors, je vais faire court: on les appelle des leçons parce qu'elles le sont""]",[],[]
en_284,"['Les vieux cordonniers ne meurent jamais, ils ont juste besoin de pompes funèbres', 'Les vieux cordonniers ne meurent pas, ils perdent les piedales.', 'Les vieux cordonniers ne meurent jamais, ils sont juste à côté de leurs pompes']",['fr_16017'],['pompes funèbres']
en_2840,"['La poudrière a été inventée dans un flash.', 'La poudre à canon fût inventée en un éclair.']",['fr_12653'],['flash']
en_2842,"['Il se muove, dit Galileo, en mouvement.']",[],[]
en_2843,"[""Quand j'ai demandé à l'homme comment il était devenu un éboueur de fossé, il a dit qu'il venait de tomber dedans."", ""Lorsque j'ai demandé à l'homme comment il était devenu un creuseur de fossés, il a répondu qu'il était simplement tombé dedans.""]",['fr_512'],['tomber dedans']
en_2846,"['Je vends tout ça avant que je ne le brise, dit Toto en soufflant', '""Tiens, il y a du vent, il y a des feuilles qui volent, il y a des nuages…"", souffa Toto en brassant de l\'air', ""Ce n'est pas la bonne direction, dit Toto en faisant la pirouette""]",['fr_3765'],['pirouette']
en_2851,"[""Son idée d'entreprise de fabrication de marteaux ne valait pas un clou."", 'La gestion de son entreprise de ciseaux à nécessité des coupes budgétaires.', ""Il avait un projet de fabrication de ciseaux à bout piquant, mais finalement ça n'a pas ponctionné."", ""Son projet de fabrication de chaussures n'a juste pas marché."", 'Il voulait monter une entreprise de fabrication de ciseaux mais son idée a coupé court.', ""Il voulait fabriquer des couteaux mais il s'y est pris comme un manche."", 'Le plan d’affaires pour monter son entreprise de ciseaux n’a pas permis de percer.']","['fr_15852', 'fr_5469']","['marché', 'percer']"
en_2852,"['Quand un juge est en train de prononcer une condamnation à la guillotine, il ne vaut mieux pas le couper !', ""S'il y a une personne dont vous ne devez pas contester le jugement, c'est un magistrat!""]",[],[]
en_2857,"[""Le professeur de calcul a essayé de garder ses élèves à l'ouvrage, mais la discussion en classe ne cessait de prendre des tangentes."", 'Le professeur de calcul a essayé de garder ses élèves en mission, mais la discussion de classe a continué sur les tangents.']",[],[]
en_286,"[""Complimenter, c'est relâcher l'ex-pression"", 'Louer quelqu’un c’est aussi savoir se l’approprier.', ""Faire un compliment, c'est steamuler l'esteame de soi."", ""Complimenter quelqu'un, c'est relâcher l'impression.""]","['fr_6939', 'fr_1753', 'fr_9360']","[""relâcher l'ex-pression"", 'steamuler | esteame', 'bouchée']"
en_2868,['Les chiens possèdent-ils des clebs USB ?'],['fr_2757'],['clebs USB']
en_2875,"['Quand on a dit au père qu’il allait avoir des jumelles, on a dû s’y reprendre à deux fois pour qu’il comprenne.', ""Depuis qu'il avait appris qu'il était le père de septuplés, il ne savait plus comment tenir ses comptes."", ""Quand ce père a découvert qu'il avait des septuplés, il a fallu qu'il stats pour s'assurer qu'il ne rêvait pas.""]",['fr_4778'],"[""qu'il stats""]"
en_2893,['Les mathématiciens sont obsédés par le nombre de kilomètres au compteur.'],[],[]
en_2904,"[""Pour beaucoup, le snooker n'a ni queue ni tête."", ""Il y a des gens qui n'ont pas la queue d'une idée de comment jouer au billard."", ""Quand il s'agit de jouer au billard anglais, certains n'ont queue faire des règles"", ""Comment on joue au billard américain ? Je n'en ai pas la queue d'une idée!"", ""L'important pour progresser au billard, c'est de se dire qu'on tient le bon bout."", ""Il y a des gens, quand on les voit jouer au billard, ça n'a ni queue ni tête !"", 'Quand il s’agit de jouer au billard, certains ont les boules.']",['fr_2562'],['queue']
en_291,['Une entreprise de fabrication de couverts a été construite à une fourche dans la route.'],[],[]
en_2910,['Le cultivateur de maïs avait de sacrés épis.'],['fr_4706'],['épis']
en_2912,"[""C'est un article un peu long sur la classe guerrière au japon féodal mais je peux t'exposer le sujet samuraïment"", 'Il a fait un sketch sur les combats japonais, quel sumoriste !']",[],[]
en_2913,"[""Un bon boulanger ne vous laissera jamais tomber : c'est levain qu'il puisse faire."", ""Un bon boulanger est toujours en levure d'élever son art, d'aller toujours croissant."", 'Un bon boulanger se doit d’être à la hauteur, sinon il est dans le pétrin.', 'Un bon boulanger se monte toujours à la hauteur. Ça, je te le vure.', 'Un bon boulanger met la main à la pâte.', ""Un bon boulanger se montre toujours à la hauteur ; c'est levain qu'il puisse faire.""]","['fr_13628', 'fr_8969']","['il est dans le pétrin', 'levain']"
en_2916,"[""Après avoir avalé un ver de terre vivant, Jimmy s'est assis en attendant avec un souffle appâté pour voir s'il serait malade.""]",[],[]
en_2923,"[""Un croisement entre un rat et un chien, c'est un chien en-rat-gé."", 'Si on croise un chien enragé avec un lapin de garenne, gare au chien de garage.', ""Un croisement entre un chiot et des tiques, c'est un sac à puces."", 'Un canif est une petit fien.']","['fr_16347', 'fr_4199']","['en-rat-gé', 'garage']"
en_2933,"[""Les ongles de pied sont des choses qui rentrent par un orteil et ressortent par l'autre."", ""La mode est quelque chose qui rentre par une ère et sort par l'autre."", 'La mode a une vague tendance à entrer par un magasin et à ressortir par l’autre.', ""L'industrie de la mode, c'est tantôt un secteur porteur, tantôt un mauvais in-veste-tisse-ment"", ""Les modes ont tendance à me sortir par l'an-nez."", ""La mode va et vient sans cesse. C'est sûrement une angoissée de nature.""]","['fr_2712', 'fr_14118', 'fr_2307', 'fr_3236']","['un orteil', 'une ère', 'in-veste-tisse-ment', ""l'an-nez""]"
en_2942,"[""Ashley s'est faite arrêtée hier soir. Elle est aveugle mais on l'entendait brailler dans la rue.""]",[],[]
en_2945,"[""Les vaches se font entendre uniquement lorsqu'elle sont d'humeuhr."", ""Une vache sais dire quand on l'émeu"", 'Les vaches ne meuglent que le meuhrcredi.', ""Les vaches préfèrent parler quand elles ont quelque chose d'important à dire, elles n'aiment pas meuhbler"", ""Les vaches ne font du bruit que lorsqu'elles sont ameuglées par l'amour."", 'Quand une vache fait du bruit, elle ra-meuh-te tout le village.', ""Les vaches ne mugissent que lorsqu'elles sont de bonne humeeeeeuhr."", 'Les vaches les plus bruyantes sont celles de la Meuse.', 'Quand elles ne sont pas contentes, les vaches ne font que meugler.', ""Les vaches ne font du bruit que lorsqu'elles sont d'humeuuhr."", 'Les vaches ne font du bruit que quand elles sont de bonne humeuhr.', 'Les vaches deviennent silencieuses quand dehors ça meuhle.', 'Les moutons sont bruyants seulement quand ils sont de bonne humêêêêur.', ""Les vaches font du bruit quand elle s'ameusent."", ""Les vaches ne s'expriment que quand elles sont d'humeuuuuuuur.""]","['fr_10145', 'fr_14114', 'fr_4119']","['meuhbler', ""s'ameusent"", 'humeuuuuuuur']"
en_2946,['La plupart des chasseurs sont gentils car ce sont des biches.'],[],[]
en_2947,"['Docteur, Docteur, que prendriez-vous pour ce rhume ? - Faites-moi une offre. Suivant', 'Docteur, que prendriez-vous pour un rhume ? - Je ne sais pas, faites moi une offre. Suivant.', ""- Docteur, docteur, qu'est-ce que tu prends pour ce froid? - Faites-moi une offre."", 'Docteur, Docteur, que prendriez-vous pour ce rhume ? - Faites-moi une offre. Suivant.']","['fr_531', 'fr_9613']","['prendriez', 'prendriez']"
en_2950,"[""L'animateur 3D a été retrouvé. On l'a enfermé dans une cellule isolée.""]",[],[]
