id	text
fr_9979	"“Je n’en revenais pas : il y avait 527.986 abeilles autour de cet essaim !"", nous a recompté Tom."
fr_9980	"""Je suis ici - avec un cadeau!"" dit Tom à présent."
fr_10000	""" Si je lâche le plafond, il va s'écrouler "", soutient Tom."
fr_10008	Des nouvelles de Londres : un ornithologue excentrique part pour l'étranger pour enseigner l'anglais de cuicuisine.
fr_10010	Ma caméra est tombée dans le caramel mais la photo est quand même bonne.
fr_10011	Les vieux professeurs de maths ne meurent pas, ils perdent leurs fonctions.
fr_10020	50 nuances de tri
fr_10022	Nos glaces aux pacanes épicées font chauffer le congélo.
fr_10025	Les vieux fermiers ne meurent jamais, ils deviennet des légumes.
fr_10026	Le percussionniste était très doué pour analyser les symboles.
fr_10031	Dans les équations avec des nombres au carré, je n'arrive jamais à trouver la racine du problème.
fr_10037	Les vignes ont un sale caractère. Elles peuvent vriller au moindre petit coup de vent.
fr_10044	"Il lui a proposé de lui montrer sa collection d'estampes japonaises. Elle lui a répondu: ""pas besoin de me faire un dessin""."
fr_10046	Le plombier a dû quitter son emploi car il était vanné.
fr_10051	Les entraîneurs ont généralement un but en tête.
fr_10067	Le comique s'était arrêté dans un magasin de tissu pour changer la trame de son nouveau spectacle car il pensait avoir l'étoffe d'un metteur en scène.
fr_10072	Je suis allée voir mon guru, mais ce n'était pas un Om
fr_10076	Un CARrefour de nouvelles expériences.
fr_10081	Le défendeur sans oreille a renoncé à son droit d'audition.
fr_10082	Un pêcheur illettré avait la phobie de l'o.
fr_10086	Ils ont organisé une fête pour l'inventeur du grille-pain et l'ont tartiné d'éloges.
fr_10089	Le cyclomotoriste parcourait 20 kilomètres le matin et 20 autres le soir. Il aimait recycler.
fr_10094	"""Je me suis mis à lire Voltaire"", admis Tom, candide."
fr_10100	Pour faire son examen de conscience, il faut se regarder au fond des dieux.
fr_10109	"""On va tous jouer un la, un do dièse et un mi"" s'exclamèrent les membres du groupe de Tom à l'unisson."
fr_10117	Un médecin ne meurt jamais, seulement, il n'est plus patient.
fr_10132	Nexen, n'excelle qu'en votre satisfaction.
fr_10141	C'est pas canal ça !
fr_10145	Les vaches préfèrent parler quand elles ont quelque chose d'important à dire, elles n'aiment pas meuhbler
fr_10147	Les vieux prof de math ne meurent jamais, ils deviennent juste irrationnels
fr_10156	Avec tous les vinyles que j'ai collectionnés, il vaut mieux que je m'organise pour que tout tourne rond.
fr_10158	Un couple d'astronautes s'est séparé : ils avaient besoin d'espace.
fr_10160	Le rinçage de mon voisin est pour moi une irrigation constante.
fr_10163	L'invention du sorbet a brisé la glace.
fr_10167	Quand la batterie de mon téléphone s'est déchargée, j'ai cédé à la tension et pété un câble. Quand j'ai mis mon psy au courant, il m'a donc conseillé de faire volt-face et de ne pas lâcher prise
fr_10169	Je m'appelle Lute, je suis musicien.
fr_10174	Une compagnie d’électricité recherche toujours des employés débordant d’énergie.
fr_10223	Le chat a pris des cours d'informatique dans l'espoir de maîtriser sa prise sur une souris.
fr_10229	L'Irlande n'a l'Eire de rien mais il n'y a patriquement que des beaux paysages !
fr_10231	Les vieux randonneurs ne meurent jamais, on les envoie juste promener.
fr_10238	Le roi m'avait chargé de chasser le dragon, j'étais tout feu tout flamme !
fr_10245	Le plombier a dû quitter son emploi, car il n'arrivait pas à se canaliser.
fr_10249	J'ai pris quinze kilos, dit Tom d'un ton grave.
fr_10252	Les géologues sont des émotifs capables de grands sédiments.
fr_10256	Pourquoi la musique est-elle si controversée ? Parce qu'elle fait Volt-face !
fr_10276	Un voleur déroba un calendrier et prit douze mois fermes
fr_10298	Le coût d'une coque galvanisée est suffisant pour te rendre zinc-zinc
fr_10299	Les développeurs photographiques ont parfois du mal à contrôler leurs émulsions
fr_10305	Nous sommes la crème de la crème glacée.
fr_10319	"""Superglue !"" me dit Tom le regard fixe."
fr_10330	Certaines personnes avec beaucoup de vision ont commencé l'Institut des aveugles.
fr_10336	C’était un pêcheur illettré qui n’aimait pas l’O.
fr_10337	Quand ma caméra est tombée dans la mer, j’ai compris que l’addition serrait salée.
fr_10356	Un terrassier était bien ancré dans sa carrière.
fr_10379	"""Chantons un LA"", dit Toto, au diapason."
fr_10409	Le satellite est en orbite depuis le 1er janvier, c'est une révolution de début d'année !
fr_10410	Qui aime bien ses lunettes, ménage sa monture.
fr_10418	C'était un vétéran du commerce d'épices, on le reconnaissait à ses cheveux poivre et sel.
fr_10430	L'eau qui rafraîchit plus vite que l'eau fraîche !
fr_10434	Ohm a résisté à l'idée au début.
fr_10440	Quand on mange en avion, il ne faut pas s'attendre à de la haute cuisine.
fr_10445	Moi, c'est clair que si demain on m'annonce qu'on doit m'amputer et que je suis cul-de-jatte, les bras m'en tombent.
fr_10452	Je me suis mis au sport pour perdre du poids, mais c'était surtout une perte de temps.
fr_10476	"""Je veux le même miroir!"" réfléchit Tom"
fr_10479	Deux pianistes ont concouru pour la meilleure note.
fr_10483	Il a piétiné sa vieille montre parce qu'il avait du temps à tuer.
fr_10492	Le plombier a décidé d'arrêter de travailler parce qu'on lui a donné un tuyau.
fr_10527	Cet acrobate portait toujours des costumes cousus de quantité de strass pour que les spectateurs soient éblouis par le spectacle et le trouvent brillant.
fr_10531	Un magasin de musique a été cambriolé. Les policiers ont luthé en vain mais le voleur s'est échappé.
fr_10555	Les vieux académiciens ne meurent jamais, il perdent juste leurs facultés.
fr_10558	Il faut convertir tout ton argent en monnaie du Ghana et au moins comme ça Cedi !
fr_10581	Un nouvelle Claus juridique interdit à toute personne autre que le Père Noël et sa famille de s'habiller comme lui.
fr_10591	Vous faites une Affaire.
fr_10620	Les anciens opérateurs IBM ne meurent jamais, ils font leur trou autrement.
fr_10624	"Saviez-vous qu'il n'y avait pas de formation pour les collecteurs d'ordures ?
Ils l'apprennent sur le tas."
fr_10625	Un voleur soigneux sait blanchir l'argent sans se salir les mains.
fr_10638	Les vieux profs de maths ne meurent pas, mais ils ont des expressions bizarres.
fr_10655	Son passe-temps avion modèle a vraiment décollé.
fr_10664	Mes cours de géométrie n'étaient pas très carrés
fr_10674	Elle avait un partenaire avec une jambe de bois, mais elle l'a rompue.
fr_10676	J'ai appelé le zoo, mais la ligne était coqupée.
fr_10682	Un électricien, ça ne meurt pas, ça disjoncte, c'est tout.
fr_10686	Le magasin de bateaux fait des proue-sses.
fr_10694	"MISS PRISM : Tout dépend de la compassion intellectuelle de la femme. Ayez confiance en la maturité. Rien ne vaut une femme mûre. Les jeunes femmes sont encore vertes.
Croyez-en mon discours horticole. Quelle métaphore juteuse !"
fr_10695	Hier, j'ai avalé du colorant alilentaire par accident. Le docteur m'a recommandé d'éviter les oranges, les fromages bleus, la viande rouge et les légumes verts pour prévenir une maladie couleurectale.
fr_10715	Le jeune pin se fit masser par son père. Apparemment il avait quelques nœuds.
fr_10721	Je suis tombé malade après m'être empiffré de soupe de lentilles. J'aurais dû le voir venir.
fr_10750	Elle n'était que la fille d'un archer, mais pour tous les hommes, elle était la cible.
fr_10772	Tu as attrapé un attacus Atlas ! Il ne serait pas un peu agressif ?
fr_10776	Ma peur de l'avion s'est envolée.
fr_10780	Les vieux chimistes ne meurent jamais, ils cessent de réagir.
fr_10796	Elle a été suspectée d’avoir volé une robe, mais ils ne purent l’épingler.
fr_10806	Quand les joueurs de poker doivent se plier, ils se sentent un peu écartés.
fr_10820	A chaque fois que j'achète un vinyl, j'écris le nom de la chanson et de l'artiste. Le disque est rayé.
fr_10823	Il avait mis un clou dans sa poche pendant la partie de volley pour envoyer des balles piquées
fr_10830	Les vieux imprimeurs ne meurent pas, mais leur caractère ne va pas en s'améliorant.
fr_10837	Je ne peux pas me voir sans yeux.
fr_10846	Un fournisseur d'électricité est toujours à la recherche d'employés énergiques
fr_10853	Les vendeurs d'équipements de sécurité aiment quand leurs client'es s'alarment.
fr_10857	Dans les équations de nombres au carré, je ne trouve jamais la racine du problème.
fr_10868	LES CASES ORANGE SENTENT L’ORANGE ; ELLES TE DONNERONT UNE ODEUR APÉTISSANTE !
fr_10874	Les lapins aiment prendre la vie du bond côté
fr_10879	Elle était fille de gardien de but, et elle m'a filé une de ces gaules !
fr_10891	"""Je ne sais vraiment pas où planter ces nénuphars"" dit Toto en se marrant"
fr_10896	La meilleure unité de mesure de bruit est le gros cube.
fr_10901	Il y a des mathématiciens, quand on leur demande de cosiner un prêt, ils préfèrent prendre la tangente.
fr_10902	visitons les tombes, dit Tom, cryptiquement.
fr_10913	Pablo et José ont attendu que Pilar leur dise de la rejoindre à dans le clochet de l'église. Ils ont cherché le clochet mais ne l'ont jamais trouvé. Pilar ne dit que des sonnettes.
fr_10929	Le plus puissant tracteur de John Deere vient d'être lancé. C'est le moteur du village.
fr_10936	Au bureau, elle cherchait frénétiquement ses faux ongles pour découvrir qu'elle les avait rangés.
fr_10940	J'ai fait de la soupe d'oeil de poisson, ça devrait m'aider à voir venir la semaine.
fr_10941	Le docteur, qui était aussi barman, ne pouvait pas se passer d'alcool.
fr_10952	Les régimes sont pour ceux qui n'en pèsent plus.
fr_10976	J'étais accro au savon, mais je suis clean maintenant.
fr_10978	Des moteurs à force de persuasion.
fr_10985	L'endroit qui a fait des boules de caoutchouc a failli faire faillite, mais elles ont rebondi.
fr_10993	Quel est le comble pour un rouleau compresseur ? D'être à plat.
fr_10995	C'est peut-être la bonne voie mais si tu ne t'écartes pas tu vas te faire renverser.
fr_10998	Son père était agriculteur. Elle savait se montrer ferme.
fr_11015	Les docteurs ont dû retirer un os de mon bras, dit Tom sans humourous.
fr_11018	Les politiciens devraient boire plus de thé car ça leur confèrerait plus d'honnête-THÉ.
fr_11028	Quand on porte une montre en faisant de la couture, c’est fou comme le temps file.
fr_11036	Un musicien est allé à l'hôpital après avoir joué trop d'accidents.
fr_11048	Le voleur est entré dans le magasin de musique par refrainction et il est reparti avec la caisse.
fr_11050	Ce qui est chouette avec une piñata c'est que ça fonctionne à tous les coups.
fr_11065	Apporte-moi une corde, et que ça saute !
fr_11074	Son père était jardinier. C'était une belle plante.
fr_11084	Un jour, j'ai demandé comment il faisait pour avoir un jardin aussi beau et des baies aussi bonnes. Il m'a simplement répondu que le mérite revenait uniquement à la moure.
fr_11091	Mon nom est Derek. Je suis dans le business des fuels.
fr_11098	L'invention de la glace a résorbet le problème.
fr_11116	Là où le canin-croyable devient réel.
fr_11129	Les vieux dessinateurs ne meurent jamais, ils croquissent la vie à pleine dent.
fr_11132	Va chier, petit scarabée.
fr_11138	Elle a mémorisé le médaillon qu'elle voulait, par cœur.
fr_11157	Le silence est d'or et le sommeil aussi
fr_11183	Le jardinier d'un grand cimetière était important parce qu'il comptait 5 000 personnes sous lui.
fr_11197	Jésus est responsable de la seule transformation extrême du monde : une piste peut-être ? Des luges.
fr_11202	Quand le voleur est tombé dans le ciment mouillé et s'est cassé les deux jambes, il est devenu un criminel endurci.
fr_11204	Rien de tel pour mettre le feu à une caserne que de lancer un défi à deux pompiers.
fr_11206	Fiez-vous à votre savoir-flair.
fr_11209	Le commerce des engrais est une industrie en pleine croissance.
fr_11212	Trouver toutes les relations logiques possibles entre une collection finie d'ensembles n'est pas une question de Si mais de Venn.
fr_11219	On s'éclate trop quand on écoute les chansons du groupe les Ballons.
fr_11221	Le coffre-fort a été inventé par un policier et un criminel. C'était une bonne combinaison.
fr_11223	"""J'ai presque atteint le sommet de la montagne"", se piqua Tom."
fr_11230	Deux philatélistes se sont réunis pour parler du bon vieux timbre.
fr_11234	"""Je suis un chasseur de lions"", rugit Tom."
fr_11237	Quand j'ai vu que mon téléphone était complètement déchargé je me suis mise en colère. Ma conseillère m'a alors prise en charge.
fr_11258	La fusillade au théâtre d'Athènes était une tragédie grecque
fr_11269	"Signe sur un flacon de parfum cassé: ""Hors dosage"""
fr_11282	"Je continue à lire ""Le Seigneur des Anneaux"" encore et encore. Je suppose que c'est juste la force du hobbit."
fr_11289	Il a mis du temps à rebondir de son accident en saut à l'élastique.
fr_11295	Tu as entendu parler de la nouvelle piñata ? Elle fait un carton.
fr_11296	Les guitaristes âgés ne meurent jamais, mais ils sont quand même beaucoup moins frets.
fr_11316	Un marin ne meurt pas, il perd baleine.
fr_11325	"Je démens tout"" dit Tom avec un regard fou."
fr_11337	Je me présente: Jérémy Lambiance. Je suis animateur T.V.
fr_11343	Après une dure journée de travail les dentistes croquent la vie à pleine dent.
fr_11348	J’ai trouvé du pétrole ! dit Tom d’un air pompeux.
fr_11362	Les vêtements faits pour marcher
fr_11364	L'abstinence fait grandir l'ardeur amoureuse.
fr_11370	Un fossoyeur avait le sentiment d'avoir fait son trou mais de ne plus savoir comment sortir de l'ornière
fr_11385	Quand j'ai visité le théâtre, j'ai eu l'impression que tout était en scène.
fr_11390	"Tu as déjà lu ""Le Bateau ivre"", d’Arthur Ribaud."
fr_11396	Il y a des jours où les dentistes n’aiment pas ramener leur fraise au bureau.
fr_11410	J’aime les films de détectives chinois, Tom cantonais.
fr_11425	Les vieux juristes ne meurent jamais, ils perdent juste leur jugement.
fr_11433	Quand des éléphants entrent dans un bar, le patron sait qu'il peut s'attendre à des gros pour boire.
fr_11452	Le sergent buvait du whisky pour être fortifié dans sa position.
fr_11454	Le couple cultivait des fruits et vécut jusqu'à un âge mûr
fr_11455	Les vieux nageurs ne meurent jamais, ils continuent à brasser de l'air.
fr_11456	On a cambriolé un magasin de batteries. Le voleur est parti avec cymbales et la caisse claire.
fr_11468	Un vieux randonneur ne meurt pas, il fiche le camp.
fr_11470	Deux frères jouaient partition de Bach, mais l’un des deux a fugué.
fr_11485	En voulant aimablement citer le travail de Mario Puzo pour ses cours, elle lui a promis une pollicitation.
fr_11501	Le sniper vise haut dans la vie.
fr_11520	Les vieux guitaristes ne meurent jamais, ils ont plus d'une corde à leur arc.
fr_11529	Hier, une vache m'a sauvé la vie : c'était une intervention bovine.
fr_11533	C'était un terrassier à la carrière bien établie.
fr_11534	Seul, tu es beau. En groupe, tu deviens immonde.
fr_11556	De temps en temps, un audioprothésiste décide de faire comme il l'entend.
fr_11557	A chercher des noises aux spermophiles, c'est tout l'écosystème qu'on fait sauter.
fr_11570	Les dentistes ont un talent particulier pour plomber une journée.
fr_11574	"Dans la forêt, Papa pin reprochait à son fiston de ne pas pousser assez droit : ""Je te trouve un peu plié""."
fr_11578	Il n'a pas pu venir au rendez-vous car son lièvre venait de mourir, il lui a donc posé un lapin.
fr_11596	"""Les médecins ont dû retirer un os de mon bras"" dit Tom, d'humeur usée"
fr_11610	"Quand on admet une erreur : "" Tel le patient d'un orthophoniste, au ton pour moi."""
fr_11616	Je m'appelle Otto. Je suis mécanicien automobile.
fr_11617	Il devint si doué de la tronçonneuse qu'on le promut au poste de directeur de sa branche
fr_11634	Pourquoi les arbres sont aussi susceptibles en plein soleil? Ils sont très ombrageux.
fr_11643	Hier j'ai avalé un peu d'eau de javel par accident. Le médecin m'a dit que ce n'était pas grave, mais j'ai l'impression d'avoir fondu un peu.
fr_11645	Les vieux électriciens ne meurent jamais, ils ne peuvent juste pas faire des connexions.
fr_11653	Les scientifiques qui étudient le soleil en connaissent un rayon.
fr_11659	Les légendes nous disent que le point faible d’un vampire carnivore c’est la caïl.
fr_11665	J'ai entendu dire qu'Edgar Allan Poe avait des poeblèmes de colère.
fr_11667	Le dévoilement de la statue a été une occasion monumentale.
fr_11674	comment appelle-t-on un petit lapin très malin? un lapin naintelligent
fr_11690	Le forage des puits est un sujet profond.
fr_11697	""" Tu es homosexuel ? "", demanda Tom gaiement."
fr_11699	"""Je n'ai pas encore pris mes photos"", dit Tom négatif."
fr_11711	Puis... le silence. Un silence de mort.
fr_11716	Certains trouvent que les sirènes incendies ont un effet alarmant.
fr_11720	Pourquoi ne trouve-t-on jamais les momies seules? Parce qu'elles se déplacent en bandes.
fr_11725	Si tu rates ton guacamole, il te faudra un avocat.
fr_11726	"Stéphane plaça : ""Je suis l'animateur de Maison à vendre"""
fr_11736	Quand les cannibales dévorèrent le missionaire, cela leur donna un avant-goût de la religion
fr_11738	50 nuances de gras
fr_11739	Je m'appelle Larnac. J'élève des pigeons.
fr_11748	Quel est le fruit favori des vampires? L'Orange sanguine.
fr_11758	Certains rappeurs sont doués, pour d'autres c'est Pas Le Kiff.
fr_11777	Toujours mettre de la crème avant de s'exposer au sommeil.
fr_11780	Les vieux fabricants d’encadrements de porte ne meurent jamais, ils sortent juste de leurs gonds.
fr_11793	J'étais banquier avant, mais j'ai perdu tout intérêt.
fr_11810	Il faut fê-THÉ ça !
fr_11815	On m’a invité à remettre un prix de cinéma, s’exclama César.
fr_11820	Après avoir avalé la montre, Junior a dû attendre pour passer le temps.
fr_11842	Quand j'ai proposé de reloger le sénateur à Caen, j'ai bien cru qu'il allait m'étriper.
fr_11849	Le magicien cambrioleur pensait pouvoir disparaître, mais il se faisait des illusions.
fr_11862	Pour un employé malhonnête : C'est un travailleur incroyable.
fr_11890	Ça se réchauffe, vous voulez rester frais ?
fr_11891	Savoir s'il fallait ou non creuser un nouveau puits de mine était un débat trop profond pour lui.
fr_11899	Un homme était tellement bon avec une tronçonneuse qu'il est devenu directeur de branches.
fr_11925	Les vendeurs d'équipements de sécurité aiment voir le regard alarmé de leurs clients.
fr_11939	Comment appelle-t-on un tas de petits chats? Une miaoutagne.
fr_11947	Les spaghetti réchauffés ne sont pâte très bons.
fr_11957	Quand j'ai eu ma PS3 volée, mes proches ont été là pour m'en consoler.
fr_11972	Waze, une fausse route ?
fr_11973	Un joueur de baseball s'est engagé dans l'armée et a fait le tour des bases militaires.
fr_11977	Deux astronautes étaient en couple mais se sont séparés car ils avaient besoin de plus d'espace.
fr_12005	"Qu'a dit le raisin lorsqu'on l'a cueilli ?
Rien, on lui a lâché la grappe !"
fr_12009	Tu as attrapé un dytique ! Il aime les vers dithyrambiques !
fr_12022	Une fois j’ai été accusé d’avoir volé un vieux timbre rare et précieux, j’ai évidemment nié comme un timbré.
fr_12045	Nous devons ralentir, et vite !
fr_12046	C'est dur pour une tortue déprimée de sortir de sa coquille.
fr_12049	Il jeta un sorbet sur sa femme, qui le fit arrêter pour ces faits glaçants et inculper pour pots d'armes prohibés
fr_12055	Je m'appelle Mous. Je suis barbier.
fr_12061	Mon perroquet peut prédire la mort, c'est un oiseau de mauvais augure.
fr_12062	Tous les étudiants à Budapest doivent s'habiller Hongrie.
fr_12075	Les chaussures conçues pour vous faire avancer
fr_12079	Les vieux ingénieurs ferroviaires ne meurent jamais, ils déraillent juste.
fr_12081	C’est pour cette raison qu’on les appelle des cours : parce qu’ils deviennent chaque jour un peu plus courts.
fr_12087	Achille Talon, ça m'envoute ! Surtout quand il semelle des affaires de son voisin et lui casse les pieds.
fr_12098	Deux astronautes qui sortaient ensemble ont dû se séparer car ils avaient tout les deux besoin d'espace.
fr_12120	Pour planifier un cimetière, vous avez besoin d'une idée de squelette avant un plan détaillé.
fr_12122	Quel genre de film les fleurs aiment-elles regarder ? Les films à l'eau de rose.
fr_12123	Il y a des moments où un outil de pointage est nécessaire pour faire une bonne pointe.
fr_12125	Comment contacter un avocat ? Il suffit de faire appel.
fr_12132	La professeure de maths avait faim, mais il ne lui restait qu'une part de pi-zza froide.
fr_12136	Les vieux profs ne meurent jamais, ils perdent juste leurs facultés.
fr_12146	J'ai appellé le zoo mais il y avait de la friture sur la lionne
fr_12158	Votre foi dans nos toits.
fr_12160	Un poinçonneur ne meurt pas, il est au fond du trou.
fr_12163	"""On n'a plus d'orange"", dit Tom avec acidité."
fr_12164	Le plombier a dû quitter son travail parce que c'était trop drainant.
fr_12165	Elle était galeriste mais n'avait jamais de Monet
fr_12171	Quand vous portez une montre en avion, le temps ne suspend pas son vol.
fr_12174	Si les enfants étaient autorisés à travailler à la mine, est-ce qu'ils seraient vraiment mineurs?
fr_12175	Les enfants peuvent faire des choses dénouées de sens avec une ficelle.
fr_12176	Les vieux chimistes ne meurent jamais, seulement, ils cessent de réagir.
fr_12184	(Mais il ne tirera plus sur cette corde.)
fr_12187	J'ai essayé d'apprendre à conduire un véhicule avec une boîte de vitesses, mais je n'ai pas trouvé le manuel.
fr_12188	J'étais contre la construction de courts de tennis dans le parc car j'avais peur de me faire racketter.
fr_12197	Une compagnie d'électricité cherchent des employés qui ont de l'énergie.
fr_12199	Le gars faisait des haltères avec la cartouche d'imprimante. Il se musclait pour faire bonne impression.
fr_12203	En hiver, certains chevaux frileux ne se tirent pas la bourre.
fr_12206	"Pourquoi le tailleur de pierre a t-il dû quitter son travail ?
Parce que sa carrière est ruinée."
fr_12221	Candide, Tom avoua qu'il avait lu Voltaire.
fr_12230	"""J'en ai mare de planter des nénuphars !"" s'écria Toto"
fr_12240	Tu as entendu parler de la nouvelle pinata ? Il paraît qu'elle défonce
fr_12254	Mon cœur se cerf, murmura-t-elle en voyant ce beau et majestueux mâle.
fr_12288	Quel est le comble pour un réalisateur ? De se projeter trop vite.
fr_12292	"""Wow, cette étoile est brillante"", dit Tom siriusement."
fr_12295	Faites preuve de flair-udition.
fr_12317	"""Ce sont de vulgaires bijoux plaqués!"", cria Tom, or de lui."
fr_12319	Naviguez avec votre équipage !
fr_12322	Les chrétiens, gardez la foi... mais pas des autres!
fr_12323	Certains commandements donnés par l'armée sont spécifiques, d'autres généraux.
fr_12339	Regarde sa croupe
fr_12371	Quel genre de revêtement préfèrent les chasseurs d'alligator ? Les crocodalles !
fr_12397	A quelle heure est votre rendez-vous chez le dentiste? une heure moins le carrie
fr_12409	Deux mûres se sont rencontrées. Ce fut une vraie déconfiture.
fr_12417	C'est deux entreprises d'exploitations minières ne s'appréciaient guères mais choisirent quand même de fusionner leurs activités. C'était un alliage de raison.
fr_12449	Ce petit trou a ouvert une énorme brèche dans votre témoignage.
fr_12452	Ma soeur compte reprendre l'entreprise fourmilliale de construction.
fr_12458	Hubble voulait faire le point sur cette idée.
fr_12476	Le projet Hubble a été difficile à mettre au point
fr_12488	J'aime les ascenseurs, ils me laissent dire des blagues à tous les niveaux.
fr_12495	L’amour de son métier était profondément ancré dans le cœur du marin.
fr_12501	Fille d'un simple cultivateur, jamais elle ne se débinait.
fr_12503	Quel est le comble pour un mécanicien ? Être crevé et avoir besoin de recharger ses batteries.
fr_12508	GWENDOLEN : Si vous n'en avez pas pour long, je vous attendrai jusqu'à la fin de ma vie.
fr_12510	Je vais discuter du réchauffement climatique la semaine prochaine, c'est un sujet très chaud.
fr_12514	Les comédiens, la plus grande blague qui soit.
fr_12522	"""Je lis Voltaire en ce moment"", a dit Tom d'un ton candide."
fr_12525	Tu es au courant de ce qu'on dit du prêtre qui est toujours nerveux? Il aurait les psaumes moites.
fr_12537	"""Je suis déjà à mi-sommet"", lança Tom, comme une saillie."
fr_12546	Hier une vache m’a sauvée, que Dieu vous génisse
fr_12557	Les voleurs qui surfent sur le web ne comptent que sur les gros débits.
fr_12565	Les étrangers sont aimables parce qu'ils sont aussi spatiaux.
fr_12570	Sa décision de faire de l'escalade a été pour le moins précipitée.
fr_12572	Le garçon n'avait jamais fait du basket-ball auparavant, il a décidé de le lancer.
fr_12574	"""C'est une unité de courant électrique"", dit Tom avec beaucoup d'ampleur."
fr_12583	Les vieux engins de formation ne meurent jamais, ils sont juste déraillés.
fr_12591	La Freud est-elle punie en contrôle de philosophie ?
fr_12592	Le langage des signes, c'est toujours pratique à avoir sous la main.
fr_12594	Les pâtes c’est apestossant.
fr_12602	Je suis un creuseur de fossé, dit Tom, d'un ton tranchant.
fr_12621	La création de la crème glacée fut un projet tout particulièrement bien léché.
fr_12622	LES VIEUX UTILISATEURS DE CARTE DE CRÉDIT ne meurent jamais, ils expirent simplement.
