id	text
fr_4654	Les vieux gérants de magasins ne meurent jamais, ils se laissent porter par les ventes.
fr_4663	Mes deux oncles se défièrent de savoir lequel se remarierait en premier. Le père de Thomas gagna, la tante à Sion était trop forte.
fr_4690	Quel bruit fait une pièce de monnaie vietnamienne en tombant au sol ? Dong
fr_4700	L'idée de l'entrepreneur intelligent de concevoir des catapulte a fait que son patron était complètement éjecté.
fr_4704	Les vieux marins sont obstinés mais ils virent parfois de bord.
fr_4706	Le cultivateur de maïs avait de sacrés épis.
fr_4715	J'ai essayé de rentrer dans une valise. Sac m'amuse.
fr_4719	Un nom et un verbe étaient en couple mais ils ont rompu parce-que le nom était trop déterminé.
fr_4731	De nombreux retours satisfaits !
fr_4744	Modiano se livre
fr_4745	Un cowboy, il va au rodéo, et il ne se repose cabrer.
fr_4753	Quand vous entrez au funerarium, n’oubliez pas de rester vigilant et d’avoir l’air bien vivant !
fr_4777	Hier une vache m'a sauvé la vie - une intervention bovine.
fr_4778	Quand ce père a découvert qu'il avait des septuplés, il a fallu qu'il stats pour s'assurer qu'il ne rêvait pas.
fr_4785	"""Superglue !"", s'exclama Toto pour montrer son adhésion."
fr_4801	Quelle belle paire de lunettes ! Tom fit la réflexion.
fr_4811	Il a dérobé une invention puis il s'est mis à raconter des mensonges patentés.
fr_4822	Le sous-officier avait des douleurs aux poignets. Le médecin l'a dit syndrome de tunnel corporel.
fr_4831	Les vieux PROFESSEURS MATH ne meurent jamais, ils utilisent juste des expressions étranges.
fr_4832	Un fermier qui veut tuer un poulet pour le dîner doit agir en un clin d'œuf.
fr_4836	L’inventeur du chevwing-gum a très vite pu se permettre de buller grâce à l’argent emmagasiné par son invention.
fr_4850	Les fossoyeurs ne meurent pas. Au contraire, ils ont toujours une bêche d'enfer.
fr_4856	Un pirate qui n'a qu'une seule main décroche souvent le téléphone. Il voulait décrocher.
fr_4864	"""J'aimerais savoir si cette crise est dûe à une maladie sérieuse ou pas. Est-ce la fin? Est-ce une feinte?"""
fr_4876	"Deux chats discutent : ""ma minette, on est félin pour l'autre"""
fr_4883	Et maintenant, mon cher Monsieur Worthing, je m'en vais de cette maison de chagrin. Je voudrais simplement vous dire de ne pas vous laisser écraser par le deuil. Ce qui nous paraît être une épreuve épineuse n'est bien souvent qu'une bénédiction cachée.
fr_4891	Avez-vous entendu parler du père qui était difficile à voir ? Il était transparent.
fr_4898	Les jardiniers ne meurent jamais, ils mangent juste les pissenlits par la racine.
fr_4916	M’avez-vous dit porc, ou porte ?
fr_4920	"Laissez notre gamme ""Destination"" vous faire voyager."
fr_4930	"Mon patron est venu me voir à midi : « Mais où-étiez-vous passé ? Je vous ai cherché partout ! »
Je lui répondu en haussant les épaules : « Les bons employés sont difficiles à trouver. »"
fr_4934	""" J’en ai gros sur la patate ! - Essaie ce nouveau régime. """
fr_4963	Ce sont eux qui ont écrit le discours pour la soirée en l'honneur de l'inventeur du grille-pain. Ils en ont écrit une tartine.
fr_4964	J'ai appelé le zoo, mais la lionne était occupée.
fr_4971	"La pancarte sur la zone non-fumeur annonçait : “Réouvre en joint""."
fr_4975	Les cours de maths sont tellement dramatiques. Il y a beaucoup trop de problèmes.
fr_4983	Nos gens sont et rendent brillants
fr_4990	Elle ne crache pas son repas... elle crache des mensonges !
fr_4995	Les vendeurs de valises roulent sur l'or.
fr_4998	J'aime, j'aime Lipton, j'aime cette odeur, toutes ces herbes en douceur, lentement infusées, sensuali-THÉ
fr_5004	Fais châtrer ton chien, mieux vaut prévenir que maudire.
fr_5034	Je ne dois pas laisser mourir ce feu, m'a soufflé Tom crâmement.
fr_5035	"“Le soleil se lève"", s’exclama Tom avec aurore."
fr_5044	Il devint astronaute et n'eût plus la tête sur les épaules.
fr_5055	Dès maintenant, le volant à 10h10.
fr_5115	Quoi ? Benji est avachi dans le salon ?
fr_5118	Les VIEUX ELECTRICIENS ne meurent jamais, ils perdent juste leur potentiel.
fr_5132	Le trapéziste économisait pour s’acheter du matériel de sécurité, et il n’y avait pas UN banquier pour lui filet un peu de thunes.
fr_5134	"""J'attends de voir le docteur "", dit Toto, patient."
fr_5137	Tu as attrapé un agrias ! Grillé, l'agrias !
fr_5154	– Et si on essayait de trouver une femme à notre oncle vieux garçon? – Ok, ça se tante
fr_5171	"""Je suis le présentateur de Touche pas à mon poste !"", Cyril ânonna."
fr_5172	C’est un canard qui ne voulait pas entrer dans l’eau. Il s’est fait traiter de poule mouillée.
fr_5184	Ces mines sont pleines d'or, on a qu'à y piocher pour devenir riche !
fr_5191	Il pleuvait des cordes. Ce n’était pas le moment d’oublier le linge dehors.
fr_5199	Je me présente: Monsieur Specteur. Alain Specteur. Je suis détective
fr_5202	L'acupuncture est à la pointe de la médecine.
fr_5211	Dans cette boîte, j'ai un serpent de 10 pieds. Sammy : Tu ne peux pas me tromper, professeur... les serpents n'ont pas de pieds.
fr_5212	Il se rendit à un festival de cinéma à Venise où on leur Mostra des films originaux.
fr_5228	Mon nom est Manuel, j’écris des livres pour l’Education Nationale.
fr_5233	Ses qualifications en tant qu'enseignant de maths ne se sont pas ajoutées.
fr_5237	Les vieux statisticiens ne meurent jamais, ils se décomposent en fonction de l'âge, du sexe et de l'état civil.
fr_5240	En retard, Kennedy a glissé sur une banane et s'est retrouvé avec une toute nouvelle coupe de cheveux en se relevant.
fr_5261	La police m'a arrêté après que mon psy m'a conseillé de trouver quelque chose à prendre pour guérir ma kleptomanie.
fr_5262	Volta était électrisé.
fr_5267	Les plombiers qui réussissent sont ceux qui ont les bons tuyaux.
fr_5279	Les vieux cuisiniers chinois ne meurent jamais, ils nems pas l’idée de mourizr.
fr_5281	Certains ordres donnés par l’armée sont spécifiques, d’autres sont Généraux.
fr_5292	Pour finir les restes de spaghetti, il faut vraiment être bonne pâte.
fr_5293	Cointreau met le feu à la glace.
fr_5294	"""Jouons tous un la, un do dièse et un mi,"" s'écria le groupe de Tom d'un même accord."
fr_5300	Je préfère me cantonner à mon travail sans trop m'échiner, affirma Tom.
fr_5317	On a demandé au cordonnier combien de chaussures il vendait par semelle.
fr_5336	C'est parce que la vitesse de la lumière est supérieure à celle du son que certains paraissent brillants avant d'avoir l'air con.
fr_5339	Avant qu'il ne soit embauché comme cuisinier à commande courte, ils l'ont grillé.
fr_5345	Les vieux professeurs de mathématiques ne meurent jamais, ils utilisent seulement des expressions étranges.
fr_5347	Les gens qui aient la peinture dorée ont un complexe de superiORité.
fr_5352	“ Il était une fois une magnifique princesse …, Perrault-ra-t-il.
fr_5355	Le gérant du magasin de bateaux a gagné assez d'argent pour se permettre de mettre les voiles.
fr_5370	Lorsque tu portes une montre dans la queue d'un magasin, le temps file.
fr_5388	"""J'ai écouté les concertos brandebourgeois"" dit Tom, prêt à nous donner son feedbach."
fr_5428	Quel est le comble pour un photographe ? De perdre de vue ses objectifs.
fr_5430	L'impression d'une Gleem dans votre bouche.
fr_5431	""" Il y a de la place pour un de plus "", admit Tom."
fr_5457	On l'a piqué en train de se gaver de miel.
fr_5460	On est allé à ce salon de hiboux, c'était super chouette.
fr_5462	Pour avoir de bonnes notes en couture, il faut connaître tous les bons fils.
fr_5466	C'est un fait, les plus grands dorment plus longement au lit.
fr_5468	Vers un meilleur lendemain.
fr_5469	Le plan d’affaires pour monter son entreprise de ciseaux n’a pas permis de percer.
fr_5479	"Une femme dit à son mari, ""c'était un passage de gaz explosif, je dirais d'environ 8.0 sur l'échelle du sphincter."""
fr_5480	""" Je lis du Voltaire "", admit Tom, candide."
fr_5485	Prier à l'avance.
fr_5499	Un photographe ne meurt jamais, seulement, il n'a plus d'objectifs.
fr_5503	Tom Hodgkinson ouvre la cage aux oisifs
fr_5504	Les gens qui fabriquent du mazout sont très raffinés.
fr_5516	Lorsqu’ils ont apporté une orange pour remplacer le ballon, il n’y avait plus un zeste dans le stade.
fr_5518	Les vieux jardiniers ne fanent jamais même quand ils sont déflorés.
fr_5548	Chaque jour est un cadeau de Dieu, c'est pourquoi on l'appelle le présent.
fr_5558	Un astronaute qui échoue à une expérience en zéro G doit s'inquiéter de la gravité de la situation.
fr_5563	Un optométriste devrait se porter candidat à la présidence, car ils sont des gens de vision.
fr_5569	"Moins cher, moins rèche ! 
Moins cher, plus fier !"
fr_5570	"""Je prendrai ça"", dit Tom de manière appropriée."
fr_5594	Les personnes qui cherchent la petite bête ne meurent jamais, ils grouillent partout.
fr_5606	"Le premier canard ne put aller dans l'eau. L'autre canard lui dit : ""Arrête de faire le pied de grue et viens barbotter."""
fr_5617	L'autre jour à la ferme j'ai vu un mouton manger de la menthe. Je pense qu'il voulait garder la laine fraîche.
fr_5626	l’Arithmétique : l’Ambition, la Distraction, l’Enjolification, et la Dérision.
fr_5629	Un magasin de musique a été cambriolé. Le voleur a pu s'enfuir avec tout le butin tant son cambriolage était bien orchestré.
fr_5648	La nourriture que l'on sert dans les avions est bonne à jet-er.
fr_5654	AH, JE VEUX QU’ON ME CARESSE, MOI AUSSI ! SOUPIR... AU FINAL, C’EST UN CONCOURS DE POPUCE-ARITÉ.
fr_5655	Le trampoline était en vente pour 50 % de remise. J'ai sauté sur l'offre.
fr_5656	Fie-toi à ton intestin.
fr_5657	Mes camarades en cours supérieur de géométrie, ont pour habitude de suivre les règles.
fr_5674	"""Je me suis planté une épingle dans le nez"" dit Tom, piqué au vif."
fr_5676	Un boulanger ne meurt jamais, seulement, il est dans le pétrin
fr_5678	L'avocat amorça la discussion sur les explosifs.
fr_5679	"“J’abats des arbres, c’est mon bouleau"" dit Tom"
fr_5682	Le petit sapin s'était fait enguirlandé par son père. Il avait les boules.
fr_5685	Le candidat se demandait pourquoi sa déco sur le thème des pirates n'avait pas plu aux juges. Ils lui ont dit que c'était son choix du thème qui avait sabordé son projet.
fr_5694	Les vieux ingénieurs du train ne meurent jamais, ils déraillent juste.
fr_5703	Apporte moi un ressors, et que ça saute !
fr_5705	"""Jouons un la, un do dièse et un mi"", s'accorda d'une voix aiguë la bande de Tom."
fr_5714	Si vous tombez malade à l'aéroport, ça pourrait être une maladie terminale.
fr_5717	Moi, je suis allé à un festival de cinéma, cancanna Tom.
fr_5741	Pour rester en forme, le prêtre fait des exorcismes.
fr_5747	‘’ Il y a de la place pour un de plus’’ admit Tom.
fr_5763	Docteur, docteur, aidez-moi : je crois que je suis kleptomane. - Ne vous inquiétez pas, je vais trouver ce que vous allez prendre ! Suivant !
fr_5771	"Rien que pour le jeu de mots dans le titre de la pièce, ""L'importance d'être constant"" aurait dû avoir un Oscar."
fr_5774	"Le “parce que"" est un conseil avisé aux "" pourquoi "" de ma viande rouge bleue."
fr_5797	Nous jouerons tous un La, un Do dièse et un Mi, cria le groupe de Tom en chœur.
fr_5802	Je pratiquais l’escalade de falaises quand j’étais petite, j’étais quand même plus assurée à l’époque.
fr_5808	Si tu es raide comme une planche, c’est peut-être à force de t’être un peu plié.
fr_5812	Les prévisionnistes météorologiques sous-payés ont prévu une tempête de protestation.
fr_5817	Avant que le golfeur ait fini de boire sa boisson glacée et infusée, il a fait tomber son Thé-shirt sur le chemin pour voiturettes.
fr_5824	Les vieux artistes ne meurent jamais, ils perdent juste de leur perspective.
fr_5832	Allez les gars, on joue un la, un do dièse et un mi, cria le groupe de rock de Tom à l'unisson.
fr_5845	Les vieux logiciens ne meurent jamais, ils trouvent juste la sorite.
fr_5848	Il m'a dit qu'il pouvait manger un steak de 32 oz, mais je trouvais ça difficile à avaler.
fr_5850	Un bébé éprouvette à une chambre avec vue sur mère
fr_5853	Faire du mal à une abeille ? Nous frôlons l’agression.
fr_5876	Quand on a inventé le colle fou, beaucoup de gens se sont attachés.
fr_5879	A : Prenez un peu plus de thé. B : Je n’en ai pas pris du tout. Je ne peux donc pas en prendre un peu plus. C : Vous voulez dire que vous ne pouvez pas en prendre moins. Il est très-aisé de prendre un peu plus que pas du tout.
fr_5881	Ils l'accueillirent les bras grands ouverts, psaumes tournés vers le ciel.
fr_5903	Un coiffeur très occupé en vient parfois à s'arracher les cheveux.
fr_5929	Je m'appelle Ringo, je suis boxeur.
fr_5938	Bienvenue aux Martiens. Nous avons de l'espace pour tous.
fr_5947	Lorsque le professeur posa une question, aucun élève ne baissa les bras.
fr_5961	C'était l'anniversaire de l'inventeur du grille-pain. Ils ont porté un toast en son honneur.
fr_5962	Ils la suspectent d’avoir volé une broche mais ils n’ont pas pu l’épingler.
fr_5982	Le rejeton du pin fut admonesté par son père. Apparemment, il se faisait des noeuds.
fr_5986	"""Utilise ta propre brosse à dents"", hurla Tom les poils hérissés."
fr_6020	La photo que j'ai pris de la tempête de sable était granuleuse
fr_6021	L’éditeur a décidé de soigner son obésité chronique après chronique.
fr_6035	Je peux faire une excellente impression de Sinatra, a dit Tom, étant parfaitement franc.
fr_6037	Si c'était bIERe alors c'est du passé, à chaque jour sa Tuborg.
fr_6040	Je m'appelle Élie. J'élève des oiseaux
fr_6045	Pour être lucide, il faut manger ! Un esprit sain dans un corps plein !
fr_6068	Avant de se lancer dans la vente de puits, ils faut trouver un fonds de commerce
fr_6070	Quand vous achetez une batterie, vous ne devriez pas avoir à la charger.
fr_6105	Pour ce qui est du nouveau puits de mine, il n'a pas souhaité creuser le sujet.
fr_6110	sectionnée ? Il ne va plus marcher droit maintenant.
fr_6112	D'abord je t'enchaîne. Ensuite, je me déchaîne.
fr_6117	"""Je me suis fais percer le nez"", pointa Tom."
fr_6124	On fait grandir et rafraîchit les branches de votre entreprise.
fr_6134	Les psychanalystes aiment l'alcool freulaté.
fr_6138	J'ai essayé d'enregistrer mon album dans une animalerie, mais le gecko était horrible.
fr_6144	Je n'aime pas les blagues sur la nourriture. Elles manquent de goût.
fr_6154	Tom portait sa coolitude sans ironie.
fr_6167	Celui qui a volé un calendrier a pris douze mois.
fr_6170	Si tu travailles dans une patisserie, tes responsabilités iront croissant.
fr_6202	Je m'appelle Manuel, j'écris des notices d'utilisation.
fr_6203	Les dures journées au travail, ce n'est cariement pas pour les dentistes.
fr_6227	La présentatrice météo a annoncé de la pluie sans aucune précipitation
fr_6243	On a été au salon du hibou. C'était vraiment chouette!
fr_6260	Cousteau a été submergé dans son travail.
fr_6261	Il avait acheté une assiette à quatre coins. Maintenant, tout ce qu’il mangeait était carrément bon.
fr_6264	Il y avait un chef d'orchestre avec des problèmes de temporament
fr_6269	Je suis un chasseur de lions, dit Tom en rugissant.
fr_6273	La médecine du travail l'avait prévenu que travailler dans un abattoir était un métier tuant.
fr_6274	« Je peux en manger cent quarante-quatre », se vantait salement Tom
fr_6278	Le poulet a traversé le bar pour atteindre l'autre beauté
fr_6279	Quand le voleur de livres a été arrêté, il n'avait pas voix au chapitre.
fr_6283	Je me suis acheté une de ces nouvelles chemises en papier recyclé. Elle déchire !
fr_6286	L'inventeur des lunettes a eu le coup d'oeil.
fr_6288	J'ai étudié les écrits de Freud, mais ils ne m'ont pas Marx-é.
fr_6290	Le poisson a raté l'appel parce qu'il était coincé sur l'autre ligne.
fr_6310	Smart, le choix intelligent.
fr_6323	Vous ne trouverez pas plus rares thés
fr_6331	Un jour quelqu’un m’a accusée d’avoir volé un œuf de Fabergé très rare, et je n’ai pas pu rester pondéré.
fr_6334	"""Si seulement quelqu'un pouvait jouer avec moi aux cartes"", soupira Toto, solitaire"
fr_6364	Le cycliste avec des problèmes de coeur a dû se lancer dans un régime sans selle.
fr_6366	Les tailleurs, parfois, décident de faire à leur mode.
fr_6371	Gouache wesh ! Maintenant chevalet faire un peu de peinture, dit Tom d'un air pincé.
fr_6383	Pendant la préparation du beurre il y a une faible marge-arine d'erreur
fr_6385	Les universitaires ne meurent pas, ils perdent juste leurs facultés.
fr_6394	Le problème de faire la fête le samedi ET le dimanche, c'est lundisponibilité qui suit.
fr_6407	On devrait faire une pub pour la bière. Ça a l'air tout simplement enivrant.
fr_6416	Les vieux académiciens ne meurent pas, ils perdent seulement leurs facultés.
fr_6419	Le cours des éclaireurs pour apprendre à confectionner des habits s'est déroulé sans accroc.
fr_6423	Elle n'était que fille de forgeron, mais elle avait beaucoup de savoir-fer.
fr_6430	L'intégrale apporte un peu d'aire dans le calcul.
fr_6433	On attend des joueurs de baseball qu’ils sachent jouer correctement sur-le-champ.
fr_6440	Ma mère n'a plus vu mon père depuis ma naissance, c'est un très mauvais transparent.
fr_6453	J’étais contre la création d’une maison close pas loin de chez moi, j’avais peur que ça crée trop de bordel.
fr_6471	Appelle-moi un taxi. - Ok, t'es un taxi.
fr_6487	"""Sauvez les baleines, cracha Toto, Cétacé!"""
fr_6488	Les coureurs portaient tous des shorts trop petits pour eux, alors la course était serrée.
fr_6495	Il ne faut jamais prendre les boules de bowling comme àquille.
fr_6500	Je viens de lire les Principes Mathématicaux de Newton, et j'ai trouvé beaucoup de choses très dérivées.
fr_6507	Les docteurs ont dû m'amputer les membres supérieurs. Les bras m'en tombent.
fr_6515	Ça me plaît quand les chevaux défilent sur les Champs Elysées. Je trouve sabot.
fr_6524	A : C'est donc là que vous voulez en venir ? B : C'est exactement là où je voulais en venir. C : Où voulez-vous en venir ? Dites-le-moi, que j'y aille aussi.
fr_6526	J'ai fait tomber ma marmite de curry. Heureusement que j'avais du piment fort pour m'aider à la relever
fr_6528	Tu ne peux pas avoir eu 11 en philo car le Marx, c’était 10/10.
fr_6561	sectionnée ? Il a droit à une bonne convalescence maintenant.
fr_6618	Un plongeur ne meurt pas, il est submergé.
fr_6635	Un bûcheron abat beaucoup de travail
fr_6636	Ça donnerait envie de s'y noyer
fr_6647	Tu sais lire la musique ? demanda notamment le chef d'orchestre.
fr_6649	Pour rattraper son retard dans ses livraisons, le fleuriste ne pouvait plus se reposer sur ses lauriers.
fr_6652	Maintenant qu’ils étaient en appartement, ils n’avaient plus besoin de tondre la pelouse, sup-herbe !
fr_6673	Les lapins aiment la bière parce que, on a bondir, le houblon, c'est bond.
fr_6680	Mon podologue me soigne aux p'tits oignons
fr_6684	Les vieux encadreurs de porte ne meurent pas, ils sortent juste de leurs gonds.
fr_6726	Je vais chez Pat' pour me faire une manucure.
fr_6729	Les avocats doivent aimer l'alcool parce qu'ils sont toujours appeler à la bar.
fr_6739	Argh, j'ai attrapé la mort !
fr_6740	Le couple a cultivé des arbres fruitiers jusque dans l'âge mûr.
fr_6748	Elle est devenue trafiquante d'art pour gagner plus de Monet.
fr_6765	La vie d'un cheval de course est toujours sur la bonne voie.
fr_6766	Rester patient c'est résister à l'attentation
fr_6768	Tu as vu comme son père est devenu invisible quand il a révélé se sentir femme ? C'est devenu un transparent !
fr_6773	Un couple s'est séparée violemment lors d'un jour embrumé. Ils se sont embrouillards.
fr_6778	John Deere a sorti un nouveau modèle d'attelage pour ses tracteurs. Il a été très remorqué au salon de l'agriculture.
fr_6787	On n'a plus de citrons', dit-elle amèrement.
fr_6795	Les vieux électriciens ne meurent pas, ils travaillent jusqu'à ce qu'ils n'aient plus de jus.
fr_6824	Je n'ai pas « entendu » l'heure, je l'ai « vue » !
fr_6829	Pour trouver toutes les relations logiques possibles dans un ensemble définie, il ne faut pas des SI mais de la Venn
fr_6832	Je reste sourd à vos accusations, dit Tom d'un air entendu.
fr_6841	Si on laisse une soupe aux pâtes alphabets sur le feu sans surveillance, on risque de créer U.N A.C.C.I.D.E.N.T.
fr_6849	Un jour, les félins dirigeront le monde. Vous verrez, ce sera une chatastrophe.
fr_6851	Elle n’était que fille de paysan, mais elle allait souvent aux asperges dans le comté.
fr_6855	Quand l'eau en bouteille est bon marché, ça s'appelle une vente de liquidation.
fr_6872	Un tarte auditionne pour un rôle dans une pièce de théâtre. Malheureusement, le recruteur n'est pas friand de son jeu d'acteur.
fr_6873	Un marin ne meurt jamais, seulement, il décide que cétacé.
fr_6881	Les consommateurs de thé ont tendance à mieux travailler, car ils sont pleins de créativi-THÉ
fr_6882	Les addicts du shopping ne meurent jamais, ils souffrent de différentes ruptures.
fr_6896	En gros, je peux manger une centaine de burgers, dit Toto grossièrement.
fr_6901	Les dentistes n'aiment pas quand les patients ont la dent dure.
fr_6935	Après avoir brûlé ses cookies, le pâtissier avait le coeur en miettes.
fr_6939	Complimenter, c'est relâcher l'ex-pression
fr_6947	La carte maîtresse, l'une après l'autre
fr_6961	Tout seul, tu as raison. En groupe, tu es à la ramasse.
fr_6972	Les vieux UTILISATEURS DE CRÉDIT ne meurent jamais, ils expirent juste.
fr_6976	Les astrophysicien étudiant le soleil sont des gens brillants et leurs idées ont un rayonnement planétaire.
fr_6979	"""Mon crayon n'arrive qu'à faire des gros traits"", dit-il grassement"
fr_6982	La glace de la patinoire présente de nombreuses ornières. Je pense que l'équipe de maintenance est en train de déraper.
fr_6988	"La logique de Mlle von Karma est sans faille. Vous perdez votre temps. [...] (On dirait que je viens de trouver le ""trou"" que je cherchais )"
fr_6992	"""Je me suis fait faire un piercing dans le nez"", dit Tom d'une voix pointue."
fr_6993	Pourquoi le chien n'a pas pris de café ? Car il haletait.
fr_7043	Je m'appelle Leo, un entraîneur de lion.
fr_7049	Plabo et José ont attendu un signal de la part de Pilar pour la rejoindre dans la tour de l'église, mais aucun des deux n'a répondu au carillon, car ils ne savaient pas lequel des deux cette cloche sonnait.
fr_7050	Il voulait me vendre des vitres, mais ses motivations étaient transparentes.
fr_7055	Tu as entendu parler du gars qui a été poignardé dans un garage en sous-sol ? On ne sait toujours pas parquing il s’est fait tuer.
fr_7064	Fais confiance à ton blair.
fr_7069	Les vieux jardiniers ne meurent pas, ils sont juste déflorés.
fr_7071	Ils disent que la curiosité est un vilain dé faux, les gens sont dans le vrai dé fois.
fr_7078	Il était un critique de restaurant, mais il n'avait aucun goût.
fr_7080	Un boulanger ne meurt pas, il perd son gagne-pain.
fr_7082	Elle pédale tellement dans la semoule qu'elle pourrait faire un couscous !
fr_7092	Le choix du père du père de votre père.
fr_7119	Le magasin d'aubaines promettait un boulier gratuit pour tout achat, mais il ne fallait pas y compter.
fr_7134	Pour un chimiste déçu d'une expérience, la réaction était sur son visage.
fr_7143	Si vous jardinez, autant vous considérer comme un gérant vert.
fr_7149	Les salariés de l'accueil sont très froids. Il créent un environnement hostel.
fr_7156	Les boulangers ont un grand pétrin pour faire du pain.
fr_7157	Beaucoup d’arbres mouraient mais ils essayaient de revenir à la racine du problème.
fr_7171	Nouveaux développements de la guerre des étoiles: la Grande Ours finit dans une grande casserole
fr_7180	Elle est devenue marchande d'art parce qu'elle voulait plus de pièces de Monet.
fr_7182	Quand un animal se fait tailler la queue en pièces, il va se faire soigner chez un détaillant.
fr_7187	Si tu portes un bandeau sur tes yeux au stand de tir, tu ne sauras pas ce que tu rates.
fr_7191	C'était un charpentier connu pour son travail de pointe.
fr_7199	ROCKFISH. Délicieux fruits de mer, pour les petites boursins.
fr_7211	Un nom et un verbe sortaient ensemble, mais ils ont rompu parce que le nom était trop possessif.
fr_7221	C'est un bien joli miroir, dis Tom en réfléchissant.
fr_7230	"""Joli miroir !"" dit Tom en réfléchissant."
fr_7235	Elle n'était que la fille du forgeron, mais elle se forgeait déjà sa propre destinée.
fr_7243	Data a eu tellement d'ennuis que ses parents l'ont envoyée faire des paquets.
fr_7262	Les vieux ingénieurs de locomotives ne meurent jamais, mais il déraillent.
fr_7263	Les acrobates font toujours de bon tour.
fr_7272	Pourquoi les crabes ne font jamais don de leur argent? Parce que ce sont des pinces
fr_7274	J'ai préparé une soupe au pain, ça baigne pour toute la semaine.
fr_7283	Je ne fais pas confiance aux lapins ils racontent des sauttises
fr_7287	A l'époque où les nouvelles étaient écrites sur des plaques en argile, elles étaient fracassantes.
fr_7289	On a entendu des coups de feu dans le bar du coin. La police ne sait pas ce qui a détenché le conflit.
fr_7292	Pour apprendre aux amateurs à reconnaître les champignons, il faut bien moisir ses exemples.
fr_7296	Je m'appelle Derek, je suis dans l'industrie des plates-formes pétrolières.
fr_7299	Wilber Wright dit qu’il souhaitait voler de ses propres ailes.
fr_7307	Cet armateur, qui n'était pas un amateur, n'a recruté que des marins obséquieux pour s'assurer que son contre-torpilleur flatte bien.
fr_7311	Le mortician tardait à dîner parce qu'il était enterré dans son travail.
