id	text
fr_7327	Si vous vous sentez raide comme un morceau de bois, vous avez peut-être un problème au tronc.
fr_7328	Il n'élèvera jamais de volaille, c'est une poule mouillée.
fr_7332	Les vieux professeurs ne meurent jamais, ils perdent juste leur classe.
fr_7335	Sa carrière a décollé quand il est devenu aviateur.
fr_7354	"“Cette armure, je la fabrique avec des maillons"", répondit Tom, “il n’y a que ça qui m’aille""."
fr_7364	Un serrurier doit avoir une bonne combinaison de talents
fr_7391	Venez butiner des infos sur les abeilles à l'origine de vos glaces au miel préférées en visitant la page Save the Honey Bees.
fr_7401	Le bonnet ne se met pas sous tifs mais plutôt dessus.
fr_7408	Certains caissiers en font des caisses.
fr_7429	Venez vous parfum-pliquer
fr_7437	Pour les entreprises de cartes de vœux, leur destin est dans les cartes.
fr_7445	La grossesse est si longue, ça peut paraître une maternité.
fr_7451	Les consommateurs de thé ne fréquentent pas les mauvais employés, ce n'est pas leur tasse de thé.
fr_7458	Quand le souffleur de verre a inspiré, ça lui a coupé le souffle.
fr_7468	Elle s'est fait épingler pour une histoire de broche volée.
fr_7470	Les vieux bouchers ne meurt jamais, ils deviennent juste des vieilles carnes.
fr_7496	On tue les animaux pour leur viande dès leur plus tendre enfance.
fr_7508	Deux astronautes qui sortaient ensemble se sont séparés car ils manquaient d'espace.
fr_7521	Tu as entendu parlé du crime qui a eu lieu sur le parking ? Un scandale à tous les niveaux.
fr_7529	Je suis ici - avec un cadeau ! dit Tom à présent.
fr_7543	LADY BRACKNELL : Je dois dire , Algernon, qu'il est grand temps que Monsieur Bunbury se décide à vivre ou mourir.
fr_7570	C'est un paramètre réel, pas un paramètre formel,'' était l'argument de Tom.
fr_7575	La clé pour être un ténor dans son domaine est de mettre les bémols en sourdine et de conserver plusieurs cordes à sa harpe.
fr_7577	"""Il va falloir attendre longtemps pour que vous me trouviez une table ?"" Demanda Tom sans réserve"
fr_7579	Ce nouveau roman policier a un début qui tue.
fr_7584	Tu connais la fille du laitier ? Une vraie crème !
fr_7588	J'ai besoin d'une couverture ! Il fait plutôt froid ici !
fr_7589	Les vieux randonneurs ne meurent jamais, ils ont les pieds sur terre.
fr_7590	L'invention de la glace a mis faim au problème.
fr_7594	Les régimes, c'est pour les gens qui en ont gros.
fr_7598	Ma nouvelle théorie sur l'inertie ne semble pas prendre de l'élan.
fr_7599	Les Grecs y perdent-ils leur latin ?
fr_7623	Il a décidé d’ouvrir un magasin de bateau, car il aime surfer sur les tendances.
fr_7639	Si tu danses une marche dans l'escalier, mieux vaut ne pas la rater !
fr_7640	- Comment avez-vous trouvé votre steak, monsieur? - J'ai juste déplacé la pomme de terre et là était le steak.
fr_7651	Un arboriculteur ne meurt pas, il est déraciné.
fr_7653	"""J'ai gagné 30 kilos"", dit Tom lourdement."
fr_7673	Certains mathématiciens se font traiter de sinus habens.
fr_7675	Je m'appelle Lionel. Je suis dresseur de lions.
fr_7683	Je n'ai pas encore fait développer mes photos, dit Tom d'un ton négatif.
fr_7687	Un doyen d'université ne meurt pas, il perd ses facultés.
fr_7697	Cousteau était plongé dans son travail.
fr_7703	Appelle-moi le chauffeur ! - Ok le chauffeur !
fr_7715	C'était la plus honnête boulangère mais ils la laissèrent partir avec une franche de pain
fr_7722	Les médecins ont dû m'enlever un os du bras, dit Tom, d'humeur peu radiuse.
fr_7723	Le cours d’apprentissage des nœuds de notre groupe de scouts se passa sans accroche.
fr_7725	Les vieux ingénieurs de locomotive ne meurent jamais, ils déraillent.
fr_7727	Si une abeille se fait maltraiter, est-ce que la police va intervenir dare-dare ?
fr_7735	Les anciens professeurs de math ne meurent pas, ils utilisent des expressions étranges.
fr_7746	Ils l'appelaient le roi des dentistes parce qu'il se spécialisait dans les couronnes.
fr_7751	L'homme apporta son parapluie à la brûlerie de café parce qu'il avait entendu dire qu'il y avait un risque de grain.
fr_7754	""" Je n'ai pas encore fait développer mes photographies "", répondit Tom, négatif."
fr_7765	Pour tuer un cirque entier d'un seul coup, il faut jongler avec des scies circulaires.
fr_7766	Un pratiquant de baseball a demandé s'il avait une bonne courbe, mais il voulait une réponse directe.
fr_7769	Avec tout le noir que vous broyez, vous feriez mieux de vous moudre du café.
fr_7776	Les pharmaciens trouvent que leur travail est une délivrance.
fr_7779	Fille d'un simple fermier, elle avait la plus jolie binette du comté.
fr_7781	Un spationaute échouant au test d'apesanteur doit avoir conscience de la gravité de la situation.
fr_7783	Ils ont déménagé en appartement pour ne plus avoir à tondre le gazon. Maintenant, ça gaze pour eux !
fr_7792	« J'aime les marges gribouillées, » a dit Tom sans justification.
fr_7800	Un cowboy qui avait un bon coup de crayon le dégainait à tout propos.
fr_7801	T'as entendu parler du bivavle qu'ils sont en train d'interroger ? Ils pensent qu'il a commis le meurtre, mais il est fermé comme une huître.
fr_7802	ALLEZ, ON SE SERRE LA CARPE !
fr_7804	Une chronique d'astronomie dans le journal y consacrerait beaucoup d'espace.
fr_7808	Le voleur de lingerie s'est échappé en sautant depuis le balconnet.
fr_7815	Si tu es jardinier, tu peux te présenter en tant que manager en herbe.
fr_7820	Beaucoup de gens donnent du crédit au seigneur, peu de gens lui donnent de l'argent.
fr_7823	Cet inventeur de génie n'avait même pas le brevet des collèges.
fr_7825	Mes compétences en ski vont vraiment en descente.
fr_7859	Il fait chaud ici, ou ça vient de moi ?
fr_7860	Elle voulait être tisserande mais il y avait toujours trop d'accrocs.
fr_7863	Une fois l’équerre inventée, le problème fut réglé.
fr_7871	Elle n'était que fille de menuisier, mais elle en avait des vices.
fr_7873	Quand le pape a visité la France, il a manqué la Metz.
fr_7883	La beauté en bonnes et dues formes
fr_7887	Sa femme adorait la poterie, mais pour lui c'était juste grès chiant.
fr_7889	Les vieux cordonniers ne meurent jamais, mais ils cassent les pieds.
fr_7891	"""Je me sens vide"", dit Toto sans cavité"
fr_7911	Au bout d'un moment, les vieilles imprimantes n'ont en plus rien à taper.
fr_7912	"""Je sais ce qu'il faut pour donner du goût à cela"", fit Tom, mutin."
fr_7916	Les VIEUX ÉLECTRICIENS ne meurent jamais, ils ne peuvent juste pas faire de connexions.
fr_7927	Avec certains caissiers, les choses sont longues à enregistrer.
fr_7928	Les vieux sauteurs à l'élastique meurent parfois, mais ils trouvent toujours le moyen de rebondir.
fr_7930	J'ai eu des problèmes de dos, mais ça m'a tout derrière moi.
fr_7966	Pratique la langue des signes quand il s'agit de filer un coup de main à un sourd-muet.
fr_7969	Insulter un chef indien vous vaudra un mauvais Korma.
fr_7971	Ceux qui jouent des instruments de musique pour la radio ou la télévision doivent rester à l'écoute.
fr_7978	Même s'il était reconverti en cuisinier maintenant, il gardait toujours ses réflexes de coiffeur quand on lui demandait un canard laqué.
fr_7989	Mon nom est Zéphyr. J'élève des oiseaux.
fr_7991	Un électricien ne meurt jamais, il travaille et il ampère la tête.
fr_7997	"Hier, j'ai débouché mon évier.
Ça m'a siphonné toute mon énergie."
fr_8007	Trouver l'air est une part intégrale de l'arithmétique.
fr_8018	J’adore les chats, beauté.
fr_8027	Je fais beaucoup de feuilles de calcul dans mon bureau, c'est dire que je suis excellant au travail.
fr_8035	La journée des chevaux a été sabotée par le mauvais temps.
fr_8052	Vous voulez la clef du succès pour améliorer vos performances ? Il est de bon ton d'être en désaccord majeur avec les critiques et de poursuivre votre octavité musicale.
fr_8064	Les vendeurs de valises se démènent pour éviter que que vous ne vous fassiez la malle au lieu d'acheter.
fr_8090	"""C'est entre mon bras et mon avant-bras"", articula Tom d'un air sinueux."
fr_8092	""" J’aurais aimé faire partie du corps de travailleurs chinois "" dit Céleste."
fr_8093	Chaque fois que les prêtres ont une idée originale, on leur demande de l’enterrer.
fr_8095	Un type est devenu si habile avec la tronçonneuse qu'on l'a nommé directeur de branche.
fr_8097	Les ampoules sont une invention brillante.
fr_8102	Une cuisinière faisait des crêpes à la volée.
fr_8132	Il en va de suie que le Père Noël descende par la cheminée.
fr_8134	Son père était forgeron. Elle avait un caractère bien trempé.
fr_8136	"""Fait comme si nous étions à l'époque où les trains à vapeur n'existaient pas"", siffla Tom."
fr_8164	Une étrange secte s'était formée dans mon chenil, leur chef rappelait un loup gourou
fr_8165	En général, le courant passe bien entre électriciens.
fr_8167	Si on laisse une soupe alphabet sur le feu et qu'on sort, ça sera un désastre de A à Z.
fr_8172	"Le premier canard refusait d'aller dans l'eau. L'autre lui ""Vas-y donc, espèce de poule mouillée !"""
fr_8190	Les mensonges colportés sur les puces et les tiques ont tendance à parasiter la recherche.
fr_8192	Voulant acheter à sa lapine le cadeau idéal, Bugs Bunny a décidé de partir sur du 24 carottes
fr_8193	Ils ont remplacé la balle de baseball par du piment pour épicer le jeu.
fr_8197	Pour un humoriste, il n'y a pas de pire auditoire qu'une bande d'apprentis alcoomiques.
fr_8200	Le serveur l'a informé qu'il n'y avait plus de soupe et il a répondu « Wow, je n'ai vraiment pas de bol ! »
fr_8233	Vous aurez un avocat tellement incompétent qu'à côté, même vous, vous aurez l'air doué.
fr_8239	Sur la route, les musiciens chantent toujours à plusieurs voies.
fr_8252	"""J'agonise"", râla Tom"
fr_8266	Fille de ramoneur, mais elle m'a bien ramoné.
fr_8276	Après avoir tant travaillé, le maître verrier se dit qu'il en aurait bien besoin d'un.
fr_8284	Un prof de math ne meurt pas : il est élevé à la puissance supérieure, c'est tout.
fr_8307	Elle mourait d'envie d'acquérir l'immense propriété, mais elle n'osait pas en palais à son mari radin.
fr_8317	Il avait mis un imperméable avant d'aller acheter des légumes car il craignait qu'on l'asperge
fr_8322	Les vieux élèves de GEOMETRY ne meurent jamais, ils s'en vont sur une tangente.
fr_8341	"""Pas question que je me sépare de ma meute !"" aboya Tom."
fr_8350	"""Depuis mon donjon, je vois toute la ville"", dit Toto avec hauteur"
fr_8354	Tu as vu la nouvelle pinata qu'ils ont sortie ? Ils ont frappé fort.
fr_8355	Je dois vite mettre cette affaire au clair lâcha Prune en fonçant
fr_8373	Les zèbres aiment leur bière bien panachée.
fr_8377	Le chauve envisageait des implants capillaires pour ne plus s'arracher les cheveux en se voyant vieillir.
fr_8378	L'inventeur de la échelle Fahrenheit a résolu le problème par des degrés.
fr_8385	La fermeture du magasin de bateaux a fait des vagues dernièrement.
fr_8395	Nos bikini sont passionnants. Ils sont tout simplement les tops.
fr_8396	Les installateurs de tuyauterie ont souvent des tâches à haute pression.
fr_8405	Si les rongeurs disparaissent, ça rat-iboisera l’écosystème.
fr_8438	Docteur, docteur, je continue de penser que je suis une balle de billard. - Rejoignez la queue.
fr_8445	Les vieux profs d'arts plastiques ne meurent pas, ils s'emmêlent les pinceaux.
fr_8451	"Un chien m'a mordu"", dit Tom avec rage."
fr_8466	Quel est le comble pour un barman qui est plutôt cocktail et supervise un stagiaire pas très doué? D'être scotché !
fr_8483	Les musiciens dignes de mention sont très composés.
fr_8484	Un directeur de banque adepte du saut en hauteur a atteint des sommets lors du dernier exercice.
fr_8499	Ce n'est pas en jetant des bananes qu'on mène une Guorrilla!
fr_8507	Les photographes ne meurent pas, seulement, ils deviennent des vieux flous.
fr_8530	""" Ne restez pas planté là ! "", dit le jardinier."
fr_8553	Quel est le comble pour un médecin ? De perdre patience.
fr_8556	Les vieilles imprimantes ne meurent jamais, elles sont trop cyantes.
fr_8564	Elle était suspecte dans une affaire de vol de broche, mais ils n'arrivaient pas à l'épingler.
fr_8586	Je m'appelle Colombe. Je suis ornithologue.
fr_8587	Les vieux électriciens ne meurent jamais, il faut juste qu'ils ar-Hz un jour.
fr_8588	Une vache trop soignée donnera du lait gâté.
fr_8591	Les affreuses gorgones sont-elles médusées ?
fr_8596	Je ne tiendrais pas longtemps sans mes jambes
fr_8629	Que fait un saumon pour doubler une truite ? Une queue de poisson.
fr_8639	Elle était seulement fille de fermier, mais elle était la plus grande bêcheuse du pays.
fr_8641	Qu’est ce qui fait qu’un quainard flotte à la surface de l’eau ? Il en a jamais mare.
fr_8642	La flambée du cours des céréales a permis à certains de se faire du blé
fr_8644	Un soir, les hommes du Roi Arthur découvrirent le trafic illégal de whisky de Lancelot et montèrent sur leurs grands chevaux.
fr_8648	Les compagnies aériennes sont devenues si pénibles qu'elles m'ont facturé mon bagage émotionnel.
fr_8650	Les gorilléros se sont fait bananer.
fr_8653	"“J’ai oublié mon numéro de téléphone, oh, c’est 06 25 18 78 63 !"" Tom se rappela."
fr_8654	Pour rester frais, les hipsters ne boivent que du thé glacé.
fr_8656	L'homme de main n'avait pas perdu pied: il sut se relancer.
fr_8664	Il vola une perceuse et après il raconta des mensonges évidants.
fr_8673	Les vieux profs de maths ne meurent pas, mais ils développent des problèmes de sinus.
fr_8685	Un golfeur ne meurt jamais, il change de club, c'est tout.
fr_8686	Hautement REDommandé
fr_8693	Pour une femme qui cherche une taille triple XL, ce n’est pas une mince affaire.
fr_8701	Rah, j'ai la crève !
fr_8702	Dans les équations, dès qu'il y a des nombres au carré, je n'arrive pas à prendre le problème à la racine.
fr_8705	Les vieux cowboys ne meurent jamais, même quand ils en ont plein les bottes.
fr_8707	Le pistilet d'une fleur est sa seule défense contre les insectes.
fr_8715	Deux entreprises qui fabriquent des règles ont décidé de se aligner.
fr_8719	Pour soigner mes allergies, mon médecin m'a aiguillé vers un acupuncteur
fr_8726	"“Si je lâche le plafond, tout va s’effondrer"", maintient Tom."
fr_8743	Une colonne d'astronomie dans le journal aurait beaucoup d'espace consacré à elle.
fr_8746	Les abstinents ont toujours tort.
fr_8753	Les deux inventeurs du radio étaient sur la même longueur d'onde.
fr_8762	Les vieux Janitors ne meurent jamais, ils sont juste balayés.
fr_8790	"J'étais invité à un marriage en inde et j'ai voulu plaisanter avec la mariée en lui disant: ""vous voilà dans de beaux draps!"" Ça ne l'a pas fait sarire."
fr_8795	T’as entendu parler de la nouvelle pinata ? Apparemment elle vaut le coup.
fr_8797	Un coiffeur occupé sera toujours tressé.
fr_8802	Les profs de yoga ont des horaires flexibles.
fr_8813	"""3,14159265', piaula Tom / fit Tom pieusement."
fr_8817	Je m’appelle Marin, j’aime bien me balader sur la plage.
fr_8819	Les vieux botanistes ne meurent pas, ils sont seulement déflorés.
fr_8820	"""J'ai combattu aux côtés du dernier des Mohicans"", conclut bravement Toto."
fr_8834	Beaucoup de personnes devraient apprendre à être heureuses de l'État dans lequel elles se trouvent.
fr_8838	"""Je t'appellerai plus tard"". Ne m'appelle pas plus tard, appelle moi donc papa"
fr_8856	Le chef des pompiers se voyait toujours poser les questions les plus brûlantes.
fr_8880	Super-colle ! adhéra Tom.
fr_8897	Sa décision de s'engager dans l'escalade était précipitée, pour le moins.
fr_8913	Tu as attrapé une fourmi ! Elle est pour ti !
fr_8916	"""Si je n'étais pas là, le monde s'écroulerait"", soutenait Toto."
fr_8917	Ils s'étaient cachés dans un sauna pour faire croire à leur poursuivant qu'ils s'étaient évaporés
fr_8925	Même si le puits était pour elle un mystère, elle ne souhaitait pas en savoir plus, au fond
fr_8940	Pablo et Jose attendirent un signal de Pilar pour la rejoindre dans la tour de l'Église, mais ils ne répondirent pas au chant parce qu'ils ne savaient pas pour qui la belle se balançait.
fr_8959	"""Il faut que je garde ce feu allumé"" dit Tom en soufflant."
fr_8961	C’est dingue ce que deux pêcheurs ou plus peuvent s’apôtrer.
fr_8964	Les gens qui choisissent de ne pas manger vont vite devenir faimeux.
fr_8965	Si les mérinos disparaissent, c'est tout l'écosystème qui partira en quenouille.
fr_8969	Un bon boulanger se montre toujours à la hauteur ; c'est levain qu'il puisse faire.
fr_8970	Des solutions créatives appétissantes
fr_8983	Les pharmaciens sont élégants. Je dirais même qu'ils ont du cachet.
fr_9014	Je m'appelle Emmy Sion, je suis une vedette de télévision.
fr_9017	Elle n'était qu'une fille de fermier, mais c'était la plus grande experte en râteaux de la région.
fr_9030	""" Combien de temps devrai-je attendre pour une table ? "" demanda Tom sans réserve."
fr_9040	Pour travailler dans une boulangerie, Il faut savoir mettre la main à la pâte.
fr_9041	Après avoir acheté un feutre à son fils de deux ans, il est devenu un homme marqué.
fr_9045	Je suis allé voir la démolition du vieux salon de coiffure. C'était ébouriffant de les voir raser ce bâtiment.
fr_9046	"""Je ne veux pas utiliser de caméra grand angle"", conclut Toto, obtu."
fr_9048	Quel est le comble pour les salariés AirFrance ? D'être de mauvaise compagnie.
fr_9054	Si vous passez trop de temps dans le café, vous serez latte pour le travail.
fr_9060	Ce plat a un goût de plutonium, dit Tom, irradiant la joie.
fr_9061	Tout au long des siècles, les bergers bouddhistes du Pérou ont suivi leurs lamas de manière religieuse.
fr_9071	"""Ma fin est proche"" , dit Toto, la mort dans l'âme"
fr_9088	Les vieux couturiers ne meurent jamais, ils perdent juste le fil de la vie.
fr_9117	Un héritier est quelqu'un qui a une riche généalogie.
fr_9120	Lorsque les clients ont fini leur bière et que le serveur arrive, ils savent que le moment de verre oté est proche.
fr_9121	Sa longue carrière de terrassier l'avait laissé avec des opinions bien tranchées.
fr_9125	Un creuseur de fossés était retranché dans sa carrière
fr_9146	Je serai toujours ta biche murmura-t-elle, pensant combien elle était a-cerf-vie à ses charmes et sa puissance
fr_9148	La maladie, quelle qu'elle soient, n'est pas à espérer chez autrui. La santé est le premier devoir de la vie. C'est ce que je dis toujours à ton pauvre oncle, mais il n'a jamais l'air de vouloir m'écouter... ou du moins pas pour l'amélioration de sa santé.
fr_9152	Quand un prêtre fait une erreur à l'église, c'est une erreur d'écriture.
fr_9158	Est-ce que tu as entendu parlé de la nouvelle pinata ? Elle casse la baraque
fr_9160	es tu homosexuel ?' s'enquit Tom gaiement
fr_9164	J’ai appelé le zoo mais la ligne était occupée, ils auraient quand même puma-peler.
fr_9178	"Ce plat a goût de plutonium"", dit Tom, radieux"
fr_9191	"Il y a un nouveau feuilleton quotidien de TV avec des zombies. Ça s'appelle ""Plus Belle la Survie""."
fr_9203	Le paysagiste pensait que les magazines de jardinage étaient amusants à feuilleter.
fr_9206	Le cordonnier ne refusait rien à son apprenti. Il le recevait en grandes pompes.
fr_9211	J'aurais dû te prévenir plus tôt de castrer ton chien, mais mieux vaut bâtard que jamais.
fr_9239	J'ai trébuché en courant ce matin et maintenant le voisinnage se moque de moi... Il va me falloir un nouveau pied-à-terre.
fr_9249	Quand le réparateur de télévision s'est marié, la réception a été excellente.
fr_9251	Pourquoi la voiture est-elle gênée ? Parce qu’elle a des gaz dans le pot.
fr_9252	Suivez votre savoir-flair.
fr_9256	Pour certains, les exercices d'incendie sont alarmants.
fr_9262	Notre comm, votre licorne.
fr_9266	Un fossoyeur ne meurt jamais, seulement, il finit au trou.
fr_9295	"La police l'a arrêté pour avoir démembré ses colocs. Face à la presse, l'un a déclaré ""je suis scié"", l'autre, ""les bras m'en tombent""."
fr_9297	Une chronique sur l'astronomie dans la presse aurait beaucoup d'espace pour elle.
fr_9299	Camille déménagea à Little Italy : ils lui firent une gaufre qu'elle ne pouvait pas refuser.
fr_9305	Il est peut-être nécessaire de faire quelque chose, et en urgence. C'est bien sûr à réfléchir sérieusement.
fr_9306	Pour alimenter sa maison, Socrate installa des panneaux photo-volstoïques.
fr_9310	En hiver, certains chevaux ont le pur-sang chaud.
fr_9346	L'horloge somme de vous réveiller.
fr_9347	""" Quel beau miroir ! "" s'exclama Tom après réflexion."
fr_9350	Attacher un programme informatique à une chaise électrique, est-ce forcer l'exécution ?
fr_9360	Complimenter quelqu'un, c'est relâcher l'impression.
fr_9386	Le fait que les services de l'obstétricien étaient nécessaires dans le train était un accident de couchette.
fr_9399	Une vache m'a sauvé la vie hier, une véritable intervention bovine !
fr_9409	Je trouve que les coiffeurs sont aussi assez barbant.
fr_9421	Les blagues sur les banquiers, ça ne compte pas.
fr_9427	Fâchés, les deux maçons avaient monté entre eux un mur de silence.
fr_9433	"J'attends de voir le médecin"", dit Tom patiemment."
fr_9439	Les prisonniers sont des gens fermes.
fr_9441	Je te conseille de choisir une citrouille bien sphérique pour manger avec tes π de vache.
fr_9447	Peut-on dire d’un gentil hibou qu’il est chouette ?
fr_9454	Les taxidermists finissent rarement sur la paille.
fr_9456	La photo que j'ai prise de la tempête de sable s'est révélée grainée.
fr_9479	Mon chien fait beaucoup d'économies depuis qu'il fait ses courses au marché aux puces
fr_9515	T’as entendu parler du crime qui a eu lieu dans un parking souterrain ? Le coupable ne devait pas avoir la lumière à tous les étages.
fr_9520	Les mécaniciens musiciens composent des pièces… détachées.
fr_9546	Certains régimes font un bide.
fr_9548	Le mannequin qui est entré dans l'armée de l'air, c'était une vraie bombe !
fr_9555	Vous devriez enfermer votre vin dans un cabernet.
fr_9580	"""Je n'ai pas encore développé mes photos"", dit Tom de façon négative."
fr_9599	Je suis content de connaître la langage des signes, c'est toujours pratique d'avoir cette connaissance sous la main.
fr_9601	Un homme présenta son retriever au vétérinaire pour lui faire passer des examens et dû payer des frais de lab.
fr_9613	Docteur, que prendriez-vous pour un rhume ? - Je ne sais pas, faites moi une offre. Suivant.
fr_9627	Voulant acheter à sa petite amie un cadeau qu'elle apprécierait certainement, Bugs Bunny a décidé que quelque chose de l'ordre de vingt - quatre carats serait à peu près juste.
fr_9637	"Si vous êtes jardinier, on peut vous appeler ""directeur végétal""."
fr_9649	Après la lecture des évangiles, le prêtre entraîna ses oeuf-ailles dans une longue homé-lette.
fr_9650	Plongez dans un monde coloré.
fr_9670	"Un petit garçon appelait son père qui faisait des ballons ""pop""."
fr_9681	Les tuyauteurs ont souvent un travail sous haute pression.
fr_9682	Les vieux statisticiens ne meurent pas, mais sur la fin ils ne sont que moyennement vivants.
fr_9686	"""Ça nous fera un total de 144 ma grosse"", calcula Toto grossièrement"
fr_9694	Un coiffeur très occupé doit souvent se couper les cheveux en quatre.
fr_9705	Le géologue est allé voir le médecin car il avait une hématite.
fr_9710	Quand le canonball humain a pris sa retraite, ils n'ont pas pu trouver de remplacement du bon calibre.
fr_9719	Je suis aller pêcher hier mais tout ce que j'ai pu attraper, c'est un rhume.
fr_9724	Je m'appelle Manu. Je suis manucure.
fr_9726	Les vieux boulangers ne meurent pas, ils arrêtent juste de se faire du blé
fr_9736	Avant d'embaucher un cuisinier, ils l'ont grillé.
fr_9745	Les anciens porteurs de quiltes ne meurent jamais ils vont juste sous couvertures.
fr_9753	Les taxidermistes détestent qu'on leur bourre le crâne.
fr_9782	Je m'appelle Harmonie, je joue de l'harmonica
fr_9790	Rien de pire pour un artiste que de ne plus jouer devant un public d’ivrognes parce qu’on a pris de la bouteille.
fr_9812	"Voûté, Tom dit : ""C'est entre ma semelle et mon talon""."
fr_9821	Il est cloué par son nouvel emploi dans une usine de soudure.
fr_9827	Les anciens professeurs de math ne meurent jamais, ils ne peuvent juste plus différentier.
fr_9834	"""C'est là-dedans que je range mes flèches"", dit Tom avec un sourire carquois."
fr_9835	Apporte-moi un trampoline, et que ça saute !
fr_9841	L'inauguration de la statue a été une occasion monumentale.
fr_9845	Les deux astronautes ont mis fin à leur relation pour retrouver chacun leur espace.
fr_9851	Un vieux randonneur, ça ne meurt pas, ça fout/fiche le camp.
fr_9858	J'ai commencé à travailler dans un restaurant de fruit de mers, mais je pense démissionné parce que je n'aime pas le bulot.
fr_9863	Son travail laissait au verrier un regard vitreux
fr_9864	"""Votre rouleau compresseur est vraiment magnifique"" siffla Toto platement"
fr_9866	J'avais peur des obstacles, mais j'ai osé sauter le pas.
fr_9877	Si je lâche le plafond, il va s'effondrer, a soutenu Tom.
fr_9885	"""Ce film sera très populaire"", projeta Tom."
fr_9900	Ce paysagiste adore feuilleter des magazines de jardinage.
fr_9905	Un cuisinier chinois ne meurt jamais : il inwok son droit de retrait, c'est tout.
fr_9932	Il fait froid ici, ou ça vient de moi ?
fr_9944	Tu sais comment s'appelle ce jeu de cartes ? Toto demanda à un barbu
fr_9952	"""C'est depuis que j'ai perdu ma jambe que je bois tant"", a dit Tom."
fr_9959	Le propriétaire du salon de coiffure devait faire des coupes sur son personnel.
fr_9968	Un fossoyeur était au fond du trou quand il a dû faire une croix sur son emploi.
